,tweets,ano
849,"Seu Problema é Nosso: Sobre Trabalho, Bullying, Demissão e Seguir o Bail... https://invidious.lanterne-rouge.info/76TcI-yWkBU via @YouTube",2018
850,Tenho sofrido de bullying o dia todo no trabalho porque disse que não acredito em reviravoltas com o Bryan em campo...,2018
851,"acabei de ouvir a nova música da @pabllovittar! essa música serve de força para muita gente, foi feita com foco nos LGBTs, mas a mensagem é para todos aqueles que sofrem bullying, ou qualquer tipo de agressão/rejeição! Esse trabalho está de parábens....",2018
852,"Mudaram o balcão onde eu trabalho e ficou geral falando ""nossa, agora você alcança o balcão"", sofri bullying.",2018
853,"Hennely está fazendo um trabalho sobre bullying e preconceito e ela pediu a ajuda dos amigos. Daí a amiga dela chega e fala ""Fala daquele dia que eles queria me bater com a ripa"" KKKKKKKKKKKKKKKKK alguma coisa boa essa menina não fez",2018
854,"Live @marcos_harter  definições de live, almoço, salário, trabalho, App, nariz sem bullying. (… https://www.instagram.com/p/BhcZQT8BBIu/",2018
855,Adora fzr bullying com os outros — esse trabalho é de luiz mario KKKKKK https://curiouscat.me/Manu_Petito/post/400683892?1523476000,2018
856,Hj só fui no trabalho pra entregar o atestado e ja começaram com o bullying sobre o show da demi,2018
857,quando eu vejo esse apelido sendo tratado como um nome eu me sinto muito orgulhoso do meu árduo trabalho de bullying com o @oarthureduardo no ensino fundamental https://nitter.lanterne-rouge.info/victoriao_da_ma/status/983895757156646912,2018
858,"Acabei de assistir (o lindo trabalho) #Indestrutível da @pabllovittar com um nó enorme na garganta até lembrar de todo o preconceito e bullying que sofri na escola por ser lesb, daí caí em prantos, o nível dessa dor só entende que já sentiu 😭😭😭  https://invidious.lanterne-rouge.info/O8B72HzTuww",2018
859,"Gostei de um vídeo @YouTube invidious.lanterne-rouge.info/76TcI-yWkBU?aSeu Problema é Nosso: Sobre Trabalho, Bullying, Demissão e Seguir o Baile! |SPN|",2018
860,"a professora passou um trabalho pra gente fazer um cartaz com mensagens para pararem de praticar bullying, melhor trabalho do ano!! ❤️",2018
861,Esses dias teve uma palestra na escola Eu nao fui Aí esses dias a vice diretora foi na sala falando q quem n foi na palestra ia ter que fazer um trabalho sobre bullying de 15 fucking páginas manuscrito pra AMANHÃ,2018
862,"Tenho que apresentar um trabalho na quarta sobre bullying,e não vou negar que estou amando pesquisar sobre isso.",2018
863,"Eu não tive nem o meu primeiro dia no trabalho e já me botaram apelido, seria um record mundial do bullying??🤣🤣🤣",2018
864,"O projeto:"" Os multiplicadores de combate ao bullying"" desenvolveu mais uma ação. Desta vez o trabalho foi realizado na escola Vale do Guaporé e Sanária. O trabalho foi em parceria entre professores e alunos. O... https://www.facebook.com/jornal14emacao/posts/1797791453605679",2018
865,"justo no qual, todos somos responsáveis pelo amanhã e se cada um de nós dizer um pouquinho em suas casas, no seu trabalho, com seu vizinho, com seus amigos o movimento se fortalecerá e praticas como o bullying serão mais facilmente denunciadas e porque não dizer exterminadas.",2018
866,"Mesmo os protagonistas que são preparados mesmo para levar atividades culturais para as escolas, sofrem bullying, tem que fazer um trabalho com os alunos.",2018
867,"Sofrendo bullying no trabalho pq uso chinelo e meia, vê se pode",2018
868,"Sofro bullying no trabalho, isso é muito triste!! 😢😂",2018
869,"obg galera q fazia bullying comigo, o trabalho de vcs foi excepcional, meu emocional ta fudido pelas prox 3 décadas",2018
870,"Quem pratica o bullying é um inútil, e aqueles que fizeram isso comigo estão vendo como eu superei, todos infelizes, isso que eu escrevi é o que eu já passei, como é um trabalho creio eu que você poderá mostrar sua opinião",2018
871,"Você já sofreu bullying por ser cristã? Eu pergunto isso pq apesar de ser nova (15 anos) eu sou católica, trabalho nas pastorais e frequento a igreja constantemente, e sempre tem aquelas piadinhas ""vai virar feira hein""... Com já rolou algo do tipo?",2018
872,"gente, estou sofrendo bullying no trabalho por ter paladar infantil",2018
873,PROGRAMA DE PREVENÇÃO E COMBATE AO BULLYING E CYBERBULLYING  Iniciamos um trabalho que ira… https://www.instagram.com/p/BhOWreJAqcG/,2018
874,eu chamando os mlk pra entrevistar sobre bullying pra me ajudar no trabalho ai o primo do @lucaspunkz,2018
875,"Gostei de um vídeo @YouTube invidious.lanterne-rouge.info/76TcI-yWkBU?aSeu Problema é Nosso: Sobre Trabalho, Bullying, Demissão e Seguir o Baile! |SPN|",2018
876,"Seu Problema é Nosso: Sobre Trabalho, Bullying, Demissão e Seguir o Bail... https://invidious.lanterne-rouge.info/76TcI-yWkBU via @YouTube",2018
877,Sofro bullying dos meus colegas de trabalho por ser facilmente persuadida por vendedores de transporte público com histórias tristes.,2018
878,eu nasci pra sofrer bullying dos colegas de trabalho eh isto,2018
879,"quando a prof perguntar pq eu não fiz o trabalho, eu vou falar q fizeram bullying cmg e ninguém me quis em grupo nenhum",2018
880,"Sobre ficar grávidx... Expectativa: Nossa, vai ser lindo, vou comer, ser mimado e passar um tempo com os pés pro ar. Realidade: Rotina normal, pilhas de trabalho, reclamações, bullying generalizado, sintomas estranhos, ainda não bebi um copo de água hoje...  😪",2018
881,"Kkkkk falei que enquanto ele falava mal dos outros Marcos estava operando exercendo sua profissão,  colando seu trabalho a disposição para operar nariz e orelhas de pessoas sem condições financeiras e que sofrem bullying, com sua clínica no MT. Autorizado para operar fora do Br+",2018
882,sofrendo bullying no trabalho por usar um casaquinho de velho,2018
883,os filhos vão tudo sofrer bullying igual vc aqui no trabalho kkkkkkkkkkkkk,2018
884,E esse bullying diário dos colegas de trabalho por eu não gostar de futebol?!!,2018
885,"gente, eu preciso fazer um trabalho sobre bullying, se vcs puderem me ajudar contando experiências ou falando a opinião de vocês",2018
886,"Gostei de um vídeo @YouTube invidious.lanterne-rouge.info/76TcI-yWkBU?aSeu Problema é Nosso: Sobre Trabalho, Bullying, Demissão e Seguir o Baile! |SPN|",2018
887,"sim, eu não vejo mais o apelo do Alpino há muito tempo. dos chocolates deles eu gosto também do Sensação, sofro bullying no trabalho por isso porque todos dizem que é horrível hahahahahah",2018
888,"Gostei de um vídeo @YouTube invidious.lanterne-rouge.info/76TcI-yWkBU?aSeu Problema é Nosso: Sobre Trabalho, Bullying, Demissão e Seguir o Baile! |SPN|",2018
889,"Gostei de um vídeo @YouTube invidious.lanterne-rouge.info/76TcI-yWkBU?aSeu Problema é Nosso: Sobre Trabalho, Bullying, Demissão e Seguir o Baile! |SPN|",2018
890,Sofro bullying pq faço barulho cagando. Ae cagar no trabalho eh uma operação q envolve encontrar um banheiro q ngm vai. Ainda n entendi a concepção de cagar so cocô ploft sem ser acompanhado de 10 minutos de peido sinfônico,2018
891,"Trabalho realizado pelos alunos, exemplificando ações cotidianas referentes ao bullying, respeito ao próximo e ao professor. Parabéns! https://www.facebook.com/EducandarioSP/videos/1599277926808480/",2018
892,"Gostei de um vídeo @YouTube invidious.lanterne-rouge.info/76TcI-yWkBU?aSeu Problema é Nosso: Sobre Trabalho, Bullying, Demissão e Seguir o Baile! |SPN|",2018
893,"eis q vc e seus amigos de trabalho resolvem fazer um ""amigo oculto de chocolate"".... vanessa tira larissa e junto com o chocolate, tem uma carta... larissa se emociona antes de ver a carta..  a carta era uma receita de como emagrecer  tô passando mal até agora 😂😂😂😂😂 bullying",2018
894,"Vou sofrer bullying o resto do ano no trabalho por causa q fiz um escândalo quando roubaram meu diamante negro da caixa de bombom, até vídeo chorando fizerem 🤦🏼‍♀️",2018
895,"Gostei de um vídeo @YouTube invidious.lanterne-rouge.info/76TcI-yWkBU?aSeu Problema é Nosso: Sobre Trabalho, Bullying, Demissão e Seguir o Baile! |SPN|",2018
896,"Meu, nem fala dessa praga kkkkkkk vai que eu sofro bullying no meu próximo emprego por causa dela, ou pior nem arranjar trabalho por isso kkk",2018
897,"Gostei de um vídeo @YouTube invidious.lanterne-rouge.info/76TcI-yWkBU?aSeu Problema é Nosso: Sobre Trabalho, Bullying, Demissão e Seguir o Baile! |SPN|",2018
898,"Gostei de um vídeo @YouTube invidious.lanterne-rouge.info/76TcI-yWkBU?aSeu Problema é Nosso: Sobre Trabalho, Bullying, Demissão e Seguir o Baile! |SPN|",2018
899,mais romântico do que se apaixonar por um colega de escola faz bullying contigo??? acho que só se apaixonar pelo chefe de trabalho que te humilha diariamente *-*,2018
900,"Gostei de um vídeo @YouTube invidious.lanterne-rouge.info/76TcI-yWkBU?aSeu Problema é Nosso: Sobre Trabalho, Bullying, Demissão e Seguir o Baile! |SPN|",2018
901,"Gostei de um vídeo @YouTube invidious.lanterne-rouge.info/76TcI-yWkBU?aSeu Problema é Nosso: Sobre Trabalho, Bullying, Demissão e Seguir o Baile! |SPN|",2018
902,"Gostei de um vídeo @YouTube invidious.lanterne-rouge.info/76TcI-yWkBU?aSeu Problema é Nosso: Sobre Trabalho, Bullying, Demissão e Seguir o Baile! |SPN|",2018
903,"pessoa do mundo mano, vcs nao sabem o lixo q eu sou, nunca contei mas na escola eu meio que sofro “bullying” pelo meu jeito fisico e meu jeito de ser, eu nao consigo fazer trabalho escolar nao sei cada vez eu fico mais lenta, e minha familia ou seja minha mae e minha irma ficam",2018
904,"Gostei de um vídeo @YouTube invidious.lanterne-rouge.info/76TcI-yWkBU?aSeu Problema é Nosso: Sobre Trabalho, Bullying, Demissão e Seguir o Baile! |SPN|",2018
905,"Gostei de um vídeo @YouTube invidious.lanterne-rouge.info/76TcI-yWkBU?aSeu Problema é Nosso: Sobre Trabalho, Bullying, Demissão e Seguir o Baile! |SPN|",2018
906,"Gostei de um vídeo @YouTube invidious.lanterne-rouge.info/76TcI-yWkBU?aSeu Problema é Nosso: Sobre Trabalho, Bullying, Demissão e Seguir o Baile! |SPN|",2018
907,"Gostei de um vídeo @YouTube invidious.lanterne-rouge.info/76TcI-yWkBU?aSeu Problema é Nosso: Sobre Trabalho, Bullying, Demissão e Seguir o Baile! |SPN|",2018
908,"Gostei de um vídeo @YouTube invidious.lanterne-rouge.info/76TcI-yWkBU?aSeu Problema é Nosso: Sobre Trabalho, Bullying, Demissão e Seguir o Baile! |SPN|",2018
909,"Gostei de um vídeo @YouTube invidious.lanterne-rouge.info/76TcI-yWkBU?aSeu Problema é Nosso: Sobre Trabalho, Bullying, Demissão e Seguir o Baile! |SPN|",2018
910,"Gostei de um vídeo @YouTube invidious.lanterne-rouge.info/76TcI-yWkBU?aSeu Problema é Nosso: Sobre Trabalho, Bullying, Demissão e Seguir o Baile! |SPN|",2018
911,"Gostei de um vídeo @YouTube invidious.lanterne-rouge.info/76TcI-yWkBU?aSeu Problema é Nosso: Sobre Trabalho, Bullying, Demissão e Seguir o Baile! |SPN|",2018
912,"Gostei de um vídeo @YouTube invidious.lanterne-rouge.info/76TcI-yWkBU?aSeu Problema é Nosso: Sobre Trabalho, Bullying, Demissão e Seguir o Baile! |SPN|",2018
913,"Gostei de um vídeo @YouTube invidious.lanterne-rouge.info/76TcI-yWkBU?aSeu Problema é Nosso: Sobre Trabalho, Bullying, Demissão e Seguir o Baile! |SPN|",2018
914,"I liked a @YouTube video invidious.lanterne-rouge.info/76TcI-yWkBU?a Seu Problema é Nosso: Sobre Trabalho, Bullying, Demissão e Seguir o Baile! |SPN|",2018
915,Vamo combater o cyberbullying?  Vamo! Como?  Talvez se a gente printar os que fizeram bullying e não se dar ao trabalho de apagar o nick da vítima e expor ela ainda mais...,2018
916,"Gostei de um vídeo @YouTube invidious.lanterne-rouge.info/76TcI-yWkBU?aSeu Problema é Nosso: Sobre Trabalho, Bullying, Demissão e Seguir o Baile! |SPN|",2018
917,"Gostei de um vídeo @YouTube invidious.lanterne-rouge.info/76TcI-yWkBU?aSeu Problema é Nosso: Sobre Trabalho, Bullying, Demissão e Seguir o Baile! |SPN|",2018
918,"Gostei de um vídeo @YouTube invidious.lanterne-rouge.info/76TcI-yWkBU?aSeu Problema é Nosso: Sobre Trabalho, Bullying, Demissão e Seguir o Baile! |SPN|",2018
919,"Seu Problema é Nosso: Sobre Trabalho, Bullying, Demissão e Seguir o Baile! |SPN| https://invidious.lanterne-rouge.info/attribution_link?a=Acvxm5Ms8ZI&u=%2Fwatch%3Fv%3D76TcI-yWkBU%26feature%3Dshare",2018
920,"Gostei de um vídeo @YouTube invidious.lanterne-rouge.info/76TcI-yWkBU?aSeu Problema é Nosso: Sobre Trabalho, Bullying, Demissão e Seguir o Baile! |SPN|",2018
921,"Gostei de um vídeo @YouTube invidious.lanterne-rouge.info/76TcI-yWkBU?aSeu Problema é Nosso: Sobre Trabalho, Bullying, Demissão e Seguir o Baile! |SPN|",2018
922,"Gostei de um vídeo @YouTube invidious.lanterne-rouge.info/76TcI-yWkBU?aSeu Problema é Nosso: Sobre Trabalho, Bullying, Demissão e Seguir o Baile! |SPN|",2018
923,"Gostei de um vídeo @YouTube invidious.lanterne-rouge.info/76TcI-yWkBU?aSeu Problema é Nosso: Sobre Trabalho, Bullying, Demissão e Seguir o Baile! |SPN|",2018
924,"Gostei de um vídeo @YouTube invidious.lanterne-rouge.info/76TcI-yWkBU?aSeu Problema é Nosso: Sobre Trabalho, Bullying, Demissão e Seguir o Baile! |SPN|",2018
925,"Gostei de um vídeo do @YouTube invidious.lanterne-rouge.info/76TcI-yWkBU?a Seu Problema é Nosso: Sobre Trabalho, Bullying, Demissão e Seguir o Baile!",2018
926,"Gostei de um vídeo @YouTube invidious.lanterne-rouge.info/76TcI-yWkBU?aSeu Problema é Nosso: Sobre Trabalho, Bullying, Demissão e Seguir o Baile! |SPN|",2018
927,"Gostei de um vídeo @YouTube invidious.lanterne-rouge.info/76TcI-yWkBU?aSeu Problema é Nosso: Sobre Trabalho, Bullying, Demissão e Seguir o Baile! |SPN|",2018
928,"Gostei de um vídeo @YouTube invidious.lanterne-rouge.info/76TcI-yWkBU?aSeu Problema é Nosso: Sobre Trabalho, Bullying, Demissão e Seguir o Baile! |SPN|",2018
929,"Tem um professor gordo aqui no trabalho e o que os outros professores fazem com ele todo dia? Isso mesmo, bullying",2018
930,ne não fica fazendo bullying com as colegas de trabalho,2018
931,Meu trabalho da facul é sobre bullying,2018
932,"Para, eu tô orgulhoso do meu trabalho com o @deusdamadeirada , nem todo bullying do mundo me tira isso...",2018
933,"imagino vc escrevendo um livro ""bullying no ambiente de trabalho e como lidar com ele""",2018
934,Eu sofro bullying no trabalho do meu próprio chefe :(,2018
935,vocês támbem esquecem que são adultos e tem medo de sofrer bullying pelos colegas de trabalho?,2018
936,Bullying entre adultos no trabalho https://ift.tt/2Gbkgss,2018
937,Fora que já estou sofrendo bullying no trabalho kkk só porque eu esqueci a panela de pressão ligada no fogo e sai pra ir trabalhar kkkk,2018
938,"Daora que a minha prof de português deu um trabalho em grupo Que é fazer uma crônica  E nesse grupo em que eu estou nos estamos copiando a historia de Koe no Katachi e passando pra folha, falando sobre bullying  Que eu saiba só nós 3 vimos Koe no Katachi naquela sala",2018
939,Menino Na turma um menino franzino e tímido sempre sofria bullying. Um dia pegou o objeto de trabalho do pai e foi para a escola. BUM! O pai era policial.   Miniconto - Sophia Sardinha,2018
940,"Po, fala um pouco ai sobre o seu trabalho. fiquei curiosa — eu sou pago pra fazer bullying e segurar animais https://curiouscat.me/GLXXBXR/post/368110305?1521857933",2018
941,Hoje o dia foi de trabalho... Iniciamos na escola Vitalina Motta a Semana de combate ao Bullying. Levar conhecimento aos alunos nunca é demais... ❤️❤️❤️,2018
942,O número de profissionais que praticam bullying com colegas de trabalho e forjam uma personalidade para chegar ao topo é assustador. Entenda como essas pessoas conseguem cargos de liderança e saiba como evitar que isso aconteça. Baixe nosso conteúdo: hoganbrasil.com.br/e-books/d…,2018
943,"bullying do futuro:  e sua mãe q fazia trabalho pros amiguinhos por 5 reais desculpa filhos, vcs vão ouvir isso",2018
944,Fiz o cartaz do bullying da minha irmã enquanto ela fazia o meu trabalho pra mim,2018
945,"Mano eu sofro bullying no trabalho, com a mh miuda, até no meu grupo de amigos, eu juro",2018
946,E eu que achava que não tinha bullying em nossa escola. Vamos fazer um trabalho sério pra ver se acabamos com isso?,2018
947,"To sofrendo bullying no trabalho, já ganhei 2 desses hoje",2018
948,Eu sofro bullying no ambiente de trabalho,2018
949,"Eu, vítima de bullying no grupo do trabalho. Percebi que PRECISO de um mousepad bonitinho para minha alegria",2018
950,Trabalho de Psicologia Educacional/Escolar  Dinâmica sobre bullying  Turma: 7º Ano  21/03/2018,2018
951,Trabalho de psicologia educacional/escolar Tema: bullying  Turma: 8º Ano   21/03/2018,2018
952,"não fazem bullying comigo, só me ignoram mesmo tenho, mas preciso de comprovante que trabalho ou coisa assim, mas de qlqr jeito não vai mudar muita coisa",2018
953,Sofro bullying até no grupo do trabalho 😂😂,2018
954,"Esse caso Marielle Franco virou uma disputa horrível sobre opiniões, pessoais e uma triste realidade é que estão mostrando cada vez mais  bullying e preconceitos. Cadê o respeito com o seu trabalho e trajetória. Eu não a conhecia e li e formei opinião. Sinto muito q ela se foi!!",2018
955,Sofrendo bullying no trabalho,2018
956,"Passei a infância inteira sofrendo bullying, chego na vida adulta e sofro bullying até no trabalho. Pqp",2018
957,"Yep. Depois de velha as pessoas (adultas?) vem mexer com minhas inseguranças. Nunca sofri bullying no colegio, mas acabei de me tocar que sofro isso no trabalho. A vida não é engraçada?",2018
958,"Ah, existe. Gente que não come mel porque tá explorando o trabalho das abelhas são um exemplo de politização  Bullying não é, é ódio de classe mesmo porque pequeno burguês eu passo longe",2018
959,"Sofri bullying no trabalho hoje pelo meu salário e PPR, prefiro quando recebo carinhos",2018
960,"Quando Glauco tinha uns 12 anos teve um trabalho de inglês para levar seu artista preferido e ele levou uma foto da Gwen Stefani e a letra da música preferida dele. Agora imaginem o bullying que esse menino sofreu esse dia. Detalhe, ele é hétero hahahahaha.",2018
961,"trabalho em grupo é dor de cabeça demais séloko e em arquitetura tem o agravante de muito leite com pera arrogante, o professor sofria bullying de um grupinho lá e deu o texto mais difícil pra esse grupo, apresentei meu seminário no começo da aula e ri fininho o resto dela",2018
962,"Trabalho de Psicologia Educacional/Escolar   Tema trabalhado: Bullying Turmas participantes: 6º Ano, 4º Ano e 5º Ano",2018
963,"- pesquisa para o meu trabalho do colégio.  girls, minhas princesas, dentro do colégio vcs já sofreram algum tipo de bullying sexual/abuso sexual de algum garoto? Como por exemplo eles tocarem a sua bunda sem consentimento. Podem dar + exemplos citando ou comentando o tweet pfvr",2018
964,Esse trabalho foi o início de um bullying eterno,2018
965,Lembrando q o Lupin não apenas sofreu bullying como tb não conseguia trabalho por conta de sua condição tendo sido sustentado pelo pai do Harry por boa parte da vida . E nunca descontou em ng .,2018
966,o que é cyber bullying seu preto lazarento? — é a parte do trabalho que você deveria estar fazendo otario https://curiouscat.me/brenogabr/post/355306099?1520989629,2018
967,Sofro bullying dos meus colegas de trabalho,2018
968,SOFRO BULLYING NO TRABALHO SOCORRO AUTORIDADES,2018
969,Eu sofro bullying demais no trabalho pqp kkkkkkkkkkkkk,2018
970,"Eu sofro bullying aqui no trabalho, essas garotas só sabem gastar minha onda kkkkkkkk",2018
971,Acho que meu trabalho de sociologia sobre bullying ficou mt bom,2018
972,Sofrer bullying no trabalho já faz parte das tarefas de rotina 😥,2018
973,"Fui perceber a existência destes demônios brasileiros quando percebi muitos deles tentando clamar a vida alheia, por bully, music constante e que canta o anus masculino, paranoia das drogas, bullying na escola, trabalho e por vizinhos tentando destruir todas as atmosferas",2018
974,"tinha na tl alguém falando de au 2jae e achei q fosse esse do bullying mas era outro aí eu fui ver é esse outro era um típico esteriótipo do jaebum filho da puta, nem me dou o trabalho de ler isso pq é ridículo",2018
975,Comecei a assistir #ChoquedeCulturaNoEIGames aqui no trabalho.! Tô sofrendo bullying pq é Mario kart.,2018
976,"Bullying: ""A única arma capaz de combater a violência é a inteligência."" Nagib Anderáos Neto - https://goo.gl/EjHeeZ https://www.facebook.com/CRENeurologico/ #CREN #Psicoterapia #Bullying #Trabalho #Saúde",2018
977,sofrendo bullying no trabalho por falar o portugues do jeito certo,2018
978,as críticas ao bullying e abuso de hierarquia no mercado de trabalho eu amei demais,2018
979,Sofro bullying no trabalho por isso 😂😂😂,2018
980,Vcs tbm sofrem bullying no trabalho?,2018
981,"mudei o tema do trabalho, fiz sobre bullying  n sei se ficou mt bom, espero q tenha ficado",2018
982,"Gente, eu tô fazendo um trabalho de escola com o tema bullying, é preciso contar um relato sobre o assunto. Se alguém já sofreu/sofre bullying ou conhece alguém, me chama na dm e me conta a sua história, e se me permitir eu coloco no meu trabalho a história.",2018
983,"hoje é dia internacional de TODAS as mulheres que resistem todos os dias nos seus ambientes de trabalho, nas favelas, no transporte público, nas cadeias. das que sobreviveram ao bullying, das negras, gordas, lésbicas, trans! que nossa diversidade seja nossa maior riqueza na luta",2018
984,"verdade, meu filho sofre esse tipo de bullying no trabalho dele, ele é o único por lá que está na universidade",2018
985,"Mobbing, bullying e stalking: que tipo de assédio moral você já sofreu no trabalho? Leia mais AQUI ➡️ https://goo.gl/iV2ZST",2018
986,Tô com saudade até do bullying que eu sofria no trabalho por só tomar café com leite morno,2018
987,"Tava indo tudo bem no trabalho até eu ouvir a entrevista da Lu Andrade da banda Rouge na Gaúcha...   Eu sou eternamente a bebe desse lugar. Hahahha  Aí eu soltei: ""quando eu era criança"" estou sofrendo bullying",2018
988,"Fica o dia todo na internet falando que bullying é errado que não pode julgar e tudo mais, pra chegar no colégio/faculdade/trabalho ficar dando risadinha das pessoas e apontando pra elas quando não se encaixam no “suposto” padrão da sociedade! Quanta hipocrisia",2018
989,"“a vitoria come terrores, boca nervosa” “serio? Mas n parece” “serio é so olhar p pança dela” to sofrendo bullying no trabalho ah pronto",2018
990,sofro bullying no trabalho por gostar de guilherme arantes e ficar cantarolando o dia todo,2018
991,Estou impressionada com esse bullying que tao fazendo cmg no grupo do trabalho,2018
992,"Muito importante esse assunto... Lembrei de um trabalho que fiz sobre Bullying e suas consequências na sociedade, fiquei nervosa porque a sala estava lotada de gente, mas foi maneiro demais ver a galera interessada no assunto e participando",2018
993,"Acho que todo mundo que não se encaixa em um""padrão"" que é imposto pelo ambiente em que se vive, sofre bullying. Seja na escola, seja no trabalho, seja na família, enfim..ser diferente parece que incomoda o outro.",2018
994,"Bullying geralmente inicia em casa, e  uma forma de expor era fazer o mesmo na escola.hoje eu professora de educação infantil trabalho isso direto com meus pequenos.nao quero ver neles o que passei quando criança 😘  @EncontroFatima",2018
995,"O bullying criou sequelas pra vida toda, ate hoje faço terapia para ajustar a minha personalidade, mas influenciou bem meu trabalho e hoje tenho um projeto social para combater o bullying #Encontro",2018
996,"Já fiz um trabalho sobre Bullying e suas consequências na sociedade, é muito mais do que parece... É assunto de saúde pública   GiovannaGrigioNoEncontro",2018
997,Vendo o encontro aqui no trabalho e  esses relatos de bullying me fazem tanto lembrar dos meus 11 anos..,2018
998,Sofro bullying até hoje ... no trabalho na escola deixei de fazer uma faculdade por causa bullying sou obesa e brigo contra meu peso e as vezes brigo até comigo mesma 😔 #Encontro,2018
999,Nao gostei era demasiado bullying! UMA PESSOA NÃO PODE FAZER UM TRABALHO QUE VÃO LOGO CASAR!!!,2018
1000,#divulgando um ótimo trabalho sobre #bullying https://fb.me/TdTI2B61,2018
1001,"Mas,há algo em sua escola que apenas influencia sua tristeza; O Bullying. Todo dia ele chega em casa completamente machucado,mas,não há formas de comunicar; Seus pais não são presentes,vivem viajando a trabalho. É muito tímido e não consegue falar nem com os colegas de classe",2018
1002,na faculdade não existe bullying existe trabalho em grupo que é mil vezes pior,2018
1003,Gente tenho um trabalho de redação kkkkkk nao sei se faço lgbt ou bullying ou preconceito religioso... Duvida cruelll,2018
1004,"E o pior, entrar pra ""lista negra” e sofrer bullying e represálias (com chefes omissos).",2018
1005,Bora encarar mais um sábado de trabalho com um sorriso no rosto e fingir que está tudo bem não estou sofrendo bullying.,2018
1006,"Jesus!!! Isso choca mesmo a gente! Vou te falar que sou muuuito capaz de fazer isso! A minha memória é péssima, já sofri bullying por causa disso no trabalho... rs",2018
1007,To divulgando seu trabalho n dá p falar q vc taz bullying c todo mundo,2018
1008,"Sim, mas é o que muitas vezes acontece, fiz um trabalho sobre o Bullying e suas causas na sociedade, tive que ler muito relatos, era dia após dia lendo cada coisa que sério me fizeram lembrar de coisas que aconteceram comigo e relatos eram sobre tirar a força pessoas de Nárnia",2018
1009,"Esse cc é puro bullying, vai arranjar um emprego cara — Já trabalho https://curiouscat.me/CcGaropaba/post/342113866?1519999361",2018
