,tweets,ano
0,"Eu também pretendo abordar de forma diferente nos workshops que fazemos no trabalho, eu odeio ver o pessoal tratando racismo como bullying",2018
1,li um texto tão triste de uma bolsista prouni de medicina. o bullying com pobre é real até em federal e em outros cursos. no meu 1o semestre de engenharia química um grupo (de pessoas da zona sul) com o qual fazia trabalho resolveu me excluir do nd pq não queriam mais contato cmg,2018
2,"Leo colocou pão dentro da minha calça, até no trabalho eu sofro bullying",2018
3,"Tentei me afastar na adolescência e foi sofrido. Foram anos infelizes. Eu tinha vergonha de gostar dessas coisas, sofria muito bullying principalmente da família. E as vezes até fico dias sem ver nada por rotina ou trabalho, mas largar meses? Não aguento, morro de saudades.",2018
4,to lendo uma fic q o jooheon faz bullying todo santo dia c o minhyuk dai numa festa ele quase implora por um beijo do minhyuk (q dá pq do NADA o medo dele se transforma em tesao) e ai no dia seguinte o professor coloca eles pra fazer um trabalho juntos ㅋㅋㅋ,2018
5,"Desde pequeno trabalhando igual um escravo, só tinha minha mãe e minha irmã  ao meu lado, nunca ganhei nada, smp trabalhei pra ter minhas coisas, fui o homem de casa aos 14 anos, nunca deixei faltar nada pra minha família. Sofri bullying tanto na escola quanto no trabalho.",2018
6,estou sofrendo bullying no trabalho,2018
7,Sofrendo bullying no trabalho por comer saudável,2018
8,vou fazer 20 e ainda sou kpopper serase vou sofrer bullying no trabalho?,2018
9,"Objetivo: Defenda alguém que está sofrendo bullying na escola ou no trabalho. Lembre a si mesmo e aos outros do quanto as palavras podem ser poderosas. E quando estiver falando com outras pessoas, escolha as palavras com cuidado.",2018
10,"Sei lá, depois que eu fui denunciada por bullying pela minha colega de trabalho nada mais faz sentido",2018
11,"O resto da matéria é igualmente absurdo. Ele fala que tem uma galera muito sensível que fica se vitimizando e fala muita groselha sobre bullying.  Sorte que esse sr não escreve mais nada, o trabalho é de roteiristas que têm uma visão um pouco menos torta da sociedade.",2018
12,"espero realmente que você reveja esse seu tweet. Soou uma mensagem bem infantil e indelicada. Qual o problema de gostar da própria imagem? Ruim é ficar praticando bullying, não se aceitar... Gosto do seu trabalho, mas achei essa mensagem grosseira.",2018
13,"Pior que eu vejo bastante relato de gente que ostraciza o outro porque ele é gay. Do tipo de ignorar no trabalho ou mesmo fazer bullying na escola. Tem muito gente que é tipo “o que você faz em quatro paredes não me importa”, mas tem sempre ~aquele grupo~",2018
14,"a monica então, ela sempre foi desprezada pelos pais, superou a obesidade e o bullying, tem que lidar com seu TOC, se dedicou demais ao trabalho e sempre cresceu por mérito próprio, sempre foi independente, forte e madura mas também maternal e sonhadora, ícone!!!",2018
15,sofrendo bullying no trabalho pois colocaram varias camisinhas na minha mesa,2018
16,"Lembram quando eu disse que sofria bullying no trabalho por usar demais o bloco de notas? Pois bem, o meu anjo da vida e colega de trabalho @jessic_aaa me presentou neste Natal com essa linda camiseta exclusiva ❤️",2018
17,Eu sofro bullying no trabalho por ser a única que não tem,2018
18,sofrendo bullying no trabalho pq to de ressaca,2018
19,"Minha colega de trabalho fez uma ouvidoria contra mim, porque aparentemente eu faço bullying com ela",2018
20,"Bullying não é brincadeira! E Paul McCartney se engajou na campanha contra esse tipo de comportamento. O ex-Beatle se juntou à atriz Emma Stone no vídeo de sua nova música de trabalho, ""Who Cares"", para fazer um alerta.   Confira o vídeo: https://www.youtube.com/watch?v=7WOb6ePqjIE",2018
21,Aqui no trabalho essas estrelinhas renderam até um bullying.....,2018
22,Sofro bullying pela altura até no trabalho,2018
23,"Nunca tinha ouvido falar nessa garota, esse nome é “ artístico “ ou é seu nome legal? Se for legal, ela precisa processar os pais pq pqp só o nome dela já é bullying. A Kefede precisa arrumar um trabalho de verdade e parar de mi mi mim.",2018
24,"Recebi agora o livro ""Bullying, a consciência é a melhor forma de previnir"". PARABENIZO a autora Juliana Munaretti de Oliveira Barbieri pelo excelente trabalho. Obrigado! https://www.instagram.com/p/BriZhzag6Vu/ https://www.facebook.com/pastorronaldoviana/posts/2249026205117200",2018
25,"Olhaa nem nas férias vocês param de me fazer bullying, não aprenderam nada com o trabalho que fizemos para português, agora vou chorar o resto da noite !!",2018
26,Toda S/N : -Sofre bullying por ser feia. -Os pais morrem em acidente de carro ou se muda para a Coréia por causa de trabalho deles -pais. -Não gostava do cara mais popular da escola e namora ele depois de 2 meses. #tiposdefic S/N se tu não gosta da tua vida...dá pra mim.,2018
27,"Eu estudei por dez anos. Não quis apresentar um trabalho valendo a última nota porque tinha que falar em público e tal e eu não queria   me expor já que sofria um bullying danado. Resultado: fiquei de final. A professora passou o mesmo trabalho, só que dessa vez só escrito. Ufa!",2018
28,"minhas colegas tão fazendo bullying cmg no trabalho, me chamando de Shakira loca 😤",2018
29,Faltou pedir desculpas por não ter feito o trabalho de pesquisa antes e por ofender a vítima atingida pelo bullying.,2018
30,Há um novo tipo de bullying que assola os profissionais gestores de projetos e serviços: o bullying esferográfico gravitacional. Fique atento. Se você está em uma reunião ou em uma sessão de trabalho e as... https://www.facebook.com/elcio.goncalves.902/posts/2370899202982725,2018
31,o maior bullying foi minha mãe pedir se o departamento que eu trabalho vai fazer amigo secreto,2018
32,Sofri bullying de proletarios pq perguntei quantas vezes pode falta no trabalho tipo quantos % de presença precisa ter e oh boy...,2018
33,"Galera posso pedir uma coisa a vocês ? NUNCA façam bullying com o corpo das pessoas SERIO! Eu trabalho diretamente ligada com o público (DIVERSO) e tem um cliente que é um amor em pessoas,e ele está a cima do peso,já tentou emagrecer mas não consegue (psicológico abalado)",2018
34,"Você pode ver até a Globo tentando polemizar e se dando mal quando se fala nessas questão de humilhação no trabalho. Até homem se ferra la, eu mesmo sofri bullying na escola por ser um fraco. Agora, na rua, você vê homens olhando mulheres e mulheres olhando homens",2018
35,"Eu trabalho num lar e muitas vezes penso como serei com 85 anos num lar a serio, imaginem eu no quarto a jogar gta 20 na ps40 a ouvir eminem e a fazer bullying com os outros velhos",2018
36,"Falaram de diversos assuntos, como o empoderamento feminino, racismo, bullying, homofobia ♡  E falando em esmurro um dos integrantes desse trabalho se homofobia era bolsominion, só que ele não conseguiu trocar de grupo pois os grupos tavam certinhos, ele se recusou a falar bicho",2018
37,"hoje vi uma menina que praticava bullying comigo no segundo ano do ensino médio, eu estava no trabalho e ela simplesmente chegou para comprar ração. assim que olhei pra ela meu corpo todo ficou mole, minha maior vontade era a de entrar no banheiro e chorar.",2018
38,Sofrendo bullying no trabalho por preferir panetone do que chocotone kkkkkkkkkkk,2018
39,"#educacaodomal  Esses VAGABUNDOS (a), trajados de gestores e até de professores, que usam crianças para manipular o Ideb, praticam assédio moral  com colegas de trabalho e bullying com alunos de 3 anos até os... https://www.facebook.com/wellingtonmacedos/videos/981247005418301/",2018
40,"#educacaodomal  Esses VAGABUNDOS (a), trajados de gestores e até de professores, que usam crianças para manipular o Ideb, praticam assédio moral  com colegas de trabalho e bullying com… https://www.instagram.com/p/BrRT7QIgZQl/?utm_source=ig_twitter_share&igshid=nx4rchmh2n5m",2018
41,O bullying existe até no trabalho kkkkk #TercaDetremuraSDV,2018
42,sofro bullying no trabalho por nunca ter assistido,2018
43,"Eu queria mt dar os parabens para as pessoas q fizeram bullying cmg,fizeram um ótimo trabalho,acabaram com o meu psicológico e me tornaram uma pessoa crua por fora e q sente mt coisa por dentro,ms ñ consegue demonstrar na maioria das vezes",2018
44,Meu pai tá sofrendo bullying dos amigos do trabalho pq a minha madrasta tá fazendo ele tomar suco detox  Kkkkkkkkkkkkkkkkkkkkkkk,2018
45,"Eu fico puta da cara Pq ainda tem pais q ensinam os filhos a terem preconceito. E isto vem d bem cedo,independente da ideologia q gostam tanto d falar,professores estão la p defenderem alunos q sofrem bullying tbm. E o trabalho deles é gigante perante as famílias ausentes.",2018
46,"Eu sofro bullying no trabalho por ser baixinha demais, triste",2018
47,-nossa eu amo comer -sério? não parece  todo dia um bullying diferente no trabalho kkkkkkkjk,2018
48,"Cheguei ao ponto da minha vida de sofrer bullying por às vezes usar um português ""requintado"" (por causa do costume da escrita no trabalho) em conversas informais nos grupos do whatsapp",2018
49,"Sofro bullying no trabalho pq todo mundo sempre recebe os cupons de desconto no almoço do @iFood menos euzinha, cliente fiel. Queria saber o preconceito 💔",2018
50,sofrendo bullying no trabalho por não namorar e ir sozinha na festa da empresa,2018
51,"Tive q fazer um trabalho, q a gente criou um jogo sobre convivência e pá, e jogamos com o quinto ano. Aí uma das perguntas do jogo do meu grupo era “oq vc faz se vê seu amigo sofrendo bullying?” Aí uma menina respondeu “Eu n faço nada, não gosto de criança, só gosto de mim” HAHAH",2018
52,São Tiago adora praticar bullying com os alunos  ficam fazendo nós apresentar trabalho pra outras turmas baaaaah,2018
53,"ser a mais nova da tua equipe de trabalho é só Deus na causa, cada dia é um bullying novo tl",2018
54,Eu sofrendo bullying pq durmo no trabalho,2018
55,Bullying no trabalho associa-se a maior risco de complicações cardiovasculares dlvr.it/QsvLnX,2018
56,almoçando na mesa do trabalho aí começa dizendo que hetero não se pega em lugar público e que gay quer direito que ninguém mais tem aí PROFESSORES dizendo que bullying não existe,2018
57,teve uma vez tb q eu joguei uma garrafinha dagua num guri q fazia bullying cmg dai ele foi reclamar na diretoria e EU tive q fazer um trabalho falando q bullying eh feio.. escola eh um lixo,2018
58,"Minha escola é péssima em questão das pessoas realizarem o trabalho direito Coordenadora educacional que passa pano pra bullying, monitor que não sabe ver horário, professor incentivando bullying",2018
59,"Meu deus, o Baidu sofre bullying até no trabalho?",2018
60,"ALINE SOU SUA FÃ :3  Eu sofria bullying calada...  E a única vez q fui pra diretoria foi porque uma garota me encheu o saco poe causa de uma pasta do trabalho e mandei ela tomar no cu. A escola era católica, rs.",2018
61,Parte mais difícil do meu trabalho e falar que já quis me matar por causa do bullying,2018
62,Isso que fez trabalho sobre o Bullying né,2018
63,Nao quero fazer um trabalho sobre Bullying!!,2018
64,"No ápice do novo trabalho, o compositor tensiona as questões contemporâneas de espionagem, solidão e bullying.",2018
65,Sofro bullying com essas garotas do trabalho kkkkk,2018
66,"O Biff é supervisor dele. Não sei se o assédio acontece NO trabalho, mas George deixa claro que não pode revidar o bullying pq ele é superior dele.",2018
67,"amanhã vai rolar um futebol da galera do trabalho, SÓ eu de BR E 3 MANO, TRÊS ALEMÃES... vcs não tem noção do bullying, mas vou fazer o possível pra vingar a gente",2018
68,Bullying no trabalho está associado a maior risco cardiovascular https://ift.tt/2rgm8ue,2018
69,"Hoje no trabalho:  -Luis, escolhe uma música aí! -Poe Cara Estranho dos Los Hermanos  Todos respondem: AI NOSSA, COMO ASSIM NAO CREIO ESSA NÃO!  O bullying é real e me persegue!",2018
70,e mereci mesmo pq eu trabalho e não fico o dia inteiro no twitter venerando quem faz apologia ao bullying,2018
71,"Só agora disseram q o sushiman sofreu bullying dos colegas de trabalho, q n gostavam muito dele pelas promoções q teve no emprego. Um caso de inveja q terminou em surto e morte, pelo despreparo da polícia. #jornalhoje",2018
72,"Na noite dessa quinta-feira, 29, o projeto Help fez um trabalho de conscientização sobre automutilação, bullying, depressão e suicídio na escola Escola Alvino Pereira Rocha, em Rio Verde,… https://www.instagram.com/p/BqziADLh26J/?utm_source=ig_twitter_share&igshid=15gnlzjvlm75l",2018
73,"Na noite dessa quinta-feira, 29, o projeto Help fez um trabalho de conscientização sobre automutilação, bullying, depressão e suicídio na escola Escola Alvino Pereira Rocha, em Rio Verde, Goiás.  Esse trabalho... https://www.facebook.com/170762763103772/posts/1055006234679416/",2018
74,"Na noite dessa quinta-feira, 29, o projeto Help fez um trabalho de conscientização sobre automutilação, bullying, depressão e suicídio na escola Escola Alvino Pereira Rocha, em Rio Verde,… https://www.instagram.com/p/Bqzh5D0lifg/?utm_source=ig_twitter_share&igshid=1llpotoqdnu0l",2018
75,"@ascampello reclama de cobrança e Bullying em horário de trabalho, perseguição e etc. Escuta aqui Bonitao eu sofro com @vasco no trabalho, na faculdade, na escola da minha filha, em casa na rua  e tudo culpa sua e você quer se isentar? #foracampello",2018
76,"conclusão: não sofro bullying no grupo, mas a vida faz esse trabalho pra vocês",2018
77,"este tipo de coisas devia ser sancionado perante a lei, e nao digo só nestes casos! qualquer caso de bullying, ódio e desrespeito pela liberdade de outro que chegue a niveis tão vergonhosos devia ser sancionado... e mais duas palavras: trabalho comunitário.",2018
78,"Smurf, mão pequena, a baixa, Mike Wazowski  Lucas e Ana Júlia praticaram bullying comigo no trabalho hoje",2018
79,Jornalista pernambucana muda de nome após sofrer bullying no trabalho. Entenda o caso: https://bit.ly/2PXZHIR,2018
80,sofrendo bullying por parte dos meus colegas de trabalho porque falei que odeio chuva,2018
81,"Se você trabalha em uma empresa, pode ter sofrido, estar sofrendo ou vir a ser vítima de bullying no trabalho. Veja como agir nos casos de bullying no trabalho. #bullying #assediomoral gosto-disto.com/2018/11/bull…",2018
82,Ceis TB sofrem bullying no trabalho de vcs pq demoram quando vão ao banheiro? Eu sofro...,2018
83,"eu sofro tanto bullying com a Sara no trabalho, ai que crlh",2018
84,Minha irmã tá sofrendo bullying das colegas dela de trabalho pq ela tá fazendo um ótimo trabalho,2018
85,Bullying no trabalho por causa do meu tamanho...  ATÉ QUANDO?????!?!?!! 🙄,2018
86,"Tenho 27 anos, me livrei do bullying da escola e agora tenho o do trabalho.",2018
87,cultura hetero no meu trabalho é bullying,2018
88,As colegas de trabalho de vcs tb fazem bullying com vocês?  🤦🏻‍♀️,2018
89,Colégio Universitário realizou trabalho sobre “Bullying e Drogas” https://bit.ly/2DZeWei,2018
90,"Sofri bullying na escola até ter que mudar de escola, mas enfim se for contar tudo dá um livro. Só queria te dizer que só cabe a você mudar isso e se aceitar, não é um trabalho fácil e não é da noite para o dia. Ignorar os olhares, as falas maldosas, ligar o foda-se",2018
91,Os caras não esperam nem eu chegar no trabalho pra começar o bullying,2018
92,Pesquisa mostra relação entre bullying no ambiente de trabalho e doenças cardiovasculares. Saiba mais no nosso site.  #LetraseLucros https://letraselucros.com/pesquisa-mostra-relacao-entre-bullying-no-ambiente-de-trabalho-e-doencas-cardiovasculares/,2018
93,"Mas tem famoso que faz projetos sociais para prevenir o bullying em escolas e ambientes de trabalho o que eu acho ótimo.  Eu mesmo faço ações, mas não sou ninguém, só uso a minha má experiência com Bullying para evitar q outros sofram também.",2018
94,"Não mais do q eu por vc e de quem levanta a bandeira da hipocrisia, do machismo, do assédio, do bullying, da perseguição no trabalho....",2018
95,"Eu sou fã.... como vc disse.... não estou no meu trabalho em rede nacional fazendo bullying com ela.....  e mesmo se fosse com ela seria injusto, pq ser humano nenhum deve passar por situações vexatórias consecutivas..... isso causa um buraco enorme na alma.... acredite!",2018
96,"a maior e melhor vingança é ter se tornando linda e o pessoal do ensino médio ficar “ai nossa como vc tá lindo” ... engraçado né, na escola fazia tanto bullying que eu tinha vergonha de apresentar trabalho na frente da sala e sempre tinha crise de pânico, hoje dão em cima",2018
97,"Não seja cruel. Eu estava tão convicto de que as praxes, o bullying na escola, no trabalho, a violência doméstica, o meninos que sem razão aparente puxam os cabelos a arranham o colega, a discriminação das mulheres eram formas de crueldade mas afinal são apenas dinâmicas sociais.",2018
98,Tirei 10 na prova tirei 10 nos trabalho e de partição e por uma falta quase tirei 10 por não  faltar ai o bonito  fazendo bullying comigo não sou inteligente eu so prestei atencao nas aulas são  tudo dinâmicas,2018
99,"É complicado demais porque a escola nesse caso tenta fazer a parte dela (teve um projeto ótimo sobre bullying, teve promotor de justiça indo palestrar, concurso de redação sobre o tema, etc), o que pega é o trabalho com as famílias.",2018
100,O bullying e assédio no trabalho também pode ser combatido com o compliance. Entenda como no nosso blog: https://clickcompliance.com/bullying-trabalho-compliance-ajuda-combater/,2018
101,Sofrendo bullying no trabalho por ser aquariana 😔,2018
102,"#SP1 Acho que deveriam averiguar se essa rapaz sofria algum tipo de Bullying no local de trabalho, pois acho que ninguem surta assim sem motivo",2018
103,"Acho que deveriam averiguar se essa rapaz sofria algum tipo de Bullying no local de trabalho, pois acho que ninguem surta assim sem motivo   #SP1",2018
104,"Precisamos dialogar mais sobre o bullying. Pessoas ter medo de ir a escola é algo sério. Saiba que nenhuma brincadeira machuca alguém (fisicamente ou psicologicamente), caso contrario não é brincadeira.   Obs:imagem abaixo criada por mim e uns amigos de sala, em forma de trabalho",2018
105,#QuartaDetremuraSDV Gente to fazendo uma trabalho final de ética e preciso que votem nas enquetes  // Você sofre ou já sofreu bullying ?,2018
106,"engraçado que no meu trabalho sou publicitária, contadora, RH, motorista, marketing, decoradora, professora e ontem fui Psicóloga de um menino de 10 anos que sofreu bullying no colégio... as vezes sou gerente tb kkkkkkk",2018
107,"pedi demissão do meu trabalho, a mana cansou do bullying",2018
108,"Kkkkkkkkk eu não faço bullying, só trabalho com verdades",2018
109,Eu sofria bullying no trabalho 😂,2018
110,"O Moro vai ser tipo aquela pessoa do grupo que faz o trabalho pq o resto da galera joga tudo nas costas dele, aí no fim das contas o grupo tira 2, mas é de boa pq mesmo sendo burrinhos e fazendo bullying eles ainda são os pops da escola",2018
111,Não aguento mais sofrer bullying no trabalho kakakakak scrr,2018
112,Bicho o que de passa na cabeça de professor de fazer entrega/protocolo de trabalho em dia de prova? Será que eles sofreram tanto bullying assim na adolescência?,2018
113,Espero que esse episódio faça as pessoas que praticavam bullying pensarem e refletirem também  Ficamos felizes que você gostou do nosso trabalho!,2018
114,"Preciso fazer um trabalho sobre o bullying, os pontos POSITIVOS do bullying ????!!!!",2018
115,Bullying no trabalho: quando uma piada não é só uma brincadeira  https://share.appdater.mobi/IDyVIbrkYR,2018
116,Bullying no trabalho: quando uma piada não é só uma brincadeira https://glo.bo/2DtMsZ8,2018
117,"Há uma relação perigosa entre o bullying no trabalho e o risco de AVC, revela o maior estudo feito até ao momento para investigar esta associação, publicado no European... https://noticiassaude.pt/bem-estar/bullying-e-violencia-laboral-aumentam-risco-de-doencas-cardiovasculares/",2018
118,"sofri bullying de chefe (ainda sofro em parte e nem sei pq), acumulo função, chego de manhã e colocaram coisa na minha agenda sem me consultarem (foda-se vida pessoal), trabalho às vezes de domingo a domingo quero sinceramente que quem acha que não trabalho vá tomar no cu",2018
119,Você sabia que grande parte dos gays sofre bullying na escola? Esses dias realizei um trabalho para o curso de Psicologia sobre o assunto e fiquei aterrorizado com o que descobri. O… https://www.instagram.com/p/BqVn9NrgHyj/?utm_source=ig_twitter_share&igshid=p4127c9z59lt,2018
120,"Quando entrei no ensino médio meu medo deixou de ser ""sofrer bullying"" e virou ""trabalho em dupla""  #ranço #DomingoDetremuraSDV",2018
121,"Já quando tinha 10 anos por causa de um penteado que eu usa e isso me deixou muito mal mas na época eu n contava para ninguém pq n achava era bullying , na época eu lembro q perdi ponto em uma matéria por n quer apresentar um trabalho para sala toda pq os meninos ficavam me...",2018
122,"Desde a 1º série, eu sofri bullying por conta do meu jeito, sempre com piadinhas, xingamentos, já fui humilhado e xingando na hora que estava apresentando um trabalho, acho que esse foi o pior dia da minha vida na escola, já fui ameaçado e varias vezes pensei em me matar +",2018
123,"Virar almoço porque essa vida de galinha é muito dura, pessoas me maltratado né, fazendo bullying com meu trabalho 🙄😂",2018
124,"Alguns motivos que me fazem sobrer um leve bullying no trabalho: Minha pizza favorita é tomate seco c/ rúcula, eu não gosto de hals nem de chaves (o programa) e eu prefiro m&m's com amendoim.",2018
125,"nunca chegou a ser bullying, mas no quinto ano eu fui “amiga” de uma moça, ai ela me obrigava tipo a sentar perto dela pra colar, a fazer o trabalho dela e a romper umas regras da escola. ela também queria que eu bebesse cerveja (gente eu tava no quinto ano, não da pra beber) +",2018
126,"Pense a respeito do impacto que suas palavras trazem para a sociedade, para os ouvintes, para os citados, para você. Não queira ser um propagador de bullying etc. Você é mais que essa maldade transvestida de piadinha, passar bem, bom trabalho 💖",2018
127,"Ai depois eu: ""deixou de ser ateu agora filho da puta?""  Ai ele: ""Você deixou?""  Ai eu: ""nem um pouco"" Ele: ""eu também n""  Moral da história: nunca pratique bullying com seu colega de trabalho a n ser q queira ver um fantasma/demônio   Como eu sou retardada eu n vou parar kkkkkkk",2018
128,"e o bullying sobressaiu tanto o ensino fundamental que eu recebi de brinde esses mimos: bullying no ensino médio, no meu primeiro trabalho e cyberbullying na faculdade, rs.",2018
129,"Qual número que vc calça é pra um trabalho de matemática kakakakaka — Tá me zuando né, pô chama aí que te falo, ou se não vou sofrer bullying pra caralho kkkk https://curiouscat.me/CinelliPaulina/post/707947557?t=1542331002",2018
130,quarta q vem vão apresentar um trabalho sobre o bullying e vou adorar se falarem sobre oq acontece dentro e fora da sala,2018
131,Karaiiiiioooo.... Já sofrir bullying em casa Bullying nos estudos Bullying no trabalho Bullying na rua Bullying nas redes sociais Bullying nos grupos  Bullying no amor Bullying no bolso Karaiiiooo E foda!!!TO VIVO.,2018
132,Como aconteceu comigo... eu fui belieber numa cidade de interior e sofri muito bullying com isso e aos 14 (2011) prometi que nunca mais ia ser fã Encontrei os meninos em 2014 enquanto fazia um trabalho pra recuperar notas (era alguma coisa sobre a cultura)  #TogetherWithBTS #BTS,2018
133,Começamos um trabalho sobre cabelo hoje na escola. Estamos tendo problemas com bullying. Há anos isso não acontecia.,2018
134,"Danilo, respeito teu trabalho e curto bastante, porém bullying nem sempre tem violência física, mas violência psicológica, q é tão ruim quanto. Piadas, palavras ou brincadeiras nem sempre são interpretadas assim por quem as sofre, ainda mais por longo período. Abraço",2018
135,Apresentação de trabalho sobre bullying virtual. Eu to assim,2018
136,Agradeço o @Jovirone1 pela foto pra facilitar meu trabalho sobre bullying,2018
137,Danilo fazendo bullying com os amiguinhos de trabalho.,2018
138,"Coe, tô sofrendo bullying no trabalho, mané... me chamaram de panturrilha de cachorro",2018
139,A+ bonita docontinua gata e o+ bonito virou noia e mataram ele triste isso. Pior que ele fazia bullying comigo. Um dia eu saindo do trabalho e contrei ele e me pediu um dinheiro pro busão e eu dei passou uns dias tava um cartaz de desaparecidos e ele tava no iml  como indigente,2018
140,"Eles são embaixadores da Unicef, onde lançaram a campanha #Endviolence, que luta para proteger crianças e adolescentes no mundo todo contra a violência e o bullying, um trabalho muito bonito!",2018
141,"@Kah_Twi o @omarcelolopes me tira pra comédia até hoje porque eu ensinava outro dia a receita de uma torta de chocolate pra uma amiga de trabalho. Bullying isso, não achas?",2018
142,"Por nenhuma razão aparente. Eu e o antigo grupo de pessoas com quem costumava andar, pura e simplesmente embirramos com o rapaz e começamos a fazer bullying com ele. Para ver o escalabro da situação, chegamos ao ponto de usar um dos nomes que lhe chamávamos para um trabalho. +",2018
143,"minha mãe simplesmente decidiu não lavar rouoa esa semana aí eu to sem minha calça preta e tive que vestir um horrorosa  que ultra marca minha bunda, já tô até vendo o bullying que gou sofrer no trabalho",2018
144,"Cara...... tô sofrendo bullying no trabalho , chegou a Mangueira de BOMBEIRO kkkkkkkkkkkkkk......pq sou alto ??????",2018
