,tweets,ano
0,"eu achei massa abordar assédio moral no trabalho e como foi abordado, mas achei mal trabalhado mesmo, a temporada inteira eu achei beeem mais fraca, entretanto Hang The DJ achei excelente.",2017
1,"Pra mim deixou o rolê Star Trek com cara de tosco, ao mesmo tempo em que pesou com o lance de assédio moral no trabalho.. gostei dos twists e do jeito que a série sempre foi não esperava que ia terminar bem",2017
2,Um total desrespeito a globo não mostrar algo que foi uma das maiores mobilizações de 2017 contra assédio no ambiente de trabalho só pra não querer falar sobre o ator José Mayer. Lamentável e deprimente um total desrespeito a causa! #mexeucomumamexeucomtodas #Retrospectiva2017,2017
3,"Essa questão é muito maior do que a Lava Jato. Não tenho ideia fixa nisso. Minha preocupação está em vários itens que expus em post no meu Blog. Por exemplo: assédio sexual não pode ser indultado por esse decreto, mas tráfico de órgãos humanos e trabalho escravo pode.",2017
4,Mulher transgênero alega ter sido demitida após sofrer assédio no trabalho → bit.ly/2DxsaL9,2017
5,"Adorei o Vídeo, Ph!   Sempre é bom ver a inúmeras interpretações sobre um episódio como esse.  Eu, particularmente, tomei como tema principal os frutos que o assédio faz brotar nas pessoas, em principal ao assédio no trabalho.",2017
6,Gostei de um vídeo @YouTube youtu.be/UJpsYkvd9xA?aSOFRI ASSÉDIO NO TRABALHO - Jean-Luca,2017
7,a claire sofrendo assédio do médico no próprio trabalho que raiva aaaa,2017
8,Gostei de um vídeo @YouTube youtu.be/UJpsYkvd9xA?aSOFRI ASSÉDIO NO TRABALHO - Jean-Luca,2017
9,Assédio sexual no trabalho é tema do Diálogo Brasil https://youtu.be/N6GR57eFcU4 via @YouTube,2017
10,Gostei de um vídeo @YouTube youtu.be/UJpsYkvd9xA?aSOFRI ASSÉDIO NO TRABALHO - Jean-Luca,2017
11,"Ora então uma mulher vai ao meu local de trabalho assediar o meu colega basicamente é toda a gente caga inclusive ele, se fosse um homem a fazer isso a uma gaja já era alarido máximo. Há menos, mas também existe assédio por parte de mulheres",2017
12,Sempre venho aqui reclamar  ~ sei o qto é chato~ mas preciso desabafar o quão ruim e desgastante é sofrer assédio moral no trabalho. Respeito as diferenças políticas e ideológicas e tento trabalhar da melhor maneira possível independente de quem está no poder...,2017
13,"gente indignação com feministo é simples: n é legal ficar pagando de ""cool"" salvador da mulherada, qdo na real centenas de mulheres são demitidas por não aguentarem elas próprias o assédio no local de trabalho caladas e vc vem e n faz menos do q a obrigação e quer ganhar aplauso",2017
14,"Rodrigues, entendo sua indignação. Eu já trabalhei com eventos quando mais nova. Não estamos condenando o trabalho. Estamos condenando as condições de trabalho: assédio de babacas, roupas desconfortáveis e a função de apenas enfeite. Todo mundo trabalha porquê precisa. +",2017
15,Assédio Moral &#038; Bullying no trabalho -  netspeed.com.br/mais/noticia…,2017
16,"Queria muito entender essa história do diretor do clipe de vai malandra, sei que dá trabalho refazer o projeto, mas ela poderia ter refeito. E vocês que adoram dar xilique por conta de assédio em Hollywood nem sequer abriram a boca só por conta da ""representatividade"".",2017
17,aturar assédio no trabalho foi o que realmente acabou com o meu dia.,2017
18,Pesquisa aponta número assustador em relação ao assédio sexual no trabalho. https://goo.gl/eytcio,2017
19,"Primeiro: Ele foi ridiculo com a reporter e ainda mais em um campo de trabalho, foi assedio moral. Segundo: Qual a necessidade de comentar na foto da ex? Ex é ex, ela namora quem ela quiser agr e a Duda castro parece uma retardada discutindo",2017
20,PARABÉNS pelo trabalho de DIVULGAÇÃO de SALVADOR de forma POSITIVA!!! https://fb.me/YjlGa9Ye,2017
21,"Foi esta prática nazista a causadora da morte do Reitor ! A médica Edna Maria Niero notificou o suicidio de #Cancellier como acidente de trabalho, provocado por assédio moral insuportável! Dona Marisa também não suportou tamanho assédio moral #LeiCancellier @MBRAndrea",2017
22,"No caso da lata abstenha-se, a bicha tá rica e a gente assalariado. No caso das piadinhas pra você, pergunta se eles querem receber um processinho de assédio moral no ambiente de trabalho? 😌💅🏻",2017
23,QUE PAÍS MACHISTA É ESSE?  O assédio moral no trabalho é um dos problemas mais sérios… https://www.instagram.com/p/BdLAKE-HII9/,2017
24,"Parece q Jair Ventura obrigará @BotafogoOficial a mais uma ""aventura"" na Justiça do Trabalho por causa do assédio do Santos. Clubes no Brasil n se respeitam e comem uns aos outros, beneficiando, no final das contas, jogadores e empresários. E ainda falta resolver o caso Bruno...",2017
25,".@antonioguterres decidiu montar um grupo de trabalho para lidar com casos de assédio sexual dentro da ONU. Segundo dirigente, recente onda de relatos de abuso no ambiente de trabalho de várias instituições mostra o quão difusa é essa forma de violência.  https://goo.gl/sUoofW",2017
26,"""Com jornadas de trabalho de 12 horas e assédio moral descontrolado, quem trabalhou lá sabe um pouco do que é o inferno""  #apple #iphone #iphonex #trabalho #tecnologia #escravidao Uma visita na “fábrica de suicídios” da Apple na China   https://www.tecmundo.com.br/apple/118036-visita-fabrica-suicidios-apple-na-china.htm via @Tec_Mundo",2017
27,"Eu acho que isso diz respeito ao area trabalhista rsrs, o assedio no trabalho",2017
28,Nunca vi empresário mais miserável do que dono de supermercado. Já trabalhei e sei como é. Sei as condições de trabalho e o assédio que as pessoa passam lá. Infelizmente as pessoas precisam desse trabalho e tem que se submeter a isso.,2017
29,"Como se com outros treinadores fosse diferente.  A diferença é que fazia tempo que o Bahia não conseguia um trabalho com o mínimo de destaque.  Se fosse outro treinador a conseguir o acesso e ser campeão do Nordeste, o assédio seria o mesmo e o desfecho igual.",2017
30,"Além da homofobia, o caso também envolve outro problema: o assédio moral no ambiente de trabalho (via CLAUDIA... https://fb.me/7ymxQsJ4U",2017
31,QUE PAÍS MACHISTA É ESSE?  O assédio moral no trabalho é um dos problemas mais sérios… https://www.instagram.com/p/BdLAKE-HII9/,2017
32,"""A questão sobre assédio é que ele acontece em todos os ambientes – dentro, fora do trabalho e, muitas vezes, até dentro de casa"". @anatsasso  Para entender mais do assunto clique aqui: ow.ly/UD8B30ho0lQ",2017
33,"""Ah, porque você tolera assédio no trabalho? Ela é sua chefe mas não tem esse direito.""  A Vanda é uma mulher negra de 53 anos que hoje é chefe de vários homens. Pensa no tanto de assédio e humilhação que ela já sofreu pra chegar aqui?",2017
34,Isso é considerado assedio no trabalho?,2017
35,Isso se chama assédio moral no trabalho.,2017
36,"No sábado eu sofri um assédio horrivel no trabalho. Um cara começou perguntando ""você que irá me servir hoje?"" E continuou com ""me ajuda a escolher camisinha. Qual você usa, se é que usa?"" E ESTAVA ACHANDO AQUILO NORMAL, nem se importou com minhas reações",2017
37,Assédio e abuso moral no trabalho pode ser por parte de mulher também?,2017
38,"Parceria entre a OIT e o MPT, cartilha traz orientações sobre assédio sexual no ambiente de trabalho e... https://fb.me/DQMxDEOn",2017
39,Precisamos falar sobre assédio sexual no ambiente de trabalho! https://fb.me/3WgsJdeF0,2017
40,"Parceria entre a OIT e o MPT, cartilha traz orientações sobre assédio sexual no ambiente de trabalho e informações detalhadas sobre como identificar e denunciar a conduta, além de explicar as responsabilidades e consequências https://goo.gl/PkdLFJ",2017
41,"X SIPAT Unificada do CRECIPAS, Palestra Assédio Moral no Trabalho, Dra. Margarida Barreto, José… https://www.instagram.com/p/Bcndsa3lbxr/",2017
42,[Ouça] Colunista alerta sobre casos de 'assédio moral' dentro do ambiente de trabalho ► https://goo.gl/gBcizz #CBNribeirao 📻,2017
43,15% das mulheres brasileiras relatram que já sofreram de assédio sexual no trabalho. https://lnkd.in/dFFDsVu,2017
44,Teresa Fragoso: “O assédio sexual no trabalho é uma realidade” twib.in/l/n867nKdpRza5 #expresso,2017
45,Teresa Fragoso: “O assédio sexual no trabalho é uma realidade” expresso.sapo.pt/sociedade/2…,2017
46,"Hoje de manhã a minha mãe e minha tia se juntaram pra falar sobre assédio que elas passaram,muito interessante que todos os homens que cometeram os assédios tinham cargos maiores,principalmente no local de trabalho,escola,igreja,etc.",2017
47,Teresa Fragoso: “O assédio sexual no trabalho é uma realidade” expresso.sapo.pt/sociedade/2…,2017
48,Todo dia eu sou vítima de assédio sexual a caminho do trabalho/casa.,2017
49,"E a revista Vice, tão moderninha, parece que permite o bom e velho assédio sexual em seu ambiente de trabalho.",2017
50,Chicago PD abordará assédio no ambiente de trabalho em um de seus episódios. Irônico em? mixdeseries.com.br/episodio-… | Mix de Séries #ChicagoPD,2017
51,"..vou mais longe..tem que incluir o assédio de pessoas de diferentes e diversas naturezas sexuais por conta do empoderamento e a relação de ""subordinação"" no trabalho...",2017
52,Teresa Fragoso: “O assédio sexual no trabalho é uma realidade” expresso.sapo.pt/sociedade/2…,2017
53,Teresa Fragoso: “O assédio sexual no trabalho é uma realidade” expresso.sapo.pt/sociedade/2…,2017
54,"No ambiente de trabalho, a própria empresa poderia/deveria adotar medidas para punir os casos relatados de assédio?",2017
55,"Minha prima passou pra medicina. O detalhe é q ela smp quis ser médica, fez enfermagem pq na época não passou e n tinha condições de pagar particular. Hj ela com 30 e poucos anos teve coragem de largar um trabalho onde sofria assedio moral e ir atrás do sonho dela. Deu certo",2017
56,"Já saíram alguns temas para roda de conversa evento do janeiro branco em Jaguariúna (21/01) como: -Depressão -Ansiedade -Síndrome do pânico -Psicologia do esporte -Assédio moral no trabalho -Sexualidade -Orientação de carreira Quem não for já sabe, já tem um amigo a menos em 2k18",2017
57,"cabei de por the good doctor em dia e caralho que episódio incrível, eles mostrando o assédio sofrido por mulheres no ambiente de trabalho e como isso muitas vezes afeta na carreira",2017
58,"Vai processar a empresa, vai processar o empresário. A graaande justiça do trabalho vai dar ganho de causa por assédio moral, a justiça comum vai dar dano moral. Os caras vão ter que vender a alma pra pagar a indenização.  PODE APOSTAR!",2017
59,sem falar nos recentes casos de assédio moral por parte dele com as colegas de trabalho. Ranço.,2017
60,"Sempre trabalho DURO, um dia as colegas ainda me acusam de assédio 😂🎤",2017
61,Assédio sexual na ONU obriga Guterres a criar grupo de trabalho dlvr.it/Q7CkxN #Economia #António_Guterres #onu,2017
62,Globo demite William Waack após vazamento do vídeo e José Mayer continua mesmo tendo confessado o assédio dentro do trabalho.,2017
63,"sim, e mandaram isso pra mim depois que eu disse que escuto sim e que o que a pessoa tava dizendo era preconceito. Enfim, é muito assédio e ódio vindo de todas as partes. O trabalho tem que ser feito no nosso interior mesmo pra saber lidar...",2017
64,"#itautec O nome dele é Fernando José Trindade. Esse Fernando é um cara que já fez várias grosserias dentro da empresa com colegas de trabalho, já fez assédio moral em colega, já fez bullying em colega e já fez chacotas pesadas com colega.",2017
65,"""1. O motivo pelo qual não podemos tolerar 'graus de assédio' é porque um dia apertam sua bunda ou peito trabalho. E você deixa passar com uma risada. Você se torna condicionada a isso. 'Ela leva tudo na brincadeira,' eles dizem. E então? Você conhece um Schwahn. Um Weinstein.""",2017
66,Isso é buling ou assédio moral no trabalho 😂,2017
67,"Nossa, Jana, minha irmã é zen. Ela fica contando as histórias dos colegas de trabalho e fica eu e mamãe chocadas, quando não é assédio, é desrespeito",2017
68,"eu sou a pessoa que deixa de comprar algo por se sentir desconfortável com assédio de vendedor, tem macho que consegue ser escroto até no trabalho, como pode??? jesus",2017
69,"Precisamos falar sobre o assédio sexual!!!! Ele existe e é mais corriqueiro do que pensamos. Até quando, nós mulheres, ficaremos sem graças por situações que o sexo masculino nos coloca?? Quando poderemos trabalhar em paz? Pq parece que o ambiente de trabalho é território hostil!",2017
70,Gostei de um vídeo @YouTube youtu.be/UJpsYkvd9xA?aSOFRI ASSÉDIO NO TRABALHO - Jean-Luca,2017
71,ASSÉDIO MORAL NO TRABALHO https://biteable.com/watch/assdio-moral-1685623,2017
72,"Muito assédio em cima do Rueda , isso acaba prejudicando o seu trabalho no Flamengo.  #BBdebate",2017
73,Vice de Theresa May se demite por acusações de assédio sexual e milhares de fotos pornôs em seu computador de trabalho https://elpais.com/internacional/2017/12/20/actualidad/1513804333_979692.html,2017
74,"As raparigas são alvo de assédio sexual bem antes de integrar o mercado de trabalho, enquanto que os valores que... https://fb.me/8DDcUfOHq",2017
75,"""Quando Paris Alucina"", conta a história de um filme dentro de outro filme e o processo de criação de um roteiro dentro do contexto de Hollywood.  ""Se Meu Apartamento Falasse"", fala de assédio moral no ambiente de trabalho, busca pela ascensão profissional, suicídio e adultério.",2017
76,"TRABALHO, ADMINISTRAÇÃO E SERVIÇO PÚBLICO - Assédio Moral e Plano de Demissão  - 31/10/2017 - 10:22 portalminas.com/news/trabalh…",2017
77,"Relações de trabalho na era Temer: corte do feriado, demissões e assédio moral. bit.ly/2krhK8D",2017
78,Devia ser possível dizer a esta gaja o quanto o vestido justo que tem lhe fica bem. Sem ser acusado de assédio sexual no trabalho. Foda-se. Que regalo.,2017
79,"eu trabalho com entretenimento então tive que assistir ao clipe assim que ele foi lançado, e por mais lindo que seja enaltecer o morro do vidigal e o funk e etc, foi bem cagado ter um clipe dirigido por um cara que desde dois mil e bolinha tem acusações de assédio",2017
80,"https://www.significados.com.br/assedio-moral/ Os significados no google não são tão completos, mas eu te explico o porquê disso. É mais comum que ""assédio moral no trabalho"" seja visto como significado pois diversos movimentos sindicalistas usam esse termo para reivindicar ""direito dos trabalhadores"".",2017
81,"RT @daanlima_: É sobre assédio no mercado publicitário, mas poderia ser sobre qualquer área. Parabéns pelo trabalho @Iracroft 🖤  #MulheresPodcasters https://itunes.apple.com/br/podcast/anticast/id453067879?mt=2&i=1000397228548",2017
82,"Mas acusações de assédio vieram depois da gravação e ela fez uma declaração dizendo que repudia a atitude dele (por isso nunca mais o citou) e ela lançou o trabalho em respeito ao trabalho que os demais tiveram com a produção do clipe, o que eu acho bem justo",2017
83,"É sobre assédio no mercado publicitário, mas poderia ser sobre qualquer área. Parabéns pelo trabalho @Iracroft 🖤  #MulheresPodcasters https://itunes.apple.com/br/podcast/anticast/id453067879?mt=2&i=1000397228548",2017
84,"No Brasil as mulheres ainda ganham em média 30% a menos do que os homens para exercer a mesma função, mulheres também são maioria no trabalho doméstico, acumulando funções dentro e fora de casa. São as maiores vítimas de assédio sexual no trabalho cometido por homens...",2017
85,"Matt Damon: Vocês estão demonizando todos os homens. Deveriam olhar praqueles que nunca fizeram nada. Concordo, agora todos os produtores/atores de Hollywood, que não cometeram assédio ou abuso contra alguém ganharão essa belíssima placa, em homenagem ao seu trabalho:",2017
86,O final de 2017 foi palco para diversas denúncias de assédio sexual em Hollywood.  Nesse mesmo período saiu um artigo mostrando que assédio sexual no trabalho causa sintomas de depressão mais severas do que outro tipo de assédio no local de trabalho.  cienciaexplica.com.br/artigo…,2017
87,O diretor do clipe vem sendo acusado de assédio há anos. E nesta semana surgiram outras denúncias. Tem uma galera criticando com razão a escolha dele pro trabalho.,2017
88,O assédio sexual no trabalho finalmente começa a ser discutido na Suíça s.swissin.fo/49KHgy0,2017
89,6 características do assédio moral no trabalho- e como reagir  bit.ly/2kxHJdQ,2017
90,"Galera, surgiu a dúvida: existe uma cartilha sobre assédio no trabalho? Pra tipo imprimir e deixar espalhado onde for preciso.",2017
91,A pessoa ter cometido assédio não muda a qualidade do trabalho dela Infelizmente Mas é real,2017
92,Sobre abuso e assédio:  No trabalho o caminho é longo pois: assédio moral  Ninguém da moral qdo vc conta o q passa,2017
93,"Ouvindo e pensando na quantidade de ""gente"" que conheço que devia ser OBRIGADO ouvir esse episódio.   MÃO NA PERNA, PIADINHAS ETC NÃO É NORMAL   ROMATINZAR O TRABALHO EXCESSIVO NÃO É NORMAL   NÃO AO ASSÉDIO MORAL NÃO AO ASSEDIO SEXUAL",2017
94,"o clipe não se resume apenas ao Terry Richardson, e todo o trabalho de uma equipe não conta? desde q surgiu as primeiras imagens da Anitta na favela sabia-se q ele fazia parte da produção, as criticas à Anitta só vieram depois q surgiu os relatos de assédio em Hollywood.",2017
95,"""A cantora divulgou um comunicado em que explica que vai lançar o clipe dirigido pelo fotógrafo em consideração às outras pessoas envolvidas no trabalho, mas que repudia assédio e violência contra a mulher, e espera uma investigação."" https://www.google.com.br/amp/s/g1.globo.com/google/amp/https://g1.globo.com/pop-arte/musica/noticia/anitta-diz-que-vai-lancar-clipe-dirigido-por-terry-richardson-acusado-de-assedio-nos-eua.ghtml",2017
96,Eu amo meu trabalho mas tem duas coisas q eu não suporto Sol Assédio,2017
97,Assédio Moral contribui para a ocorrência de transtornos mentais no ambiente de trabalho bit.ly/OcorrenciaTranstornos,2017
98,"Mt coisa ali é falsa, eles tentam mostrar pro público uma coisa que não acontece de verdade dentro da empresa.Antes eu acompanhava muito mais do que hoje em dia, mas sei de muitas história de trabalho quase escravo, assédio, idol que perdeu 20kg em 40 dias pra poder debutar, etc",2017
99,Você sofre assédio no trabalho:   ( ) procura seus direitos na justiça   (X) reclama no Twitter,2017
100,Exatamente as justas causas mais comum é roubo e furto com certeza provado mas por falar mal de gerente onde ele estava fora do ambiente de trabalho ela foi completamente abusada isso sim assédio moral. Eu fodia com certeza só pela desaforo de ter feito FAKE.,2017
101,"val nem me chamou pra trabalhar, acho que ficou brava por eu sofrer assédio no trabalho e fala pra ela que é dona, acho que ela queria que eu ficasse quieta e aguentasse igual ouço os abusos dela",2017
102,6 características do assédio moral no trabalho- e como reagir https://fb.me/8zCFu0JD0,2017
103,mais um dia tendo o trabalho de ser mulher e sofrer assédio,2017
104,"Com 10 eps the good doctor, que é centrada em um autista, já falou de racismo e assédio no ambiente de trabalho QUE SERIEZONA DA PORRA",2017
105,"Nota: assédio, não sexual, no trabalho tbm é feito por mulheres sob homens e mulheres com cargos mais baixos.",2017
106,"Mais Ricco: Paolla Oliveira e Débora Falabella vão dar um tempo da TV depois do trabalho em #AForçadoQuerer. Paolla tá gravando #Assédio, a série do novo GloboPlay, e Débora, #SeEuFecharOsOlhosAgora, que só vai em 2019.",2017
107,Matt Damon fala que existem níveis diferentes entre assédio/estupro e a internet já quer a cabeça dele.  'obviamente estuprar uma criança é diferente de um flerte desnecessário no trabalho'  Depois me perguntam porque falo das coisas que falo no meu podcast. Cultura da Revolta,2017
108,"Trabalho com duas investigadoras absurdamente competentes. Inteligentes, proativas, sangue no olho. Uma delas foi minha aluna na academia. Mas elas têm dois defeitos: são jovens e bonitas. Ouvir uma delas dizer quão corriqueiro e degradante é ficar desviando de assédio é foda.",2017
109,Assédio no trabalho que fala,2017
110,"Vocês conhecem assédio moral? Senão:  Pra deixar claro, eu trabalho das 9h às 17h e hoje fui pra empresa, então ele sabe que eu estava na rua.  Ocultando o nome do corno e coisas que não posso colocar online.",2017
111,meu deus..olha o nível do jornalista. Pregando punição e castigo ao um profissional só que ele não quer mudar sua condição de trabalho. Isso é assedio moral fera.,2017
112,"Sofreu assédio, mas aceitou o assédio pra nao perder o trabalho? Tinham que denunciar na hora, mas agora que estao com a vida feita, resolvem falar?",2017
113,"Só o que me faltava,tô sofrendo assédio no trabalho kkkk tô rindo pra não chorar",2017
114,"Segundo o site, o objetivo do mecanismo é aumentar a conscientização, sem ferir o trabalho artístico dos filmes ou das séries. 👊 bit.ly/BdBRottenApples #assedio #rottenapples",2017
115,"Perdoe discordar... Me parece que o assedio é muito mais em função da ausência de DINHEIRO no mercado, da safra de jogadores, e pela ""facilidade"" em negociar por estes lados. Tive o trabalho de tentar ver revelações da temporada. Não chegam a 8. 3 do Grêmio. Imagine a briga.",2017
116,O futebol não foi perfeito nos últimos 3 anos. Mas desenvolveu uma linha de contratação que rendeu neste ano o assédio de grandes clubes do Brasil em nossas “apostas”. O DADE tem trabalhado bem nestas análises e acredito que o amadurecimento deste trabalho tenha refletido nisso.,2017
117,caso de assédio e estupro na uepa e os HOMENS do meu trabalho fazendo piada lgbtfóbica (todas as siglas) e machista pra caralho,2017
118,MPT apresenta cartilhas de combate ao assédio sexual no trabalho. https://buff.ly/2CldtLm,2017
119,"Com isso tbm poderia ter uma série de assédio no trabalho, QUERIA MUITO, mas é foda fazer sozinha.",2017
120,"assédio no trabalho é somente a coisa mais CU do mundo! eu só quero SUMIR, apenas!",2017
121,"Hayek foi fantástica neste artigo em que conta o desenvolvimento do assédio em seu ambiente de trabalho. Um ""por trás das câmeras"" triste e realista do filme Frida, projeto pessoal da atriz.  Vale muito a leitura!",2017
122,Assédio sexual no trabalho: debate no @SenadoFederal propõe programa de ressocialização. https://buff.ly/2z82u8c,2017
123,@smp_ifsp contra o assédio no ambiente de trabalho.  #ASSEDIONAO smp.ifsp.edu.br/index.php/co…,2017
124,Todos percebemos que a mulher fazia assédio no trabalho. Eu passei por isso quando era mais novo. Acredito que o tesoureiro se sentia manietado e com medo,2017
125,Muito provavelmente por medo. Já deves ter ouvido falar em assédio no trabalho (votaste essa lei em Setembro),2017
126,"Não sei o q é pior, o próprio ato de assédio ou a mulher colega de trabalho dos macho defendendo eles https://twitter.com/psiqueu/status/940727361464623105",2017
127,Também acho importante diferenciar assédio sexual/estupro de uma tentativa de paquera ou conquista amorosa. Teve um cara que ficou atrás de mim um tempão no trabalho e não denunciei porque atração não correspondida por alguém e paquera mal sucedida não equivale a assédio.,2017
128,CAS - Assédio no trabalho - TV Senado ao vivo - 12/12/2017 https://youtu.be/fldQZyO2LY0 via @YouTube,2017
129,esse caso da Salma Hayek é emblemático de como funcionam as engrenagens do assédio e do abuso no trabalho. quem poderia imaginar que por trás da realização de um filme lindo como o Frida teve tanto sofrimento -- Harvey Weinstein Is My Monster Too https://nyti.ms/2AAG8i7,2017
130,Sesau realiza Simpósio de Enfrentamento ao Assédio Moral no Trabalho dlvr.it/Q5pQ59,2017
131,"Bixo, o que me irrita mermo é que eu sei muito bem do que esse caba é capaz pra chegar agora e pagar de ""ain eu me preocupo com assédio no ambiente de trabalho"". Se preocupa o caralho, dava umas secada violenta nas recepa, mó hipocrisia do caraio.",2017
132,Assédio sexual no trabalho: debatedoras propõem programa de ressocialização https://www12.senado.leg.br/noticias/materias/2017/12/12/assedio-sexual-no-trabalho-debatedoras-propoem-programa-de-ressocializacao?utm_medium=share-button&utm_source=twitter,2017
133,Assédio sexual no trabalho: debatedoras propõem programa de ressocialização bit.ly/2z7mDLC,2017
134,Assédio sexual no trabalho: debatedoras propõem programa de ressocialização bit.ly/2z7mDLC,2017
135,Assédio moral no ambiente de trabalho is a thing,2017
136,#senado                      Áudio:                                           CAS estuda medidas para combater assédio contra mulheres no trabalho                  ift.tt/2ASqoE8,2017
137,Sinceramente achei inadequado por ela ter 15 anos e por ele fazer durante o trabalho. Fora isso vida que segue. Não vi assédio. Foi uma brincadeira com tom de cantada que quando viu que era menor tentou freiar e não conseguiu. Assédio está ligado a insistência não uma única vez.,2017
138,"a guria tem 15 anos, ele não esta ali para fazer brincadeira com um criança segundo o estatuto, se levar ao pé da letra poderia juntar assédio + pedofilia, não é mimimi o repórter que criou a situação, esta ali a trabalho não para brincar, concordo contigo na parte de generalizar",2017
139,A novela falando sobre Assédio no trabalho 👏🏻👏🏻 #Apocalipse16,2017
140,"Vish, assédio no trabalho 😖 #Apocalipse16",2017
141,"a questão, legítima, que se coloca é: era amor ou trabalho de puta? no caso da segunda hipótese: se tem dado para o torto vinha queixar-se de assédio? [válido para ambos]",2017
