,tweets,ano
1726,"II Seminário ""Trabalho e saúde na reestruturação produtiva: assédio moral e suicídio"" #bibliotecasuerj #feedly fb.me/43gQpFYau",2015
1727,Psicólogo e advogado dão dicas para resolver problemas no trabalho: Assédio moral é mais comum do que o normal... glo.bo/1DZCIMb,2015
1728,Psicólogo e advogado dão dicas para resolver problemas no trabalho: Assédio moral é mais comum do que o normal... glo.bo/1DZCIMb,2015
1729,Psicólogo e advogado dão dicas para resolver problemas no trabalho: Assédio moral é mais comum do que o normal... glo.bo/1DZCIMb,2015
1730,Psicólogo e advogado dão dicas para resolver problemas no trabalho: Assédio moral é mais comum do que o normal... glo.bo/1DZCIMb,2015
1731,Psicólogo e advogado dão dicas para resolver problemas no trabalho: Assédio moral é mais comu... glo.bo/1DZCIMb #renatogottschal,2015
1732,@barraco_reality Psicólogo e advogado dão dicas para resolver problemas no trabalho: Assédio moral é mais comu... glo.bo/1DZCIMb,2015
1733,Psicólogo e advogado dão dicas para resolver problemas no trabalho: Assédio moral é mais comum do que o normal... glo.bo/1DZCIMb,2015
1734,@nacarolbjs e eu acabei descobrindo que fui vitima de assédio moral... No trabalho....,2015
1735,Palestras/Eventos: II Seminário Trabalho e Saúde na Reestruturação Produtiva: Assédio Moral e Suicídio,2015
1736,"Tamo vendo esse assédio no trabalho, Carlos Daniel #Usurpadora025",2015
1737,Imagem célebre do assédio de admiradores pelo trabalho educacional da equipe Persil... Siga o IG @jairodilima... fb.me/1HtpjlIxg,2015
1738,"@SorrindopraVida rezo pela saúde  meu esposo, pelo seu trabalho, que sofre pressões e assédio moral.",2015
1739,Me ha gustado un vídeo de @YouTube (tube.mint.lgbt/rVluQNAU_BI?a - Dica - Como lidar com assédio moral no trabalho).,2015
1740,Gestora do Trabalho Seguro no RN ministra palestra sobre assédio moral no Grupo Guararapes trt21.jus.br/Asp/Noticia/not…,2015
1741,Representantes do funcionalismo municipal denunciam assédio moral no local de trabalho fb.me/t4fSnKol,2015
1742,RS: Assédio moral no trabalho é foco de encontro no SITRACOM em Bento goo.gl/fb/FsVbkH,2015
1743,MT: Audiência pública debaterá assédio moral no trabalho e terceirização goo.gl/fb/zp2sUW,2015
1744,Já ta na hora de passar aquele vídeo de assédio no trabalho para o Carlos Daniel #AUsurpadora023,2015
1745,Deixa eu voltar para o trabalho e fugir desse fake mentiroso e desse assedio do Piloto kkkkkkkkk.,2015
1746,"'Lá no trabalho, ""assédio moral"" a gente chama de ""quinta feira' - #flashdasemana #jornalismo",2015
1747,"“Muitas ... O bullying é julgado na Justiça Comum, enquanto o assédio moral é julgado pela Justiça do Trabalho.",2015
1748,"A844 Assédio moral e sexual no trabalho – Brasília : MTE, ASCOM, 2009. 44 p. ... Ações preventivas da empresa . 29 .. na falta dessa..",2015
1749,"constrangimentos, punição ou assédio moral dentro do ambiente de trabalho .... As empresas também perdem, pois o assédio traz rotatividade..",2015
1750,"negros são  atingidos pela discriminação no trabalho diferenciado, no corte de promoções e na prática de assédio moral e assédio sexual.",2015
1751,assédio moral no local de trabalho!!!!!!!!!!!!,2015
1752,pesquisa de assédio moral no local de trabalho ufes!!!!!!!!!!!!!!!,2015
1753,O que é assédio moral no trabalho assediomoral.ufsc.br/?page_i…...,2015
1754,o assédio moral no trabalho!!!!!!!!!,2015
1755,Hora da Piada: Assédio Sexual: Um funcionário passa por uma colega de trabalho e diz que os cabelos dela têm u... bit.ly/19KHoJV,2015
1756,Hora da Piada: Assédio Sexual: Um funcionário passa por uma colega de trabalho e diz que os cabelos dela têm u... bit.ly/19KHoJV,2015
1757,Hora da Piada: Assédio Sexual: Um funcionário passa por uma colega de trabalho e diz que os cabelos dela têm u... bit.ly/19KHoJV,2015
1758,COMO EVITAR O ASSÉDIO MORAL NO AMBIENTE DE TRABALHO?  O assédio moral é a exposição dos trabalhadores a situações... fb.me/2vWFMUQWo,2015
1759,"Mauro Mendes, da @CUTBrasilia: ""O assédio moral e a jornada dupla são alguns dos principais causadores de estresse no ambiente de trabalho""",2015
1760,@Woods_Bar sabem do assedio feito por um funcionário em horário de trabalho a uma mulher de Foz?,2015
1761,Entenda melhor a lei de assédio moral no trabalho e saiba se defender de abusos is.gd/vAb3fN,2015
1762,"Confira a reportagem sobre o lançamento do livro Estado, Poder e Assédio: Relações de Trabalho na Administração... fb.me/7dTzm3DIb",2015
1763,"O Senge lançou nesta sexta-feira, 24 de abril, o livro Estado, Poder e Assédio: Relações de Trabalho na... fb.me/6CRnFigJD",2015
1764,"Baixe o ebook do Senge ""Estado, Poder e Assédio: Relações de Trabalho na Administração Pública"", com vários... fb.me/3KSp7rF6J",2015
1765,Como evitar o assédio moral no trabalho tinyurl.com/phrtkbn,2015
1766,#Repost nacaojuridica ・・・ Assédio moral ou violência moral no trabalho não é um fenômeno novo.… https://instagram.com/p/16z_-mo53W/,2015
1767,Assédio moral ou violência moral no trabalho não é um fenômeno novo. Pode-se dizer que ele é tão antigo quanto o... fb.me/3noabhqg2,2015
1768,Como Denunciar Assédio Moral no Trabalho  mundodastribos.com/como-denu…,2015
1769,"se pedir para que a empregada fique nua, no primeiro dia de trabalho dela, não é assédio, provavelmente eu vivo em outra dimensão",2015
1770,"Para o MPPE e Ministério Público do Trabalho, Governo pratica Assédio Moral contra professores | Teresa Leitão teresaleitao.com.br/para-o-m…",2015
1771,Representante do Ministério Público de Trabalho:todos esses relatos caracterizam assédio moral(audiência pública comissão de cidadania),2015
1772,AINDA TEMOS VAGAS - VENHA OBTER A ORIENTAÇÃO CORRETA!  Assédio moral ou violência moral no trabalho não é um... fb.me/3Qjg9hXkG,2015
1773,"Amanhã acontece o lançamento do livro ""Estado, Poder e Assédio: relações de trabalho na administração"", com... fb.me/7bQML9Y5S",2015
1774,@SorrindopraVida Coloco meu marido e seu trabalho. Muito assédio moral e pressão por metas.,2015
1775,Curso grátis de prevenção ao assédio moral no trabalho. bit.ly/1vdmpLY #CursoGratis,2015
1776,Contei da senhora que apertou minha bunda no trabalho?  Vou fazer um diário de assédio naquele lugar jaodpad,2015
1777,@FabioLeash antes do programa..tinha esse assédio todo? Rsrsrs acho engraçado os comentários!! É o reconhecimento do trabalho de vcss!,2015
1778,Empregada vítima de assédio sexual no trabalho será indenizada  #Konvênios,2015
1779,Ter um trabalho decente é dizer não ao trabalho infantil e ao assédio moral: goo.gl/PIQohI #trabalhodecente,2015
1780,@BandNewsFMCtba _ assédio moral no trabalho não tem preço. Mas pra bancos a multa sai de graça pro prejuízo dos funcionários.,2015
1781,Fórum de Relações Trabalhistas Tema: Assédio moral no trabalho e a responsabilidade da empresa  Programação: 08h... fb.me/3hzNG2PUW,2015
1782,Sofrendo assedio sexual de gordas no trabalho.,2015
1783,@Leid_k Garçonete sofre tanto assédio no trabalho que meldels.,2015
1784,Denuncia:- empresário semi fracassado anda promovendo assédio no corpo de trabalho... Triste contar mas é... fb.me/1WRT0NhXG,2015
1785,10 perguntas e respostas sobre assédio moral e sexual no ambiente de trabalho.     São Paulo – Broncas e gritos... fb.me/4bOA5od2O,2015
1786,"Agora que trabalho no SBT, dizer que tenho tesão na Rachel Sheherazade pode ser considerado assédio? Porque eu não tenho... meu amigo q tem",2015
1787,"Greve nos Correios.   Insatisfeitos com convênio médico, condições de trabalho, assédio moral e violência nas... fb.me/1Qf8jklqK",2015
1788,"Na última terça-feira,  tivemos um caloroso debate sobre assédio moral e sexual no mercado de trabalho. Vítimas... fb.me/7hJsSUIiU",2015
1789,"Uma amiga tá sofrendo assédio no trabalho. Parei pra pensar nisso, como proceder?",2015
1790,Democracia Pornô: Assédio Moral no Trabalho democraciaporno.blogspot.com…,2015
1791,Democracia Pornô: Assédio Moral no Trabalho democraciaporno.blogspot.com…,2015
1792,Como se defender do assédio moral no trabalho exame.abril.com.br/revista-v…,2015
1793,"Janaína Soares, TAE da UFMG, apresenta seu trabalho de mestrado sobre o Assedio Moral no III Encontro Regional... fb.me/1H7tZ8qjl",2015
1794,"Neste momento participo da Audiência Pública Assédio Moral e Sexual no Mundo do Trabalho, proposta pela Deputada... fb.me/31Z56PeFZ",2015
1795,"Neste momento participo da Audiência Pública Assédio Moral e Sexual no Mundo do Trabalho, proposta pela Deputada... fb.me/4edHWHyCb",2015
1796,Iniciando os trabalhos da audiência pública  sobre Assédio Moral e Sexual no Mundo do Trabalho. #AssédioSexualÉcrime,2015
1797,Temos que combater o assédio sexual e moral no trabalho. Saiba como denunciar. Participe!,2015
1798,Assédio no local de trabalho! https://instagram.com/p/1djCBOBqoC/,2015
1799,Dez denúncias de assédio moral no trabalho são registradas por dia no país - Jornal Hoje -... fb.me/6vHiBxibh,2015
1800,Rio Sul: Assédio moral no trabalho riosul2012.com/2015/03/assed…,2015
1801,ASSÉDIO NO TRABALHO  Muita gente foi condenada pela prática do assédio no trabalho.   O assédio moral no ambiente... fb.me/32kWkm0b6,2015
1802,@dionea @alicebiruta todo mundo SEMPRE repara... e só não fala pq isso pode ser considerado assédio dependendo do trabalho.,2015
1803,Bom dia @HumanizaRedes. Tenho uma denúncia de trabalho escravo e assedio moral pra fazer. Como devo proceder?,2015
1804,"Eu ja tava tao decidida fazer a mono sobre assedio sexual no ambiente de trabalho, mas agora com essa lei da terceirizaçao to na duvida",2015
1805,Documentário A dor (in)visível - Assédio Moral no Trabalho: https://tube.mint.lgbt/ZKGzTjljGgM via @YouTube,2015
1806,@lenaga45 Vi ela dizendo numa entrevista que está afastada devido ao assédio e que isso atrapalha no trabalho !! ai ai kkkkk,2015
1807,Como se defender do assédio moral no trabalho exame.abril.com.br/revista-v…,2015
1808,@FeCastanhari arranje um trabalho em que vc seja obrigado a estar as 7 da manha sob pena de assédio moral! Hahahhaaha,2015
1809,Assédio sexual no trabalho:,2015
1810,O que é assédio moral no trabalho assediomoral.ufsc.br/?page_i…... O assédio pode assumir tanto a forma de ações diretas ..,2015
1811,Diálogo com as trabalhadoras da hotelaria e hospitalidade.Agenda Trabalho Decente e Prevenção ao assedio.100 dias,2015
1812,ASSÉDIO MORAL  Reportagem apresenta crescimento do assédio moral no ambiente de trabalho 02.06.2014 – Reportagem... fb.me/7Te0RQ0bx,2015
1813,"Trabalho, precarização e resistências: Assédio Moral e a precarização das relações de trabalho fb.me/7o2JmivIS",2015
1814,Grupo de Trabalho vai discutir assédio às mulheres de instituições de segurança brasil.gov.br/cidadania-e-ju… #PTnaTV13,2015
1815,Assédio Moral e a precarização das relações de trabalho:  bit.ly/1D03W7a,2015
1816,Assédio Moral no local de trabalho - É CRIME!  Curso «MOBBING» - ASSÉDIO MORAL NO LOCAL DE TRABALHO  Regime... fb.me/6yFi88xRz,2015
1817,Assédio Sexual no Trabalho dlvr.it/9Jdcf0,2015
1818,Assédio moral no trabalho? O constante constrangimento do trabalhador é crime e deve ser denunciado.,2015
1819,Sofro assédio no meu ambiente de trabalho. O pior de tudo é que é um homem. 😤,2015
1820,Assedio moral no meu trabalho? isso dá um processo e tanto,2015
1821,Vamos falar de Saúde do Trabalhador?  De assédio moral no trabalho? De condições insalubres de Segurança no... fb.me/3YBwbQGzy,2015
1822,"@g_jareta deve ser uma espécie compensação pelo trabalho excessivo e mal remunerado, o assédio moral frequente e os feriados perdidos",2015
1823,"""No ambiente de trabalho o assédio moral pode ser identificado por humilhações constantes, geralmente provocados... fb.me/2TvU6qrZV",2015
1824,"Durante o #CONGREGARH2015 acontece o Fórum de Relações Trabalhistas, com o tema: ""Assédio moral no trabalho e a... fb.me/6w6ELCBYI",2015
1825,TST – Empregada vítima de assédio sexual no trabalho será indenizada: denisonleandro.adv.br/tst-em…,2015
1826,Assédio Moral no trabalho fb.me/22dZhHcme,2015
1827,Assedio moral e os Grupos de Whatsapp no trabalho bit.ly/1EuQM58 #AssedioMoral #WhatsApp #DireitoTrabalhista,2015
1828,O papel dos sindicatos nas relações de trabalho e a sua atuação contra o assédio moral direitonet.com.br/artigos/ex… via @DireitoNet,2015
1829,Assédio sexual no trabalho! Veja isso: bit.ly/1Cpw7Zw,2015
1830,Hoje o nosso tema é o Mobbing. O assédio moral no ambiente de trabalho. E @sdemolinari nos ajudará ! #central98,2015
1831,"Eu Cristiane Colares, Fui vitima de assedio moral no trabalho Fui exposta a uma situação humilhante e... fb.me/7ccuQH2in",2015
1832,O Que É Assédio Moral No Trabalho? É considerado assédio moral no trabalho qualquer situação humilhante ou... fb.me/7egrM0THh,2015
1833,RT @portalbrasil: Grupo de Trabalho vai discutir assédio às mulheres de instituições de segurança: goo.gl/jRMboq @SPMulheres,2015
1834,Sofrendo assédio alimentar no trabalho com o biscoito de chocolate do chefe.,2015
1835,Grupo de Trabalho vai discutir assédio às mulheres de instituições de segurança: goo.gl/jRMboq @SPMulheres,2015
1836,Assédio moral no trabalho dlvr.it/9D8sVb,2015
1837,"O que é assédio moral no trabalho assediomoral.ufsc.br/?page_i…... O assédio pode assumir tanto a forma de ações diretas (acusações, insultos..",2015
1838,DF: Grupo de Trabalho vai discutir assédio às mulheres de instituições de segurança goo.gl/fb/723Pzq,2015
1839,"@arthur2901 @_l0en @bobagento ela tá meio equivocada. Mas, assédio moral não é só em ambiente de trabalho. Mas, não cabe processo não.",2015
1840,Grupo de Trabalho vai propor medidas de combate ao assédio às mulheres de instituições de #SegurançaPública.  brasil.gov.br/cidadania-e-ju… …,2015
1841,Grupo de Trabalho vai discutir assédio às mulheres de instituições de segurança ow.ly/L4PCS,2015
1842,Assédio Moral no Trabalho  E o que é assédio moral no trabalho?  É a exposição dos trabalhadores e trabalhadoras... fb.me/1VZsutFVM,2015
1843,Grupo de Trabalho vai propor medidas de enfrentamento ao assédio moral e sexual às mulheres nas instituições de segurança pública,2015
1844,Grupo de trabalho vai propor medidas para enfrentar o assédio às mulheres nas instituições de segurança pública bit.ly/1aiucQO,2015
1845,1. Sofro de assédio sexual no trabalho. 2. Já comi fruta por minha livre e espontânea iniciativa e vontade. 3.... fb.me/3as6tc5LB,2015
1846,#SeLigaPiloesPB Pesquisa diz que 40% das policiais já sofreram assédio sexual ou moral:   O trabalho... bit.ly/1BOWUPP,2015
1847,Assédio moral no ambiente de trabalho militar ~ Papo de PM - Aqui o papo é diferente fb.me/2ZE22xAph,2015
1848,"Assédio moral no ambiente de trabalho militar: No mundo contemporâneo, em especial nos grandes centros urbanos... bit.ly/1EBMrND",2015
1849,Me aplaudindo em pé pela belíssima apresentação do meu trabalho por assédio moral.,2015
1850,@lindoecherouso assédio moral no ambiente de trabalho,2015
1851,corretor novo olhando meus peitos que bom que parou pois eu já estava prontissima pra sacar a carta clow do assédio sexual no trabalho,2015
1852,Como denunciar o assédio no trabalho bit.ly/1xUcHAT #negocios,2015
1853,Pesquisa diz que 40% das policiais já sofreram assédio sexual ou moral: O trabalho delas é proteger as pessoas... bit.ly/1DmrQeB,2015
1854,Tô a fazer um trabalho sobre assédio sexual e só penso no Adrilles rs #BBB15,2015
1855,O que fazer quando o emprego estável no setor público se transforma em um trabalho precário em função do assédio... fb.me/4qiS0oMlm,2015
1856,DIREITO DO TRABALHO: Empregada vítima de assédio sexual no trabalho será indenizada.  Saiba mais em:... fb.me/76FBSW6nB,2015
1857,Assedio moral e os Grupos de Whatsapp no trabalho bit.ly/1EuQM58 #AssedioMoral #WhatsApp #DireitoTrabalhista,2015
1858,Assedio moral e os Grupos de Whatsapp no trabalho bit.ly/1EuQM58 #AssedioMoral #WhatsApp #DireitoTrabalhista,2015
1859,"#BomDia Agora uma mensagem: ""assédio moral no ambiente de trabalho é crime!""🚫 👀 OK! @ Brapor… https://instagram.com/p/049XHQzPQE/",2015
1860,Quase 60% das policiais acreditam que o comportamento das mulheres no trabalho incentiva o assédio fb.me/3KiNqgOe2,2015
1861,Quase 60% das policiais acreditam que o comportamento das mulheres no trabalho incentiva o assédio fb.me/7cg6tqwKK,2015
1862,Boa reportagem do Fantastico sobre policiais mulheres q sofrem assedio sexual no ambiente de trabalho  globotv.globo.com/rede-globo… Revoltante!,2015
1863,"Diferença entre ASSÉDIO MORAL e ÉTICA no ambiente de trabalho. Têm muitos ""chefes"" precisando aprender... fb.me/3HNc1KkRd",2015
1864,Quase 60% das policiais acreditam que o comportamento no trabalho incentiva o assédio goo.gl/XxnFL0,2015
1865,Pesquisa diz que 40% das policiais já sofreram assédio sexual ou moral: O trabalho delas é proteger as pessoas... bit.ly/1BFm1DK,2015
1866,Seminário Assédio Moral no Trabalho: senge-pr.org.br/noticia/comb…,2015
1867,Conheça as características e consequências do Assédio Moral no ambiente de trabalho: saudeexperts.com.br/assedio-…,2015
1868,Meu novo bigode está sendo motivo de assédio no trabalho.,2015
1869,"40% das policiais brasileiras sofreram assédio no trabalho. Maioria, de superiores. Só 11% denunciaram. g1.globo.com/fantastico/noti…",2015
1870,Supermercado responderá por assédio sexual por chantagem - blogdotrabalho.com/supermerc…,2015
1871,"40% das policiais brasileiras sofreram assédio no trabalho. Maioria, de superiores. Só 11% denunciaram. g1.globo.com/fantastico/noti…",2015
1872,Policiais mineiras trazem à luz assédio sexual em seu trabalho.Cabe à Polícia Militar punir exemplarmente o responsável.Mulheres corajosas!,2015
1873,Empregada vítima de assédio sexual no trabalho será indenizada. Acesse a notícia no link goo.gl/T4b20Z.... fb.me/7hsw9xLxf,2015
1874,O  Sindasp apoia as guerreiras do Sistema Público de Segurança na luta contra o assédio no local de trabalho.  g1.globo.com/fantastico/noti…,2015
1875,O Sinpol-PE dará  todo apoio às companheiras vítimas de assédio em seu local de trabalho.    Confira no link abaixo:  g1.globo.com/fantastico/noti…,2015
1876,Realizou-se no passado dia 26 de março a AULA ABERTA | O Assédio Moral no Trabalho #estgf #ipp #30anosIPP #aulaaberta #lsol #msol,2015
1877,2) Foquei o Assédio Moral no serviço público! O trabalho acabou virando Projeto de Lei no RS. Conheci o tema quando estudei na UAM (Espanha),2015
1878,1) Meu trabalho de conclusão no curso de Direito há mais de uma década foi: Assédio Moral! Quase não havia literatura no país sobre o tema!,2015
1879,@showdavida ja até perdi o emprego por causa disso. Não aceitei o assédio do novo chefe então ele tornou minha vida um inferno no trabalho.,2015
1880,Pesquisa diz que 40% das policiais já sofreram assédio sexual ou moral: O trabalho delas é proteger as pessoas... bit.ly/1MllEJQ,2015
1881,"O Assédio Moral está em quase todos os locais de Trabalho,  Público e Privado. Não há legislação federal para proteção das vítimas!",2015
1882,@edvaldoscouto  - Qual é o perfil das pessoas que são alvo de assédio?  - São justamente pessoas que acreditam no seu trabalho  É bem assim,2015
1883,"Viu, primeiro vem o assédio sexual e depois o moral, ai você não serve mais pra nada no trabalho, é menosprezada, demitida.. #Fantástico",2015
1884,Cara...É um absurdo uma pessoa ser punida por assédio com uma simples transferência de local de trabalho. Pqp...que machismo...,2015
1885,#fantastico assédio no trabalho,2015
1886,Matéria massa do @showdavida sobre assédio no trabalho.Mas n adianta condenar se n evitarmos q isso ocorra em qualquer lugar.N só na polícia,2015
1887,Para as mulheres: você já sofreu algum tipo de assédio no trabalho?glo.bo/1oYhAQR,2015
1888,Legal que o Fantastico vai mostrar que as policiais sofrem assedio pelos próprios colegas de trabalho e têm medo de denunciar por isso,2015
1889,Tem mina q se sofrer assédio moral no trabalho tem que chegar em casa e agradecer a deus,2015
1890,"Tribunal Superior do Trabalho  #DireitodoTrabalho Após a confirmação de que está sendo vítima de assédio moral,... fb.me/27McEYlDp",2015
1891,"Hoje fui tão humilhada no trabalho, que me senti o significado do assedio moral na pele",2015
1892,EMPREGADA VÍTIMA DE ASSÉDIO SEXUAL NO TRABALHO SERÁ INDENIZADA ln.is/blogspot.com.br/2mBBQ,2015
1893,EMPREGADA VÍTIMA DE ASSÉDIO SEXUAL NO TRABALHO SERÁ INDENIZADA ln.is/blogspot.com.br/Z1xFg,2015
1894,"Violência e assédio nos locais de trabalho europeus: Causas, impactos e políticas – Eurofound goo.gl/3vmCFS",2015
1895,@Artemis_ironica + No ministerio do trabalho o q é assedio moral e v se é isso q ele faz com as pessoas e manda ver!,2015
1896,"@Artemis_ironica V se ele não ta fazdo assedio moral.e processa, se informa direitinho e reune provas vai no Minst do Trabalho e denuncia",2015
1897,Seduc disponibiliza ferramenta de combate ao assédio moral no trabalho fb.me/6w4hCfG5M,2015
1898,Jorge André Irion Jobim: EMPREGADA VÍTIMA DE ASSÉDIO SEXUAL NO TRABALHO SER... ln.is/jobhim.blogspot.com/J3…,2015
1899,Assédio Moral - Sexual no Ambiente de Trabalho |  r7.com/Ml9Y?s=t #R7 via @portalR7,2015
1900,"ABSURDO! ASSÉDIO MORAL NO TRABALHO... Saiba como empresas pressionam empregados contra Dilma, Lula e o PT ln.is/com.br/h0wyu",2015
1901,O assédio no trabalho - Centro de Estudos Judiciários goo.gl/CZAdCg,2015
1902,@AndreaSanjad @belemtransito Isso sem falar das péssimas condições de trabalho e assédio moral qdo se denuncia. #GreveACulpaÉDoJatene,2015
1903,TO: Seduc disponibiliza ferramenta de combate ao assédio moral no trabalho goo.gl/fb/m1Y4k4,2015
1904,PR: Assédio moral será tema de debate em congresso de Direito do Trabalho goo.gl/fb/gKtwsu,2015
1905,@biacall8 @frulanis @eduguim @TrabalhoGovBr A perseguição ideológica a funcionários contratados é considerado assédio moral no trabalho?,2015
1906,Seduc disponibiliza ferramenta de combate ao assédio moral no trabalho: coto.me/edE,2015
1907,Empregada temia perseguições por já ter sofrido assédio moral durante contrato de trabalho. goo.gl/OFZz6l,2015
1908,RS: Lançamento da campanha contra o assédio no trabalho goo.gl/fb/QBVcVN,2015
1909,Hoje eu e Meus colegas fomos vítimas de assédio moral no trabalho,2015
1910,Empregada vítima de assédio sexual no trabalho será indenizada -  ow.ly/KDgco,2015
1911,"Bom-dia, trabalhador! O MPT preparou uma cartilha de combate ao assédio moral e sexual no trabalho. Saiba mais: goo.gl/HY8z3P",2015
1912,"só de raiva agr todo lugar q eu sair vou dar palestra sobre assédio sexual, pq está caralha de trabalho vai ter de servir p alguma coisa",2015
1913,Participe da palestra que vai falar sobre assédio moral e acidentes de trabalho no #campusSJC: ow.ly/KvCer,2015
1914,Saber direito - TST - Empregada vítima de assédio sexual no trabalho será indenizada.,2015
1915,- Empregada vítima de assédio sexual no trabalho será indenizada oabfi.com.br/noticias.php?id…,2015
1916,- Empregada vítima de assédio sexual no trabalho será indenizada bomdia.adv.br/noticias.php?i…,2015
1917,Rio Sul: Assédio moral no trabalho riosul2012.com/2015/03/assed…,2015
1918,Empregada vítima de assédio sexual no trabalho será indenizada  A Segunda Turma do Tribunal Superior do Trabalho... fb.me/3NGvRy5IS,2015
1919,Assedio moral no trabalho - A Justica agindo corretamente conseguimos acabar com isso. Nao se cale - Denuncie ! fb.me/1EuYxyHjA,2015
1920,Assine nosso Feed Assédio moral no trabalho goo.gl/fb/xZGzYX,2015
1921,Rio Sul: Assédio moral no trabalho riosul2012.com/2015/03/assed…,2015
1922,Rio Sul: Assédio moral no trabalho pinterest.com/pin/4260124459…,2015
1923,"michelgomesvinagre.jur.adv.b…, Empregada vítima de assédio sexual no trabalho será indenizada",2015
1924,Empregada vítima de assédio sexual no trabalho será indenizada dlvr.it/93dfwJ,2015
1925,Consequências jurídico-sociais do assédio moral no ambiente do trabalho. Acesse: https://bit.ly/AssedioMoraL... fb.me/2mHDzDNTr,2015
1926,ARAUCÁRIA: Operadora de produção vítima de assédio sexual no trabalho será indenizada fb.me/1YAQjf0ZI,2015
1927,Empregada vítima de assédio sexual no trabalho será indenizada - blogdotrabalho.com/empregada…,2015
1928,Dano moral: empregada vítima de assédio sexual no trabalho será indenizada bit.ly/1bjGloD,2015
1929,"Vítima de assédio sexual no trabalho, praticada por supervisor, empregada será indenizada flip.it/reWYk",2015
1930,Empregada vítima de assédio sexual no trabalho será indenizada - fenatracoop.com.br/site/?p=6…,2015
1931,#TST Justiça do Trabalho defere indenização por dano moral a empregada vítima de assédio sexual no trabalho bit.ly/1bjGloD,2015
1932,Empregada vítima de assédio sexual no trabalho será indenizada wp.me/p3TAHX-11R,2015
1933,Empregada vítima de assédio sexual no trabalho será indenizada wp.me/p3TAHX-11R fb.me/4gMEqdJHt,2015
1934,"#TST Vítima de assédio sexual no trabalho, praticada por supervisor, empregada será indenizada bit.ly/1bjGloD",2015
1935,"#TST Vítima de assédio sexual no trabalho, praticada por supervisor, empregada será indenizada bit.ly/1bjGloD",2015
1936,Confira se você está sendo vítima de assédio moral no trabalho. fb.me/4lOsFdP6Y,2015
1937,Vítima de assédio sexual no trabalho será indenizada spbancarios.com.br/Noticias.…,2015
1938,TST: Empregada vítima de assédio sexual no trabalho será indenizada gemt.com.br/novo/index.php?c…,2015
1939,PR: Empregada vítima de assédio sexual no trabalho será indenizada goo.gl/fb/yWqVwx,2015
