,tweets,ano
2370,"@Srta_Iozzi olha a diferença de José Mayer ele assédio colega de trabalho, varias vezes. @marcos_harter falou a verdade foi mal entendido.",2017
2371,Assédio Moral? Veja mais sobre o assunto no vídeo #assediomoral #trabalho #trabalhista #assedio #direito,2017
2372,😣 é muito comum assédio moral em ambiente de trabalho. Já passei cada coisa,2017
2373,Veja aqui 6 vídeos curtos (em inglês) q denunciam assédio sexual no trabalho. Muito bons!  cosmopolitan.com/entertainme… #ThatsHarassment,2017
2374,"Evento gratuito - Inscreva-se e participe da palestra ""Prevenção e Combate ao Assédio Sexual no Trabalho""! https://lnkd.in/e2Spg8B",2017
2375,Saiba reconhecer e denunciar o assédio sexual no trabalho » https://goo.gl/s2fb11 (Via @LeiaJaOnline ),2017
2376,Gaúcha Repórter analisará hoje com o Ministério Público do Trabalho casos de assédio sexual em ambiente de trabalho A partir das 14h30,2017
2377,Saiba reconhecer e denunciar o assédio sexual no trabalho #TánoLeiaJá leiaja.me/CP35wU,2017
2378,A pena para o assédio sexual no trabalho é de um a dois anos de prisão. Denuncie qualquer caso de assedio.,2017
2379,dos relatos de assédio e constrangimentos no trabalho; hj a gerente a abusada fez eu ver os peitos dela de propósito eu quis me enterrar???,2017
2380,No podcast do Sala de Aula Entrevista você ouve a mesa redonda sobre assédio moral no trabalho. Acesse: https://goo.gl/qziEpN :D,2017
2381,Mais um vídeo de assédio no trabalho... Quando isso irá parar?  👇👇👇 fb.me/4Hs1PvaUY,2017
2382,"Saiba como identificar o assédio moral no trabalho, através deste vídeo produzido pelo G1: g1.globo.com/pernambuco/glob…",2017
2383,"No Sala de Aula Entrevista: assédio moral no trabalho, na Rádio Frispit UCS. Acompanhe agora no link :) https://goo.gl/gohWBp",2017
2384,"Salézio Stahelin, advogado, fala sobre o assédio no ambiente de trabalho https://goo.gl/S4588N",2017
2385,Assédio sexual no trabalho: mulheres contam histórias impressionantes (e frequentes) financasfemininas.uol.com.br…,2017
2386,Confira essa matéria relacionada ao assédio sexual sofrido no trabalho. Saiba como agir!   Fonte: UOL - Publicado... fb.me/17BAogNvy,2017
2387,Sua história no trabalho: https://goo.gl/forms/0onEwa3XopX3whj82  Sua história na faculdade ou na escola: https://goo.gl/forms/rVqkk584Rjh7xdpn1 #assedio #violencia,2017
2388,Uma menina vende docinho na passarela da frente do meu trabalho e não tem UM dia que ela não esteja sofrendo assédio! EU ODEIO HOMENS!,2017
2389,Assédio moral no trabalho é tema de palestras no TRT de Goiás rotajuridica.com.br/assedio-…,2017
2390,Cês sabem identificar os limites da educação e do assédio no trabalho?,2017
2391,Acabei de sofrer o assedio mais fodido da minha vida no trabalho...... nenhum dos meus superiores fez nada a respeito,2017
2392,Cabe fácil um processo de assédio moral no Doriana.... mas só enquanto existe Justiça do Trabalho,2017
2393,"Entrei num debate sobre assédio aqui no trabalho. Evito essas discussões, mas ouvir ""Coitado do Zé Mayer"" foi a gota d'água! Não aguentei!",2017
2394,"Sobre assédio no trabalho. Já passei por isso,na frente de várias pessoas.constrangedor ser diminuído na sua capacidade entre outras coisas",2017
2395,Assédio moral no trabalho. Quer saber mais sobre o assunto? Clique em: tiagoaquines.blogspot.com.br… #direito #trabalhista #assedio #trabalho,2017
2396,💁🏼 PASSA NA LIVE 💁🏼 ASSÉDIO NO TRABALHO https://youtu.be/H64GBTr7wec via @YouTube,2017
2397,e não coloquem feminismo em balaio q nao tem nada a ver  assédio moral no trabalho é real. ng tá usando feminismo p defender a sonsinha,2017
2398,"@bandjogoaberto Humor machista diário @denilsonshow, soa como propaganda e assédio moral às mulheres, colegas de trabalho e público feminino",2017
2399,Demita uma pessoa do seu trabalho e exponha ela num vídeo do YouTube. Se isso não for assédio moral eu preciso rever meus pontos de vista,2017
2400,MG:  Defensora pública debate assédio sexual no trabalho no programa Panorama bit.ly/2pcYQq2,2017
2401,"O material da palestra ""Assédio moral, dano moral e assédio sexual no trabalho"" já está disponível para download: migre.me/wsqoj",2017
2402,Tombada com o prêmio do programa. .tombada com todo assédio e propostas de trabalho!! Parem que tá feio isso 👫👑🏆,2017
2403,"MACHISMO | Apesar de nem sempre ganhar repercussão, o assédio sexual no local de trabalho é extremamente comum.... fb.me/VEfnSFlx",2017
2404,"É lógico o Danilo Gentili é patrão dela, as vitimas de assédio no trabalho sempre tem medo de denunciar, cade o MP ?",2017
2405,Ótica de João Pessoa é condenada por assédio sexual — Tribunal Regional do Trabalho 13ª Região - Paraíba fb.me/1PBeeNmuc,2017
2406,A última frase do meu trabalho de machismo/ assédio sexualmente foi:,2017
2407,Jornalistas contra o assédio: “debate precisa conquistar o ambiente de trabalho”   correiocidadania.com.br/poli…,2017
2408,"Assédio sexual no trabalho não vou sofrer, todos são gays e super gente boa ❤",2017
2409,Humm caso se repita tipo ter de assistir um CDZ: A Lenda do Santuário por exemplo já pode caracterizar assédio moral no trabalho. 🤣🤣🤣🤣,2017
2410,Falar sobre relacionamento abusivo é todo dia agora assédio em local de trabalho eu ainda não vi uma pauta,2017
2411,Queria a pauta do encontro sobre assédio em local de trabalho,2017
2412,"""Assédio Sexual no Trabalho"", circa 2000, cartoonized",2017
2413,"Porque nos sentimos frágeis e indefesas diante de um #assédio, seja na rua ou no próprio trabalho?:???",2017
2414,"Assédio moral ou sexual, saiba como reconhecer e combater esses crimes no ambiente de trabalho. No #JM @portalcultura.",2017
2415,"Trabalho na PETROBRÁS, não sabemos se iremos chegar? E muito menos se iremos sair? fb.me/8ASg1FdBj",2017
2416,"Se sou minha chefa e tô me sentindo ansiosa,c/ receio,dúvidas d como iniciará a semana de trabalho,isso è auto-assédio moral?q cabe ao caso?",2017
2417,. O Golpe Escancarado   Assédio Psicológico Coletivo  Ameaça Justiça do Trabalho  Diz Magistrado Trabalhista  viomundo.com.br/voce-escreve…,2017
2418,"""você já sofreu alguma assédio no trabalho?"" ""nunca sofri, acho que meu profissionalismo foi mais alto"" E O CU C AS CALÇAS",2017
2419,Pq o tema n é assedio sexual no trabalho.? Q horror! #bbb17 https://twitter.com/vaidesmaiar/status/853781078217281537,2017
2420,"Galera, sigam esse perfil: @assedionaomais  É pra um trabalho de inglês sobre assédio",2017
2421,@Elianekarol assedio moral como causa de rescisão indireta do contrato de trabalho,2017
2422,Jorge Souto Maior: Assédio psicológico coletivo ameaça Justiça do Trabalho; o golpe escancarado - Viomundo - O... fb.me/8KzsTrHXl,2017
2423,Mulheres que denunciaram assédio no trabalho contam que tiveram problemas para serem ouvidas sul21.com.br/jornal/mulheres… via @jornalsul21,2017
2424,"Assédio não afeta só a vítima, mas todos no trabalho, diz especialista dos EUA sobre caso José Mayer  ""Em casos... fb.me/92qydTSBN",2017
2425,Mulheres que denunciaram assédio no trabalho contam que tiveram problemas para serem ouvidas sul21.com.br/jornal/mulheres… via @jornalsul21,2017
2426,Jorge Souto Maior: Assédio psicológico coletivo ameaça Justiça do Trabalho; o golpe… https://evsarteblog.wordpress.com/2017/04/14/jorge-souto-maior-assedio-psicologico-coletivo-ameaca-justica-do-trabalho-o-golpe-escancarado-viomundo-o-que-voce-nao-ve-na-midia-2,2017
2427,Jorge Souto Maior: Assédio psicológico coletivo ameaça Justiça do Trabalho; o golpe… https://evsarteblog.wordpress.com/2017/04/14/jorge-souto-maior-assedio-psicologico-coletivo-ameaca-justica-do-trabalho-o-golpe-escancarado-viomundo-o-que-voce-nao-ve-na-midia,2017
2428,"Estão passando por um turbilhão de coisas, polícia, inquérito, assédio, trabalho, gente se metendo na vida deles",2017
2429,Programa #EmSuaDefesa recebeu Dr. Marcos Vieira que explicou como identificarmos quando estamos sofrendo Assédio Moral no Trabalho.,2017
2430,"""Jorge Souto Maior: Assédio psicológico coletivo ameaça Justiça do Trabalho; o golpe escancarado"" viomundo.com.br.ln.is/2ah80 #informações",2017
2431,"O que tem de bonita tem de sem noção e hipocrita.Depois diz que é contra assédio,violência.Mas quando é um colega de trabalho q faz...+",2017
2432,Eu tô fazendo um trabalho sobre assédio e tô lendo aqui e o índice de HOMENS assediados é grandioso.,2017
2433,Assédio no trabalho🙈 fb.me/5qxDiY7n1,2017
2434,Jorge Souto Maior: Assédio psicológico coletivo ameaça Justiça do Trabalho; o golpe escancarado dlvr.it/NtnQPQ via @VioMundo,2017
2435,Jornalistas contra o assédio: “debate precisa conquistar o ambiente de trabalho” correiocidadania.com.br/poli…,2017
2436,"O assédio no local de trabalho continua a constituir preocupação para a juventude, sobretudo para quem pretende... fb.me/8AyQnAQDA",2017
2437,"Absurdo mais ainda é uma realidade no Brasil! Também nas cidades, falta de condições minima de trabalho e assédio!!!",2017
2438,O que caracteriza #assédio no trabalho??? @trabalho @JusticaGovBR @Psiconlines,2017
2439,Justiça do Trabalho condena Itaú a pagar R$ 1 milhão por assédio moral fb.me/6L7VtpizT,2017
2440,'ASSÉDIO MORAL - PESADELO NO TRABALHO'. Colabore você também! bit.ly/2p5xNtg  via @Kickante #crowdfunding #financiamentocoletivo,2017
2441,"alem de mostrar que qualquer ambiente pode ser hostil, casa, escola trabalho, alem de botar em pauta depressão, assédio, estupro, estigmas",2017
2442,Assédio sexual no trabalho. fb.me/6QDwHFKSR,2017
2443,Imagina o potencial de processo por assédio moral esse trabalho não tem! 😱,2017
2444,"não é modinha, ela não quer aparecer, ela sofreu assédio e quando denunciou isso foi demitida do seu trabalho ISSO É MUITO SÉRIO",2017
2445,Bom dia!   Preciso de alguém  que tenha sofrido assedio moral no trabalho para participar de uma matéria na TV.... fb.me/1T59FZDuG,2017
2446,Assédio sexual no trabalho: vítimas do ES relatam pedido de beijo e comentários sobre partes íntimas dlvr.it/NtKjvB,2017
2447,"Assédio sexual no mercado de trabalho. Hoje, na #cultura #pesquisa #InstitutoLocomotiva @ São… https://www.instagram.com/p/BS00L_Ql7XO/",2017
2448,"Não sei quem é pior: quem fala que assédio é  besteira e q lei q defende mulher vai  ""fechar""portas  no mercado do trabalho  OU",2017
2449,"""Assédio no Trabalho"" 😱😂 fb.me/1PQsjNcnB",2017
2450,Assédio no trabalho: youtu.be/VyLU0rW-zj0?a via @YouTube,2017
2451,Assédio sexual no trabalho: vítimas do ES relatam pedido de beijo e comentários sobre partes íntimas dlvr.it/Nt3Lwh,2017
2452,O assédio moral e sexual no ambiente de trabalho é mais comum do que se pensa. fb.me/6lChARmE7,2017
2453,mas já sofri assédio moral por colegas de trabalho por causa de tatuagem,2017
2454,"Após acusação de José Mayer, tire 5 dúvidas sobre assédio no ambiente de trabalho  O Presidente da AMATRA IV,... fb.me/89IEjSvE9",2017
2455,#BetaAjudaBeta Mais um vídeo de assédio no trabalho. Quando isso irá parar?  👇🏻👇🏻👇🏻,2017
2456,"O maior ponto negativo do meu trabalho não é ter q trabalhar em feriado não, é esse assédio que não acaba  Simplesmente  Não  Acaba",2017
2457,"#pordentrocomcardinot @Cardinot Após escândalo com ator Global, se liga ai.  Mais um flagra de assédio no trabalho. 😫 👇🏻Curte::#PortaldaVoVo",2017
2458,"@MarcaoTV Após escândalo c/ator Global, se liga ai.  Mais um flagra de assédio no trabalho.😫😂😂 Quando isso irá parar? 👇🏻 Curte:#PortaldaVoVo",2017
2459,#jogoaberto Denilson o José Mayer foi denunciado por assédio por colegas de trabalho  cuidado heim!!!,2017
2460,Mais um vídeo de assédio no trabalho. Quando isso irá parar?  😁😂😃😅😆👇👇👇👇👇 fb.me/20ttlfuiR,2017
2461,"""Mais uma cena de assédio no trabalho,  qdo é q isso vai parar? "" by @gilvanroots  Hehehehe",2017
2462,Mais um vídeo de assédio no trabalho. Quando isso irá parar?  👇👇👇😆😆😆😆😆,2017
2463,"Assédio sexual é uma parada tão nojenta, que você pode ser assediada, no trabalho, com palavras, no médico, com ""amigos"" é puxado!",2017
2464,Mais um vídeo de assédio no trabalho. Quando isso irá parar?,2017
2465,Mais um vídeo de assédio sexual no trabalho. Aonde isso vai parar?!,2017
2466,"Depois de muito trampo, muito assédio, muita vergonha, muito trabalho e sentimentos ruins, chegou a hora do meu descanso",2017
2467,Mais um caso de assédio no trabalho.  Quando isso irá parar?  👇🏼👇🏼👇🏼👇🏼👇🏼👇🏼,2017
2468,Boa!!! RT @ivamcabral: Assédio no trabalho,2017
2469,Assédio no trabalho fb.me/U6lC4B6W,2017
2470,Não se deve silenciar a violência ocasionada pelo assédio moral no ambiente de trabalho. goo.gl/pJlSJ0 fb.me/43ZKQVzEi,2017
2471,Assédio no trabalho,2017
2472,Explica por favor  Zé Mayer assédio varias colegas de trabalho e descobriram só agora pq não tinha câmera #EmillyCampea,2017
2473,Gostei de um vídeo @YouTube ln.is/www.youtube.com/n70Sh ASSÉDIO NO TRABALHO - Jean-Luca,2017
2474,Mais um vídeo de assédio no trabalho. Quando isso irá parar?  👇🏻👇🏻👇🏻,2017
2475,Assédio sexual no trabalho!!! Onde vamos parar?????,2017
2476,Até quando vai continuar o assédio no trabalho .... compartilhem até que essa vaca seja encontrada ....😂😃😀😅😂😃 fb.me/6lUnw2LPw,2017
2477,"mais um episódio de assédio no trabalho,,, ATÉ QUANDO???",2017
2478,Mais um vídeo de assédio no trabalho. Quando isso irá parar?  👇🏻👇🏻👇🏻,2017
2479,"Dra. Cinthya Rios, isso poderia ser considerado assédio sexual no ambiente de trabalho? fb.me/1ArXKqUtD",2017
2480,#EuViviUmRelacionamentoAbusivo Mais um vídeo de assédio no trabalho. Quando isso irá parar?  👇🏻👇🏻👇🏻,2017
2481,Assédio moral no trabalho é tema de palestras sobre Trabalho Seguro no TRT de Goiás bit.ly/2p40WVO,2017
2482,"Assédio sexual no trabalho: convidadas explicam o que caracteriza o crime de assédio e o que as mulheres devem fazer. Panorama, 19h30.",2017
2483,@zeluizlhesdiz  Mais um vídeo de assédio no trabalho. Quando isso irá parar?  👇🏻👇🏻👇🏻,2017
2484,Mais um vídeo de assédio no trabalho. Quando isso vai parar? fb.me/6TNGtMoHy,2017
2485,Mais um vídeo de assédio no trabalho. Quando isso irá parar? fb.me/8MRZA38LT,2017
2486,"Mais um vídeo se assédio no trabalho, quando isso vai parar?",2017
2487,O assédio é em qualquer ambiente de trabalho. É péssimo.,2017
2488,Mais um vídeo de assédio no trabalho. Quando isso irá parar?  👇🏻👇🏻👇🏻,2017
2489,Mais um vídeo de assédio no trabalho. Quando isso irá parar?,2017
2490,"Seja no BBB, seja na faculdade, na escola, na rua, no trabalho, quando um assédio, estupro, opressão repercutir,... fb.me/1iLJLm4uO",2017
2491,Mais um vídeo de assédio no trabalho. Quando isso irá parar?  👇🏻👇🏻👇🏻 fb.me/7iuk09CNj,2017
2492,"Aí pessoas ""Mexeu c/1, Mexeu c/Todas"" Mais 1 vídeo de assédio no trabalho. Quando isso irá parar?  Já ia me esquecendo: #LulaEDilmaNaCadeia",2017
2493,"Chega de Assédio! 👩 👱 👧 👵 Todas as mulheres precisam ser respeitadas em casa, na rua, no ônibus, no trabalho, em... fb.me/1lQsCT3yg",2017
2494,Mais um vídeo de assédio no trabalho. Quando isso irá parar?  👇🏻👇🏻👇🏻,2017
2495,Mais um vídeo de assédio no trabalho. Quando isso irá parar??? fb.me/R0EB9QNm,2017
2496,Mó legal meu ambiente de trabalho. Pessoas se elogiam se chamando de Trump e Bolsonaro. E fazem brincadeira sobre assédio e agressão. Nice.,2017
2497,Assédio moral no trabalho é tema de palestras sobre Trabalho Seguro no TRT de Goiás bit.ly/2p40WVO,2017
2498,Mais um vídeo de assédio no trabalho. Quando isso irá parar?  👇🏻👇🏻👇🏻 fb.me/6FFGBZPcD,2017
2499,Mais um vídeo de assédio no trabalho. Quando isso irá parar?  👇 👇 👇 👇 👇 👇 👇 👇 fb.me/xnc5gl0O,2017
2500,Assédio moral no trabalho é tema de palestras sobre Trabalho Seguro no TRT de Goiás goo.gl/Ctbj1M,2017
2501,Mais um vídeo de assédio no trabalho. Quando isso irá parar?  👇🏻👇🏻👇🏻,2017
2502,Mais um vídeo de assédio no trabalho. Quando isso irá parar?: youtu.be/2PfFYOB8S50?a via @YouTube,2017
2503,Aqui no trabalho varias rodas discutindo assedio nos relacionamentos e finalmente pudemos passar a visão feminina.,2017
2504,"Assédio moral no trabalho, você ainda vai sofrer disso! Aff #assedio #assediomoral #assediomoralnotrabalho",2017
2505,"Mas feminismo não é mimimi e vitimismo? Assédio no ambiente de trabalho contra as mulheres é tão comum no Brasil, pensa que só vcs não vêem",2017
2506,@CamilaPitanga Parabéns pelo protesto contra o assédio!!! Tb já fui assediada em local de trabalho... ah se eu tivesse aberto a boca!!!,2017
2507,https://curiouscat.me/_nina  hoje quero dicas de como superar o assédio moral no ambiente de trabalho.,2017
2508,https://twitter.com/Srta_Iozzi/status/851526064006451203 Empregadas da Globo q Permite Assédio no Local d Trabalho Vão Aderir à #GreveGeral dxs Trabalhadorxs? É #28deAbril.,2017
2509,O assédio comum no ambiente de trabalho...rs,2017
2510,Flagrante de assédio no ambiente de trabalho....se eu fosse esse cara pedia a cabeça dessa vaca! kkkkkkkkkkk........ fb.me/6gXAE0yfa,2017
2511,Mais um caso de assedio sexual no trabalho !!!! Ate quando a sociedade vai aceitar isso ?!?!,2017
2512,"Pq assédio moral em ambiente de trabalho tb é agressão. +1 vez,parabéns @IMedicis p tocar em temas assim d forma tão natural #RockStory",2017
2513,@GABRIELPlNHEIRO  Mais um vídeo de assédio no trabalho. Quando isso irá parar?  👇🏻👇🏻👇🏻,2017
2514,Discuti c o menino aq do trabalho pq ele disse Q VC MEXER C UMA MULHER NA RUA N EH ASSÉDIO E SIM DESEJO EU TÔ SÓ????! Vai tomar no cu,2017
2515,age of youth tratando de relacionamentos abusivos e assédio sexual no ambiente de trabalho todos deveriam ver,2017
2516,"Na mesma noite, as mesmas pessoas estavam ao mesmo tempo indignado com um caso de assédio no BBB e acharam engra um assédio no trabalho",2017
2517,Programa da @tvalmg debate assédio sexual no trabalho e mostra o q as mulheres devem fazer p/ denunciar esses casos. bit.ly/2oYDuwd,2017
2518,Se a gente esquecer por um minuto  SS é homem e RS mulher será q surge empatia no fato de q houve assédio moral no ambiente de trabalho?,2017
2519,"O assédio está em qualquer lugar. Inclusive, no trabalho. Fiquem atentas!",2017
2520,"Ainda me vou dar ao trabalho de ler as queixas trabalhistas que esse bosta tem, só pra ver se alguma tem a ver com assédio moral",2017
2521,Mais um vídeo de assédio no trabalho. Quando isso irá parar?  👇🏻👇🏻👇🏻 fb.me/3vxhA07G2,2017
2522,Será que meu colega de trabalho não tá pedindo um processo por assédio moral? Pq eu adoraria fazer isso,2017
2523,"sofre assédio e tentativa de estupro no trabalho, denuncia e entra na justiça…q arbitra indenização de mil reais. não paga nem os remédios.😡",2017
2524,"Isso tem um nome no Direito do Trabalho: chama-se Assédio Moral! Cadê o Sindicato dos Jornalistas e o MPT? Ah, esqueci! Ela é de ""direita"".",2017
2525,Assédio Moral Explícito em Público do Empregador Sobre a Empregada evidenciando a Relação Desequilibrada d Poder do Capital Sobre o Trabalho,2017
2526,DIREITO DO TRABALHO: Mantida indenização a trabalhadora que sofreu assédio moral por ser transexual  Saiba mais... fb.me/xceEHOVN,2017
2527,"Por mais difícil que seja, hoje é dia de se solidarizar com a Rachel Sherazade. Assédio conta mulheres no trabalho não pode ser tolerado",2017
2528,"Mesmo com experiências próprias de assédio moral e machismo no trabalho, a pessoa reaça não toma consciência. https://twitter.com/RachelSherazade/status/851329307406413824",2017
2529,Assista o documentário A dor (in)vísivel - Assédio moral no trabalho! #corenpe #cofen #ambientedetrabalho... fb.me/Zgtw0yAW,2017
2530,"queridos seguimores, vamos combater o assédio sexual no trabalho? nos ajude curtindo nossa página https://m.facebook.com/MeuTrabalhoNaoeUmConvite/",2017
2531,existe assédio moral no trabalho.. mas o que houve?,2017
2532,"Não gosto da shera, mas aquilo foi assedio moral. Se ele tinha algo a reclamar do trabalho dela falasse em particular, expor assim foi Uo.",2017
2533,"Tenho tanto material para aula de hoje, cujo assunto é ética no ambiente de trabalho e assédio moral/sexual q preciso de 6 horas o.O",2017
2534,Seus direitos estão garantidos na Justiça do Trabalho: discriminação no trabalho-assédio #JustiçaNossoTrabalho,2017
2535,Seus direitos estão garantidos na Justiça do Trabalho: discriminação no trabalho-assédio #JustiçaNossoTrabalho,2017
2536,"Todo tipo de assédio é inaceitável, mas no trabalho e no ambiente familiar é despedaçador.",2017
2537,"Ademais, concordo q ele foi machista e q rolou assédio ali. Super errado! Mas, quem nunca sofreu isso no trabalho q atire a 1° pedra.",2017
2538,Acho o Silvio um mito e não gosto do trabalho da Sheherazade. Mas foi extremamente desnecessária a postura dele. Isso é assedio moral.,2017
2539,foi assédio moral. Isso dá processo na justiça do trabalho e ela ganha fácil. Foi constrangedor,2017
2540,"Foi sim, eu me senti mal por ela. Se ele não gosta do trabalho dela, que a demita, mas expor publicamente uma pessoa é assédio sim!",2017
2541,Especialista explica como identificar e denunciar assédio moral no trabalho  bit.ly/2nL6OSd,2017
2542,Assédio é outra coisa. A proteção contra ele é um direito difuso. Especialmente no ambiente de trabalho. A tutela do abuso é individual.,2017
2543,"ESSA CAMPANHA É PARA ASSÉDIO SEXUAL, PRINCIPALMENTE NO TRABALHO. TANTO NO CASO DO QUANTO DA MARI É VIOLÊNCIA. FALTA DE RESPEITO.",2017
2544,"eu n to diminuindo o assédio de ngm, isso é um fato, lá no trabalho é assim, a minha sorte (??????) é q n é assédio sexual",2017
2545,"Assédio não afeta só a vítima, mas todos no trabalho, diz especialista dos EUA sobre caso José Mayer ln.is/www.bbc.com/portugue/T…",2017
2546,O próximo cara que colocar a mão no meu ombro no trabalho vai tomar uma chamada. Pelo que entendi é assédio e não sou homossexual.,2017
2547,"Assédio não afeta só a vítima, mas todos no trabalho, diz especialista dos EUA sobre caso José Mayer bbc.in/2nmO7J7",2017
2548,Mulheres relatam casos de assédio durante o ambiente do trabalho e famosos fazem campanha #DomingoEspetacular,2017
2549,Fica difícil quando se não separar um direito difuso contra o assédio nas relações de trabalho e o direito individual contra a mesma coisa.,2017
2550,Como Neutralizar o Assédio Moral e a Perseguição no seu “Trabalho” seja ele Privado ou Público? fb.me/5RvR4lTp0,2017
2551,"Após denunciar chefe por assédio, jovem ganha festa dos colegas de trabalho para humilhá-la superpsicoeducador.blogspot.…",2017
2552,"Fã-clube, assédio, pouco trabalho e recado: veja, em fotos, o retorno do goleiro Fábio j.mp/2of4TXP |HD|  #Cruzeiro ℹ",2017
2553,Assédio sexual no trabalho vítimas do ES relatam pedido de beijo e comentários sobre partes íntimas youtu.be/wjcs5HAiejk?a,2017
2554,. Assédio Moral no Trabalho  O Toyotismo Criou a Cobrança de Metas do(a) Trabalhador(a).  periodicos.ufpb.br/index.php… conjur.com.br/2013-mai-20/em… .,2017
2555,Alguém conta p @VEJA q nao é só mulher q sofre assédio no trabalho. Só é mais grave pq sao mais frágeis fisicamente.,2017
2556,"""Assédio não afeta só a vítima, mas todos no trabalho, diz especialista dos EUA sobre caso José Mayer"" bbc.ln.is/9jzhH #mustread",2017
2557,Assédio sexual no trabalho: vítimas do ES relatam pedido de beijo e comentários sobre partes íntimas dlvr.it/NrVMsZ,2017
2558,"Se essa foto é assédio, todos nós somos assediados todos os dias no trabalho. PUTA QUE PARIU",2017
2559,Assédio sexual no trabalho: vítimas do ES relatam pedido de beijo e comentários sobre partes íntimas dlvr.it/NrV9rK,2017
2560,Assédio sexual no trabalho: vítimas do ES relatam pedido de beijo e comentários sobre partes íntimas,2017
2561,"Assédio não afeta só a vítima, mas todos no trabalho, diz especialista dos EUA sobre caso José Mayer bbc.in/2nmOjrT",2017
2562,Assédio sexual no trabalho: vítimas do ES relatam pedido de beijo e comentários sobre partes íntimas dlvr.it/NrV9XF,2017
2563,Assédio sexual no trabalho: vítimas do ES relatam pedido de beijo e comentários sobre partes íntimas dlvr.it/NrV9Vs,2017
2564,#timbeta #globo Assédio sexual no trabalho: vítimas do ES relatam pedido de beijo e comentários sobre partes íntimas  …,2017
2565,"New post: ""Assédio sexual no trabalho: vítimas do ES relatam pedido de beijo e comentários sobre partes íntimas "" ift.tt/2nuwCXs",2017
2566,Assédio sexual no trabalho: vítimas do ES relatam pedido de beijo e comentários sobre partes íntimas ift.tt/2nXRXEF,2017
2567,"Existem muitas mulheres passando por relacionamentos abusivos, assédio no trabalho e n sabem o q fazer nem como lidar. Seja solidária.",2017
2568,"Principalmente agora que tem tantos casos de assédio, violência doméstica com contratados da emissora...não basta afastar do trabalho",2017
2569,Jovem denuncia chefe por assédio no trabalho e funcionários fazem festa para humilhá-la fb.me/yLQFaFAH,2017
2570,"Na época aqui no BR ninguém falava sobre isso, o mais perto q falavam era assédio moral (mas mais no trabalho q no ambiente escolar)",2017
2571,"Concordo com suas palavras, ja sofri assedio em meu local de trabalho. Pedi imediatamente que retirasse e... fb.me/tctq7EZt",2017
2572,Como Neutralizar o Assédio Moral e a Perseguição no seu “Trabalho” seja ele Privado ou Público? fb.me/8D9fgt5qR,2017
