,tweets,ano
563,"Mano kkk, na hora que falei que trabalho no jornal, ele vazou. E pelo local que ele estava saindo, penso que ele pode ser um político. Aah mas eu amaria escrever sobre assédio de um político e acabar com oq ele faz a anos na região",2017
564,"Já sofri assédio várias vezes até mesmo no trabalho, e questão de abuso sexual nunca foi certo e precisa ser banido do nosso cotidiano. Mas essa revolta para com nós homens no geral não é justo.",2017
565,Encostei minha cabeça no ombro do meu chefe agora posso ser processado e demitido por assédio no trabalho,2017
566,"Alguém já sofreu assédio? Contem pra mim, é pro meu trabalho de TV1.",2017
567,Ontem eu fiz esta postagem e hoje fico feliz por Amell e Gustin terem se manifestado condenando os atos de assédio e apoiando as colegas de trabalho.,2017
568,"Para qm não entendeu: o assédio está em um cara fazer esse tipo de pergunta a outra num ambiente de trabalho para uma pessoa que além de estar trabalhando tbm é casada. Vcs se fazem de idiota para passar pano em assediador, me poupa!",2017
569,"Se não for lei, funcionário já entra com processo trabalhista contra a empresa que cometeu “assédio moral” em não deixar ele usar o WhatsApp no horário de trabalho.",2017
570,acabei de fazer um compilado com várias acusaçoes de assedio pra o meu trabalho de sociologia,2017
571,1 a cada 3 mulheres relata desproteção para reportar assédio no trabalho bit.ly/2yy3T5h,2017
572,1 a cada 3 mulheres relata desproteção para reportar assédio no trabalho bit.ly/2yy3T5h,2017
573,1 a cada 3 mulheres relata desproteção para reportar assédio no trabalho bit.ly/2yy3T5h,2017
574,BRUCE WAYNE É ACUSADO DE ASSÉDIO SEXUAL DENTRO DO AMBIENTE DE TRABALHO; CONFIRA https://twitter.com/omelete/status/930191016430325762,2017
575,O melhor desse monte de denúncia de assédio em Hollywood é q agora serão obrigados a contratar mulheres pra fazer lindamente o trabalho desses lixos,2017
576,Isto está de uma maneira que ao sair do trabalho disse à minha colega de escritório até amanhã e ela percebeu até de manhã e diz que me vai por um processo por assédio.,2017
577,"uma ótima forma de evitar que seu artista preferido pratique assédio, é consumir trabalho feito por mulheres.  de nada.  por hoje é isso.",2017
578,"O motorista veio perguntar se estou malhando pernas e bunda, falei que sim e ele disse pra eu continuar pq tá ficando bonito. Quando eu falo que sofro assédio no trabalho ninguém acredita.",2017
579,"Relação profissional sem hierarquia não é assédio. Além disso, qts relações amorosas já foram criadas em ambiente de trabalho?",2017
580,"Por outro lado a gente sabe que é puro interesse e que no século 21 tu não pode ter teu trabalho vinculado a casos de assédio porque ativismo vende, mas arrastar eles pra fora já é um começo",2017
581,@Blakei O assédio sexual no local de trabalho não é um problema das mulheres É também um problema dos homens Se estás numa empresa tens de ajudar a resolver isso É um problema de todos! @WebSummit Respeite os Direitos humanos da mulher!,2017
582,@SusanHermanACLU É preciso ter um tratamento inclusivo as mulheres tem que receber um salario justo e que não seja discriminada pelo fato de ter nascido mulher O assedio no trabalho aumenta quando as pessoas sabem o que está a acontecendo e não fazem nada @WebSummit,2017
583,"E agora umas fãs encontraram uns tweets antigos da Sophia/Hilarie (de outubro, na vdd) falando sobre assédio, da possibilidade de você conhecer alguém no seu trabalho que faz/fez isso (acabei de dar RT)",2017
584,"O colega de trabalho dele nas séries do Arrowverse está sendo acusado de assédio sexual por 15 mulheres e 4 homens, mas ele está mais preocupado em apontar ""sexismo reverso"". Que nojo.",2017
585,É foda ver um cara que tu curte demais o trabalho ser um merda total e cometer assédio sexual,2017
586,"Entendi. Fica complicado trabalhar com uma pessoa acusada de assédio, ainda mais um trabalho com alcance mundial...olha a repercussão disso. Ela não é boba e sabe da melhor alternativa",2017
587,Assédio no trabalho à espera da actualização da lista das doenças profissionais - Home Page Jurídica https://www.homepagejuridica.pt/noticias/1194-assedio-no-trabalho-a-espera-da-actualizacao-da-lista-das-doencas-profissionais via @BowThemes,2017
588,"Não foi de repente, foi ao longo do tempo, ano após ano sofrendo assédio de familiares, vizinhos, chefes, colegas de trabalho, desconhecidos na rua, padres, médicos e etc..Pergunte para as mulheres que o cercam quantas piadinhas nojentas elas já ouviram. De repente vai entender.",2017
589,"Na onda do Assédio Sexual quando começarem as denuncias do mundo corporativo, Empresários, Gestores e Colegas de trabalho se cuidem!!!! 😂",2017
590,"O jornal Diário da Manhã deste sábado, 11, destacou o 7º encontro em Defesa e Valorização que realizamos na última segunda-feira, 06, em parceria com a Unifan. Com o tema ""Assédio no ambiente de trabalho”, o evento reuniu profissionais e especialistas no tema.",2017
591,"Meu trabalho tá muito bem servido, só espero que olhar não conte como assédio",2017
592,"Que pouca vergonha,  isso é assédio sexual. Vcs estao em horário de trabalho",2017
593,"Pena q os trabalhos “foda” que deram fama e prestígio a ele foram feitos a custa de abuso de poder, assédio e constrangimento com os coleguinhas de trabalho 🤷🏾‍♀️",2017
594,#FireKreisberg mas ele cometeu o assédio no LOCAL DE TRABALHO por tanto faz parte da vida profissional e agora ainda não importa ? https://twitter.com/ThePaulinSouza/status/929423989851770880,2017
595,"Mas caras, boa parte do assédio foi em ambiente de trabalho, e no caso é o set de filmagem e adjacências. E se não tiver esse tipo de atitude (por mais ligada a grana que seja), se passa um pano gigante.",2017
596,"Vai toma no cu, se rola assédio em local de trabalho onde o cara ganha 2 mil reais a mais que tu porque ele acha que tem esse direito, imagina um cara que é presidente de uma das maiores instituições do mundo, a maior do futebol... Não tem porque a mina inventar o assédio.",2017
597,É tanta notícia de assédio sexual no trabalho. Agora um caso ocorrido em 1990.  Já existe um conceito geral sobre qdo  ñ é consensual o “flerte” ⁉️,2017
598,"''o poder do sujeito'' Q poder ele teria, o caso iria repercutir do msmo jeito, porém dentro da lei, ele deveria ter entrado com assédio moral, e ele ainda tinha como provar, humilhação e constrangimento no trabalho existe e tem q ser falado.",2017
599,"É isso que eu chamo um assunto DELICADO: Fausto Brizzi [Poveri Ma Ricchi] é acusado de assédio, suspende trabalho e Lodovica declara: ""comigo sempre foi gentil, destacado e profissional. Ele nunca me deu uma maneira de pensar o contrário e nunca teve uma atitude inadequada""",2017
600,"Não estou tirando isso de jogo,  humilhação e constrangimento no trabalho tem que ser avisado, assédio moral sempre existiu e no caso dele, ele tinha como provar ainda, é assim q se resolve as coisas, dentro da lei, não roubando fitas e fazendo isso depois q esta desempregado.",2017
601,"Quero também deixar uma palavra de esperança aos gabirus do assédio: com elogios focados na competência e no desempenho profissional consegui obter resultados magníficos com colegas de trabalho. Sim, é possível.",2017
602,Quando o assédio moral no trabalho é tão grande que você não sabe como prosseguir,2017
603,"ñ precisa, mas eles precisariam pedir e não informar q iam conversar. No trabalho da pessoa, sem a pessoa marcar é assédio",2017
604,Toda a gente se queixa de assédio sexual no local de trabalho.  Ou isto começa a ser verdade ou então despeço-me!!!,2017
605,"Assédio e abuso no local de trabalho tem que ser investigado e, os culpados, punidos.",2017
606,"#écoisadebranco, é o presidente fake que tentou facilitar o exercício do trabalho escravo, é a volta do primeiro damismo,é político dando as nossa nossas riquezas de bandeja.  É a sociedade,misogina,que acha que vítima  podia evitar o estupro ou o assédio.",2017
607,"Te pergunto, qualquer um recebe a verba do partido igual? Quantos homens tem que se afastar do trabalho pq estão gravidos? Quantos homens sofrem assédio sexual no trabalho? Quantos % o homem receba a mais que a mulher? Quantos ""donos de casa"" vc conhece vs. Quantas donas?",2017
608,"A próxima novela das nove, ""De Volta Pra Casa"", vai abordar o assédio sexual no ambiente de trabalho através da personagem de @Nandacostareal  No folhetim, Nanda será a intérprete de Maura, uma policial que sofre ao ser perseguida de forma incansável por um colega de trabalho.",2017
609,"Todas essas notícias de assédio, violência sexual. Minha vontade é quebrar cadeira da cara do misógino do trabalho. Só pra descontar a raiva",2017
610,"Há algum tweet alusivo ao tema ""assédio/violência das mulheres sobre os homens"" que não pareça ter sido escrito por um atrasado mental? É para um trabalho.",2017
611,"O homem é muitas vezes vitima de assédio,seja na rua ou no local de trabalho,ficamos calados porque é suposto ser uma vergonha um homem queixar-se,elas mesmo,perante uma recusa acusam-nos de ser gays!",2017
612,"Assédio moral é característica de trabalho em que o patrão tem muito mais poder. O sexual só é menos por conta do ônus social (especialmente o homossexual, fora de indústrias específicas como a cultural).",2017
613,A lei contra assédio sexual em ambientes de trabalho deveria se chamar Lei José Mayer,2017
614,O perigo do assédio moral no ambiente de trabalho - O Maior Portal de Notícias para RH https://lnkd.in/emfvYwK,2017
615,Hoje o dia já começou com assédio na rua antes das 7h da manhã. É IMPRESSIONANTE como ser babaca é um trabalho full time pra homem né gente que isso,2017
616,"*um homem é acusado de assédio sexual por mulheres*: segue a vida, com pouco ou nenhum prejuízo em sua carreira *um homem é acusado de assédio sexual por outros homens*: é demitido de todos seus empregos e ainda é APAGADO completamente de um trabalho já PRONTO pra lançamento",2017
617,sobre as pessoas não validarem quando alguém comete assédio sexual contra gays no ambiente de trabalho,2017
618,Sobre todas essas denúncias sobre assédio de celebridades e a decepção que geram:  Não idolatre ninguém por mais excelente que seja o seu trabalho.   Admire o trabalho. Reconheça a competência e o talento.  Vc não conheçe a pessoa (nem precisa) pra saber do seu caráter.,2017
619,"No mais, existe diferença entre uma zoeira sadia e assédio direcionado, como desmerecer o trabalho todo de alguém.",2017
620,Denunciar assédio no trabalho é coisa de comunista? Não sabia que tinham tantos nos EUA,2017
621,"BEM ATUAL: Relação de trabalho ou ""assédio sexual""? fb.me/zONdCikl",2017
622,Um homem pode sentir-se assediado sexualmente em seu local de trabalho? Assédio só é iniciativa inadequada dos homens? O q caracterizaria assédio sexual a um homem?,2017
623,"O nome antigo era ""teste do sofá"" hj em dia ta mais lucrativo denunciar assédio do quê fazer e pegar um trabalho",2017
624,"se eu recebesse algo pelo trabalho tudo bem, mas mano eu so recebo desgosto, assedio, casaço, raiva",2017
625,Como Lidar com Assédio Moral no Trabalho fb.me/7kICRAUyM,2017
626,Assédio sexual no trabalho? Tem muito homem por aí que é safadão! bit.ly/1Cpw7Zw #sexualidade #assédio,2017
627,Óbvio. Até porque vai repercutir-se no trabalho. Da equipa. Da empresa. De todos. Não ha coisa pior que mau ambiente laboral. Bom senso. Sempre e contexto. E tb ha cargos + expostos em q se engole mtos sapos pq as contas têm de ser pagas.  O assédio é insidioso.,2017
628,Assédio no trabalho à espera da actualização da lista das doenças profissionais dlvr.it/Q04MtK | Home Page Jurídica,2017
629,"o caso era o seguinte: todo dia um mulher passava em frente um predio p ir pro trabalho ou sla, e o porteiro assediava ela dizendo coisa tipo ""gostosa"" ""e esse shortinho hein"", aí um dia ela combinou c uma amiga e filmou o assedio",2017
630,Caso Kevin Spacey: Você acha que é possível separar o trabalho do ator e ainda continuar fã do seu ofício mesmo depois das acusações de assédio ?,2017
631,"De todos os homens acusados de assédio que tem os surpreendido o que mais tenho medo de ser assediador é Carl Sagan. Eu admiro profundamente não só seu trabalho como cientista e divulgador, mas como pessoa.",2017
632,"⚡️ “Ator de 'Stranger Things' fala contra assédio de fãs” Finn Wolfhard, de 14 anos, interpreta Mike na série. Ele criticou quem 'persegue quem está atuando ou fazendo seu trabalho'. https://twitter.com/i/moments/928454889713389568 Ed.",2017
633,ó que beleza para gravar assédio moral no trabalho,2017
634,"Assédio no Trabalho é o tema do Programa Sobre Todas as Coisas de segunda-feira, 13 de novembro https://goo.gl/fb/BfSwoS",2017
635,"Isso é a @NEToficial senhoras e senhores Pensando em processa-los por assédio, além do registro que eu tenho de como afetaram meu trabalho com suas inconstâncias.",2017
636,FÓRUM ENFERMAGEM |  Assédio no trabalho à espera da actualização da lista das doenças profissionais dlvr.it/Q0294v,2017
637,Trabalho. Assédio no trabalho à espera da actualização da lista das doenças profissionais #justiça #law https://www.publico.pt/2017/11/09/sociedade/noticia/assedio-no-trabalho-a-espera-da-actualizacao-da-lista-das-doencas-profissionais-1791855?page=/&pos=1&b=stories_cover__important_c,2017
638,"Nanda Costa interpretará Maura em #DeVoltaPraCasa, uma Policial que sofrerá assédio sexual e será perseguida incansavelmente por um colega de trabalho.",2017
639,A reforma trabalhista regulamenta o assédio moral nas relações de trabalho.  oscontadores.com.br/artigos/…,2017
640,"O homem é muitas vezes vitima de assédio,seja na rua ou no local de trabalho,ficamos calados porque é suposto ser uma vergonha um homem queixar-se,elas mesmo,perante uma recusa acusam-nos de ser gays!",2017
641,Trabalho. Assédio no trabalho à espera da actualização da lista das doenças profissionais https://www.publico.pt/2017/11/09/sociedade/noticia/assedio-no-trabalho-a-espera-da-actualizacao-da-lista-das-doencas-profissionais-1791855 Estamos de facto a americanizar-nos 🤔,2017
642,Assédio no trabalho à espera da actualização da lista das doenças profissionais twib.in/l/bdLpRgkXLLzb,2017
643,Trabalho. Assédio no trabalho à espera da actualização da lista das doenças profissionais publico.pt/1791855,2017
644,Trabalho. Assédio no trabalho à espera da actualização da lista das doenças profissionais publico.pt/1791855,2017
645,"E acho meio errado ele vir com ""se vc n fizer tal parada vc n ganha mais trabalho"", meio assedio moral sabe?",2017
646,"""aaa q ridiculo tirar fulano do filme/série só porque ele é acusado em tantos casos de assedio/estupro/pedofilia/etc"" bom, talvez porque o trabalho da pessoa, mesmo que ótimo, não justifique o dano que ela causou nas vítimas  (e tbm a empresa não quer perder lucro/espectadores)",2017
647,minha mãe nesse exato momento tá conversando com meu cachorro que ela teve q demitir dois homens por assédio que rolou no trabalho com a funcionária e  os outros homens ficaram putos tipo ???,2017
648,to terminando de fazer o meu trabalho sobre assédio sexual  #EMABiggestFansJustinBieber,2017
649,"Mulher no rap, assedio no trabalho, mulher no futebol... to amandoooo tcc desse de jornalismo desse ano",2017
650,"com todas essas denúncias de assédio rolando, eu estou começando a usar o preceito ""goste do trabalho da pessoa/odeie ela pessoalmente"" mas como esse eu já usava com o Charlie Sheen, nd muda",2017
651,"Os canhotos fofinhos preparam-se para auditar e investigar todos os relacionamentos amorosos entre pessoas c a mesma profissão de modo a aferir se o mesmo começou no local de trabalho, e derivou de assédio, se sim, gulag!!",2017
652,"Ao que parece, eu que trabalho com varias colegas ha muitos anos, nao as posso elogiar, será assedio. Assim tipo ""hoje estas gira""",2017
653,Juízes do trabalho críticos à Reforma Trabalhista sofrem assédio I Por Jorge Luiz Souto Maior #ReformaTrabalhista justificando.cartacapital.co…,2017
654,Juízes do trabalho críticos à Reforma Trabalhista sofrem assédio I Por Jorge Luiz Souto Maior #ReformaTrabalhista justificando.cartacapital.co…,2017
655,Assédio moral Assédio sexual Discriminação racial e sexual deviam dar demissão sumária em todos ambientes de trabalho na minha opinião. Portanto inclui-se a televisão. Sempre.,2017
656,"Tá vendo esse tanto de HOMEM rodando por causa de DENÚNCIA DE ESTUPRO, ASSÉDIO? Pois é, o feminismo luta por isso, se as mulheres ficarem caladas com medo (como sempre foi) não há polícia que resolva. E que trabalho? Eu mandei 3 MATÉRIAS! Vc só abriu uma?",2017
657,"Hoje de manhã, as minhas colegas de trabalho estiveram a falar de assédio em público. Lamentavelmente, não houve uma que não tivesse uma história para contar.",2017
658,Valdirene ressalta que negros e negras são mais vulneráveis a assédio moral no local de trabalho.,2017
659,"Vocês realmente acham que a mulher ia se dar ao trabalho de ficar pensando em quem vamos incriminar de estupro, sendo que nós sabemos o quanto é doloroso sofrer assédio e qualquer tipo de abuso. Vocês são doentes por pensarem isso",2017
660,Você acha que é fácil denunciar assédio em ambiente de trabalho? Já passei vi uma colega passar e nunca denunciou,2017
661,"Tô quase processando a coleguinha do trabalho por assédio sexual, não pode me ver que fixa me alisando, detesto",2017
662,"Dá p entender não, venho candangão p trabalho ainda sofro assédio",2017
663,"Aí falo do meu caso de assédio no trabalho e o rapazinho fala ""ótima fanfic""................................................................",2017
664,eu to fazendo um trabalho sobre o assédio sexual,2017
665,"Mas é como eu já disse, eu já sofri assédio no trabalho e é difícil falar isso na hora",2017
666,"Gostaria de viver em um mundo sem assédio no trabalho, q n precise sorrir e acenar para os abusos",2017
667,Doação de carteira de trabalho pode ser considerado assédio moral,2017
668,Assédio no trabalho é um crime subnotificado pq as vítimas além de ficarem constrangidas e traumatizadas ainda temem perder seus empregos.,2017
669,"Assédio sexual no trabalho, quem já passou por isso aí?! Porque tá acontecendo comigo e eu não sei como proceder!",2017
670,"o que a gente chama de bullying, se acontecesse em outro local como trabalho, seria >assédio moral<",2017
671,Como eu descobri que era vítima de assédio no trabalho azmina.com.br/2016/01/assedi… via @revistaazmina,2017
672,"Nesta edição, o encontro debate o “Assédio no ambiente de trabalho”. #NãoVaiTerPsiu #SemeandoAPaz",2017
673,Nego confunde trabalho com assédio sexual. 🤦🏽‍♂️🤦🏽‍♂️,2017
674,Encontro debate formas de identificar e prevenir assédio moral em ambiente de trabalho no RS ift.tt/2zjUBuW,2017
675,Encontro debate formas de identificar e prevenir assédio moral em ambiente de trabalho no RS https://glo.bo/2AeR7sV,2017
676,Em filme pornô é assédio ou trabalho?,2017
677,MULHERES SÃO AS PRINCIPAIS VÍTIMAS DE ASSÉDIO MORAL E SEXUAL NO AMBIENTE DE TRABALHO https://www.facebook.com/TimeDilma/photos/a.642178699222008.1073741829.642162025890342/1257508694355669/?type=3&theater,2017
678,"Mulheres são as maiores vítimas de assédio no trabalho, mas homens também sofrem https://www.dn.pt/sociedade/interior/mulheres-sao-as-maiores-vitimas-de-assedio-no-trabalho-mas-homens-tambem-sofrem-8514620.html",2017
679,assedio sexual no trabalho https://twitter.com/giphz/status/926843323985350657,2017
680,"Acredito que a entrada nesse mercado de trabalho tá cada vez mais ampla e menos rigorosa, como a uber responde as manifestações de assédio?",2017
681,Estou produzindo um rádio-documentário para a faculdade. O tema é Assédio Moral no Trabalho. Preciso entrevistar algumas vítimas.,2017
682,Conversando sobre assédio no ambiente de trabalho com a minha mãe... e várias coisas ela dizendo que é infantilidade/frescura 🤦🏼‍♀️,2017
683,"Precisou de uma pá de anos de denúncias acumuladas, +atuais, para que houvesse afastamento de um homem de seu trabalho por assédio sexual",2017
684,"Eu, ganhei a causa! Foi comprovado o assédio moral e o trabalho escravo! Porém a empresa vivi recorrendo já fazem dois anos e nada é desolad",2017
685,a verdade é que dependendo do filtro que você usar pra julgar assédio vai sobrar menos da metade dos homens no mercado de trabalho.,2017
686,"Lembrei do que aconteceu quarta no trabalho, infelizmente assédio é algo muito comum em local de trabalho, ainda mais com nós mulheres..",2017
687,"Há uma Ministra sofrendo Assédio Moral e realizando trabalho escravo. Muito grave isso! Peço, Sr. Presidente, que a liberte já exonerando-a!",2017
688,"é um ABSURDO o número de mulheres que sofrem abuso/assédio na rua, trabalho,dentro da própria casa... RESPEITA AS MINA Ñ SOMOS OBJETO SEXUAL",2017
689,"OITO acusações de assédio de colegas de trabalho. Aí me vem com história de ""vou procurar tratamento"", amor procure uma cadeia e se entregue",2017
690,"Agora, com o apoio da Unifan, a 7º edição do encontro vai abordar o ""Assédio à mulher no ambiente de trabalho"". Junte-se a nós. Participe!",2017
691,Tanta coisa com as histórias de assédio sexual nos locais de trabalho e o #Taveira continua a ser um ídolo nacional... #OraPorra,2017
692,"Se uma colega de trabalho passar a mão na minha bunda, vai ser assédio? Pra mim não. Vai ser um jeito bem carinhoso de dar bom dia....😍😋",2017
693,Ator acusa Kevin Spacey de assédio durante trabalho em teatro de Londres dlvr.it/PytZ2Y #entertainmentNews,2017
694,Ator acusa Kevin Spacey de assédio durante trabalho em teatro de Londres ow.ly/G7rL50eXlvY,2017
695,#Whisnidy #Twitter ->https://is.gd/jeqwlK #ForaFacebook Ator acusa Kevin Spacey de assédio durante trabalho em teatro de Londres - ...,2017
696,"No próximo dia 6 de novembro promoveremos mais um debate, agora, na Unifan sobre assédio no ambiente de trabalho. Participem!",2017
697,O que dizem os teus olhos sobre o assédio sexual no trabalho?,2017
698,"Não me surpreendo com tudo que as mulheres sofreram e, ainda sofrem com assédio no trabalho!",2017
699,mas a tentativa de levar alguém para a cama em local de trabalho é  assédio punido,2017
700,O assédio sexual às mulheres no trabalho é prática generalizada nas sociedades patriarcais. Quase todas as mulheres que conheço o sofreram.,2017
701,Como assim? Eu não tolero situações de assédio sexual na empresa em que trabalho. Se vir ajo logo. E vocês? Na vossa empresa?,2017
702,Sindicato dos Jornalistas realizará campanha contra o assédio sexual nos locais de trabalho.  bit.ly/2gTPd9p,2017
703,#PodcasterProcura depoimento (pode ser anônimo) de #MulheresPodcasters sobre #assédio no #trabalho para @BolsaNerd Envie bolsanerd@gmail.com,2017
704,@estudioi #estudioi Já imagino o TinBot na justiça do trabalho sendo processado por assédio à impressora.,2017
705,Não permita que o seu local de trabalho seja transformado em um inferno! Denuncie práticas de assédio moral: bit.ly/AssumaOControle,2017
706,Quanta inconveniência ser importunada por macho até no ambiente de trabalho é assédio que chama né,2017
707,Adicionei um vídeo a uma playlist @YouTube youtu.be/ZKGzTjljGgM?aDocume…ário A dor (in)visível - Assédio Moral no Trabalho,2017
708,"No Caderno Gazeta Sete Dias desta edição você vai conferir uma matéria sobre trabalho infantil, trabalho escravo, assédio sexual, e muito +",2017
709,"Favorited ""Infocast 01 - Assédio Moral e Sexual no Ambiente de Trabalho"" https://www.mixcloud.com/infoproletarios/infocast-01-ass%C3%A9dio-moral-e-sexual-no-ambiente-de-trabalho/ by Infoproletários",2017
710,"GALERA QUE LUTA PELO FIM DO ASSÉDIO.  NÃO SE ESQUEÇAM DO ASSÉDIO MORAL NO TRABALHO, OK? VOCÊ NÃO É OBRIGADO A NADA.",2017
711,Ontem eu li esse texto bem bom sobre como a questão do assédio tem a ver com a dinâmica de poder no trabalho https://mobile.nytimes.com/2017/10/28/opinion/sunday/sexual-harassment-women.html,2017
712,@DepRodrigoMaia Inaceitáveis 17 anos de tramitação! APROVAÇÃO Já do #PL4742 /2001 ou apensado #PL7461 /2017 ASSÉDIO MORAL no TRABALHO,2017
713,@DepRodrigoMaia @DeputadosDEM APROVAÇÃO Já #PL4742 /2001/apensado #PL7461 /17 ASSÉDIO MORAL no TRABALHO precisa ser CRIMINALIZADO,2017
714,Comissão de Trabalho discute PDV e assédio moral no serviço público ift.tt/2yi0qfc,2017
715,"mas não, ele não vai nem perder o trabalho e quando a temp sair já vao ter esquecido do assédio, ele vai ganhar premios e vai sair por cima",2017
716,Comissão de Trabalho discute PDV e assédio moral no serviço público adurn.org.br/midia/noticias/…,2017
717,Comissão de Trabalho discute duas questões trabalhistas dos servidores públicos: Plano de Demissão Voluntária e Assédio Moral. Participe!,2017
718,Colocar minha House of Cards pra pagar pela denúncia de assédio pq? Eu te abomino @netflix vc prejudica o trabalho de várias pessoas c isso!,2017
719,Comissão de Trabalho discute PDV e assédio moral no serviço público - Notícias - FONACATE fb.me/9jGGpP5Xp,2017
720,"Trabalha em agência, veículo ou plataforma de conteúdo? Responda a pesquisa sobre assédio no trabalho. É anônimo! bit.ly/ETENDERPARMUDAR",2017
721,"COMISSÃO DE TRABALHO DA CÂMARA DISCUTE PDV E ASSÉDIO MORAL NO SERVIÇO PÚBLICO  A Comissão de Trabalho, de... fb.me/zFldcKE8",2017
722,Cidadania - Assédio no trabalho: youtu.be/hWt6_BHX9_Q?a via @YouTube,2017
