,tweets,ano
423,UFRR promove mesa redonda sobre Assédio Moral e Sexual no Trabalho roraimaemfoco.com/ufrr-promo…,2015
424,@luiztretando no meu aniversário eu sofri assédio sexual no trabalho (:,2015
425,CLT 70 discute Assédio Moral nas Relações de Trabalho -  sinttelrn.org.br/site/clt-70…,2015
426,"Se ficar aqui e ñ engrenar um trabalho bom, grandes chances de acontecer, o assédio das seleções diminuirá, então o momento é este.",2015
427,Assédio Moral  e Saúde no Trabalho: Palestra com doutora Margarida Barreto SITESPM CHR... assediomoralesaudenotrabalho…,2015
428,CLT 70 discute Assédio Moral nas Relações de Trabalho goo.gl/fb/ibuUXi,2015
429,CLT 70 discute Assédio Moral nas Relações de Trabalho goo.gl/fb/6zFHfQ,2015
430,"CLT 70 discute Assédio Moral nas Relações de Trabalho: No dia 08 de outubro, às 19h, no auditório da Livraria ... bit.ly/1KGjopH",2015
431,"CLT 70 discute Assédio Moral nas Relações de Trabalho: No dia 08 de outubro, às 19h, no auditório da Livraria ... bit.ly/1KGjopH",2015
432,Palestra sobre assédio moral no trabalho com advogada trabalhista q tá soando como se só defende homem assediador  Miga pare,2015
433,Quando acontece Assédio Moral no Ambiente de Trabalho? hmdoctors.com/index.php/2015… via @hmdoctors,2015
434,O que é assédio moral no trabalho   É uma forma de violência no trabalho que consiste na exposição prolongada e... fb.me/39L8UOnwe,2015
435,RR: UFRR promove mesa redonda sobre Assédio Moral e Sexual no Trabalho goo.gl/fb/qOyfiZ,2015
436,"40% das policiais brasileiras sofreram assédio no trabalho. Maioria, de superiores. Só 12% denunciaram. brasilpost.com.br/2015/09/23…",2015
437,CLT 70 discute Assédio Moral nas Relações de Trabalho dlvr.it/CGNlWH,2015
438,CLT 70 discute Assédio Moral nas Relações de Trabalho dlvr.it/CGNlFT,2015
439,"CLT 70 discute Assédio Moral nas Relações de Trabalho: No dia 08 de outubro, às 19h, no auditório da Livraria ... bit.ly/1MOqNKh",2015
440,CLT 70 discute Assédio Moral nas Relações de Trabalho livrevozdopovo.blogspot.com/…,2015
441,O Assistente Social e o Assédio Moral - O assédio moral nas relações de trabalho do(a) assistente social: uma... fb.me/4wPAx4byU,2015
442,CLT 70 discute Assédio Moral nas Relações de Trabalho trt21.jus.br/Asp/Noticia/not…,2015
443,Tô numa aula de direito falando sobre assédio moral no trabalho.  Fiquei pensando quanto de dinheiro que eu tô perdendo,2015
444,CLT 70 DISCUTE ASSÉDIO MORAL NAS RELAÇÕES DE TRABALHO. LEIA: fb.me/45rwhyVam,2015
445,CLT 70 discute Assédio Moral nas Relações de Trabalho fb.me/1DIOnBrAR,2015
446,"CLT 70 discute Assédio Moral nas Relações de Trabalho – dia 08/10/15, em Natal https://bibliotecaprt21.wordpress.com/2015/09/25/clt-70-discute-assedio-moral-nas-relacoes-de-trabalho-dia-081015-em-natal/",2015
447,"CLT 70 discute Assédio Moral nas Relações de Trabalho: No dia 08 de outubro, às 19h, no auditório da Livraria... bit.ly/1PzF9M7",2015
448,CLT 70 discute Assédio Moral nas Relações de Trabalho justicaempauta.com.br/2015/0…,2015
449,CLT 70 discute Assédio Moral nas Relações de Trabalho trt21.jus.br/Asp/Noticia/not…,2015
450,Apontamentos sobre Assédio Moral - E eu me pego pensando em Assédio Moral no trabalho. Difícil desvencilhar... ln.is/clecienne.tumblr.com/F…,2015
451,Cansada da vida de mulher e mãe. Colegas de trabalho q praticam.assédio  moral. Querem impor coisas que não... fb.me/4pYtnhMuP,2015
452,UFRR promove mesa redonda sobre Assédio Moral e Sexual no Trabalho - FatoReal fb.me/2cAia9LoN,2015
453,UFRR promove mesa redonda sobre Assédio Moral e Sexual no Trabalho fatoreal.blog.br/educacao/uf… fb.me/7qL5JQi5o,2015
454,UFRR promove mesa redonda sobre Assédio Moral e Sexual no Trabalho fatoreal.blog.br/educacao/uf…,2015
455,#UFRR promove mesa redonda sobre Assédio Moral e Sexual no Trabalho. Leia mais: bit.ly/1LOgfow,2015
456,Quando acontece Assédio Moral no Ambiente de Trabalho? goo.gl/fb/zUzHrW #comunicação #culturaorganizacional,2015
457,Trabalho aprova classificação de assédio moral como improbidade administrativa sinfa.org.br/mostrar_noticia…,2015
458,Pesquisa diz que 64% das mulheres jornalistas já sofreram assédio relacionado ao trabalho novoemfolha.blogfolha.uol.co…,2015
459,"Sou bancária, quero o fim do assédio moral. Quero um ambiente de trabalho saudável bit.ly/1Ne9QbA",2015
460,Câmara dos Deputados: Trabalho aprova classificação de assédio moral como improbidade… goo.gl/fb/y3PRqW,2015
461,"MWBR -  Centro de Referência em Cuiabá resguarda população vulnerável  - Trabalho escravo, assédio sexual,… dlvr.it/CDSNcm",2015
462,Assédio moral e sexual no trabalho. Brasil,2015
463,"#Stigmabase | BR -  Centro de Referência em Cuiabá resguarda população vulnerável  - Trabalho escravo, assédio… dlvr.it/CD6wL5",2015
464,Trabalho aprova classificação de assédio moral como improbidade administrativa protecao.com.br/noticias/leg… …,2015
465,Trabalho aprova classificação de assédio moral como improbidade administrativa protecao.com.br/noticias/leg…,2015
466,"B | #Pobreza - Centro de Referência em Cuiabá resguarda população vulnerável - Trabalho escravo, assédio sexual… goo.gl/fb/piRHq3",2015
467,"Centro de Referência em Cuiabá resguarda população vulnerável - Trabalho escravo, assédio sexual, homofobia, maus… goo.gl/fb/HgQW9L",2015
468,Comissão de Trabalho aprova classificação de assédio moral como improbidade administrativa bit.ly/1YuNpmK,2015
469,"#Egaylity -  Centro de Referência em Cuiabá resguarda população vulnerável  - Trabalho escravo, assédio sexual,… dlvr.it/CD4k4l",2015
470,"EGAYLiTY : #Egaylity -  Centro de Referência em Cuiabá resguarda população vulnerável  - Trabalho escravo, assédio… dlvr.it/CD4jFM",2015
471,Trabalho aprova classificação de assédio moral como improbidade administrativa - sinpaf.org.br/trabalho-aprov…,2015
472,Aí pensei de novo e descobri que sofri um assédio moral no trabalho.,2015
473,"B | #Homofobia -   Centro de Referência em Cuiabá resguarda população vulnerável - Trabalho escravo, assédio sexual… goo.gl/fb/BzUZHO",2015
474,Trabalho aprova classificação de assédio moral como improbidade administrativa  contec.org.br/index.php/cont…,2015
475,"B | #LGBT :  Centro de Referência em Cuiabá resguarda população vulnerável - Trabalho escravo, assédio sexual… goo.gl/fb/5r6LLx",2015
476,"SNewsroom | BR Centro de Referência em Cuiabá resguarda população vulnerável - Trabalho escravo, assédio sexual… goo.gl/fb/8CwLLr",2015
477,Trabalho aprova classificação de assédio moral como improbidade administrativa fb.me/4pkFkZlNT,2015
478,Serviço Social & Sociedade - O assédio moral nas relações de trabalho do(a) assistente social:... fb.me/4NLweqgvt,2015
479,Trabalho aprova classificação de assédio moral como improbidade administrativa fb.me/2kfWu0UR2,2015
480,Trabalho aprova classificação de assédio moral como improbidade administrativa fb.me/2lVtXiH3X,2015
481,como lidar com assédio na área de trabalho ~pesquisar~,2015
482,o tema do próximo trabalho de sociologia é assédio moral um tema bem amplo mas a matéria online estragou com todas as forças,2015
483,Gente que duvida do meu trabalho: só não mando tomar no cu porque posso ser acusada de assédio moral.,2015
484,ASSÉDIO MORAL NO TRABALHO https://tube.mint.lgbt/watch?v=ZDSVVT1PF1o fb.me/3qjCRMgTZ,2015
485,"MT: Assédio Moral reflete lógica da competitividade no trabalho, afirma Roberto Heloani goo.gl/fb/ytIHSn",2015
486,Ministério do Trabalho vai investigar suposto assedio moral no 180 Graus - goo.gl/FyYGAo fb.me/3IwZUVAKU,2015
487,Trabalho aprova classificação de assédio moral como improbidade administrativa fb.me/6S48eYMoZ,2015
488,Ministério do Trabalho vai investigar suposto assedio moral no 180 Graus fb.me/4xfIKsQfK,2015
489,"III Congresso Iberoamericano sobre Assédio Moral no Trabalho (Florianópolis, 08-11/10/15) iberoacosolaboral2015.ufsc.b…",2015
490,Trabalho aprova classificação de assédio moral como improbidade ad ... - fenaprf.org.br/trabalho-apro…,2015
491,"Desqualificar funcionários no ambiente de trabalho é assédio moral e pode causar danos como estresse, baixo... fb.me/2tVerqme3",2015
492,#camara Trabalho aprova classificação de assédio moral como improbidade administrativa bit.ly/1QGDKEg,2015
493,Evento gratuito! Seminário Iberoamericano sobre Assédio Moral no Trabalho em Florianópolis. fb.me/2ogYNHQjn,2015
494,Curso grátis de prevenção ao assédio moral no trabalho. bit.ly/1vdmpLY #CursoGratis,2015
495,"Fim da espetacularização do assédio moral no ambiente de trabalho. Fim do MasterChef!  Toca, Raul..... Boa noite!",2015
496,"#masterchefbr Essas broncas dos chefs nos participantes são odiosas, e tem outro nome no mercado de trabalho: assédio moral.",2015
497,Especialistas discutem assédio moral no ambiente de trabalho zip.net/blr0gM  O assédio moral no ambiente... fb.me/2HaLz3VcG,2015
498,"A - ""Procuro, com apoio de @GenivanVale, ação prática no Gerência do Trabalho.  Trabalhador sofre assédio moral e atrasos salariais"", afirma",2015
499,Cipeiro obrigado a assinar carta de renúncia à estabilidade será indenizado por assédio moral - blogdotrabalho.com/cipeiro-o…,2015
500,"@dialogay tem um cara aqui no meu trabalho que toda a vez que me vê fica perguntando se eu fui na igreja, isso é assedio religioso",2015
501,Nuno Cerejeira Namora participa em conferência sobre “Mobbing ou assédio moral no trabalho” local.pt/portugal/nuno-cerej… #Finanças #Portugal,2015
502,"Sexismo no trabalho é tão grave quanto assédio sexual, diz pesquisa fb.me/7rjN8KITf",2015
503,ASSÉDIO MORAL E DANO MORAL Você conhece alguém que já foi vítima no ambiente de trabalho?... fb.me/7JuAabmPe,2015
504,Será que você sofre assédio no trabalho e não sabe? goo.gl/0yHq5f,2015
505,Especialistas discutem assédio moral no ambiente de trabalho. Confira: ow.ly/S6GLO,2015
506,"Vítima de assédio moral não goza direitos sociais no trabalho, diz procurador - dmtemdebate.com.br/vitima-de…",2015
507,Você sofre assédio moral no trabalho? fb.me/7JO3yPF3V,2015
508,Você sofre assédio moral no trabalho? mulher.uol.com.br/comportame… via @UOLMulher @UOL,2015
509,Como identificar o assédio moral no trabalho? fb.me/4sm2Eq9UA,2015
510,Você sofre assédio moral no trabalho? mulher.uol.com.br/comportame… via @UOLMulher @UOL,2015
511,"Teste: Você sofre assédio moral no seu ambiente de trabalho?  nao fia, eu CAUSO o assédio, é diferente (;",2015
512,#OseuAdvogado: como identificar o assédio moral no trabalho?  - bit.ly/1NmJ1B4,2015
513,Você sofre assédio moral no trabalho? bit.ly/1K2WKZ5,2015
514,Você sofre assédio moral no trabalho?:  Veja o Álbum de fotos bit.ly/1K2WKZ5,2015
515,"@JEVSPRJ81 na Justica do Trabalho, dano moral é raro e geralmente baixo. E acho q nao seria pelo atraso, mas pelo assedio moral.",2015
516,#modaatual Você sofre assédio moral no trabalho?:  Veja o Álbum de fotos bit.ly/1iEAlKQ,2015
517,Você sofre assédio moral no trabalho?:  Veja o Álbum de fotos bit.ly/1K2WKZ5,2015
518,Você sofre assédio moral no trabalho?:  Veja o Álbum de fotos bit.ly/1K2WKZ5,2015
519,Você sofre assédio moral no trabalho?:  Veja o Álbum de fotos bit.ly/1iEAlKQ,2015
520,Você sofre assédio moral no trabalho?:  Veja o Álbum de fotos migre.me/rvf5v,2015
521,Você sofre assédio moral no trabalho?:  Veja o Álbum de fotos bit.ly/1iEAlKQ,2015
522,"De acordo com o Ministério do Trabalho e Emprego, assédio sexual é crime. Guarde e-mails e mensagens que podem... fb.me/2Te8zquC9",2015
523,Confira reportagem sobre o combate ao assédio moral no programa Trabalho Legal: https://tube.mint.lgbt/-WMT0es3LTI,2015
524,"Vítima de assédio moral não goza direitos sociais no trabalho, diz procurador bit.ly/1XTYJs5",2015
525,"Vítima de assédio moral não goza direitos sociais no trabalho, diz procurador - sinpaf.org.br/vitima-de-asse…",2015
526,"@realfetter  CORREÇÃO: ASSÉDIO SEXUAL SÓ OCORRE DE SUPERIOR HIERÁRQUICO PARA SUBALTERNO, ENTRE COLEGAS DE TRABALHO NÃO EXISTE.",2015
527,"@dudagarbi  CORREÇÃO: ASSÉDIO SEXUAL SÓ OCORRE DE SUPERIOR HIERÁRQUICO PARA SUBALTERNO, ENTRE COLEGAS DE TRABALHO NÃO EXISTE.",2015
528,"@Pretinho_Basico  CORREÇÃO: ASSÉDIO SEXUAL SÓ OCORRE DE SUPERIOR HIERÁRQUICO PARA SUBALTERNO, ENTRE COLEGAS DE TRABALHO NÃO EXISTE.",2015
529,Especialistas discutem assédio moral no ambiente de trabalho tinyurl.com/q6xhzjr #carreira,2015
530,"Vítima de assédio moral não goza direitos sociais no trabalho, diz procurador: O assédio… goo.gl/fb/WWAJ6j",2015
531,"Vítima de assédio moral não goza direitos sociais no trabalho, diz procurador - jornaldeibaiti.com.br/vitima…... fb.me/4Ukr4rdBE",2015
532,"Vítima de assédio moral não goza direitos sociais no trabalho, diz procurador - jornaldeibaiti.com.br/vitima…... fb.me/6QpSjG0ab",2015
533,"Vítima de assédio moral não goza direitos sociais no trabalho, diz procurador - jornaldeibaiti.com.br/vitima…",2015
534,AO VIVO no #Periscope: Fernanda Marinela falando sobre Assédio Moral no trabalho  https://www.pscp.tv/w/aMLZXTEzNTU0NjExfDF5cEtkUkV5cFZqSlcH_-CY8VmrR3Iefx8QgZnwrpSx1wznWPNZ7VWW-sIEhg==,2015
535,É um saco lidar com assédio em ambiente de trabalho.,2015
536,"Vítima de assédio moral não goza direitos sociais no trabalho, diz procurador ebc.com.br/noticias/2015/09/…",2015
537,AO VIVO no #Periscope: Aryanna Manfredini falando sobre Assédio Moral nas relações de trabalho na sede da OAB-AL https://www.pscp.tv/w/aMLEvjEzNTU0NjExfDF5cEtkUkVXTGV5Sldbgj6kqyNHt03VPBMqtXUig4MnBbckJ7lrXn48Xe_Ldg==,2015
538,Especialistas discutem assédio moral no ambiente de trabalho ift.tt/1Kf5LSy,2015
539,"Fosse no BRA, iam configurar assedio no trabalho. Vai vendo RT: ‘Isso não é Tinder!’: advogada denuncia cantada no Linkedin e causa polêmica",2015
540,"Vítima de assédio moral não goza direitos sociais no trabalho, diz procurador ebc.com.br/noticias/2015/09/…",2015
541,"Vítima de assédio moral não goza direitos sociais no trabalho, diz procurador ow.ly/3yc2GI",2015
542,"GiGi  Fala Tudo: Vítima de assédio moral não goza direitos sociais no trabalho, diz procurador gigifalatudo.blogspot.com/20…",2015
543,O assédio moral no ambiente de trabalho foi discutido hoje (10) durante o ciclo de palestras Assédio Moral no... fb.me/7qFLVBR0q,2015
544,"Vítima de assédio moral não goza direitos sociais no trabalho, diz procurador negoogle.com/index/vitima-de…",2015
545,"#EBC Vítima de assédio moral não goza direitos sociais no trabalho, diz procurador dlvr.it/C6m0c7",2015
546,"Vítima de assédio moral não goza direitos sociais no trabalho, diz procurador: O assédio moral no ambiente de ... bit.ly/1XRyrHc",2015
547,"Vítima de assédio moral não goza direitos sociais no trabalho, diz procurador: O assédio moral no ambiente de ... bit.ly/1OEFSuY",2015
548,"Vítima de assédio moral não goza direitos sociais no trabalho, diz procurador  topgyn.com.br/home/2015/09/v…",2015
549,"Vítima de assédio moral não goza direitos sociais no trabalho, diz procurador  topgyn.com.br/home/2015/09/v…",2015
550,Assédio Moral no Trabalho  É uma forma de violência no trabalho que consiste na exposição prolongada e repetitiva... fb.me/42Lsik49m,2015
551,"É assédio no trabalho, filhadaputagem do transporte no qual passo 3 horas por dia viajando, convívio com pessoa descompromissada. Tô doente.",2015
552,"Assédio moral e sexual no Direito do Trabalho e a advocacia no âmbito do Direito Coletivo e Sindical, dia 10/9 dnz.to/1FjH",2015
553,Irlan Melo fala sobre assédio moral e sexual no trabalho. Acompanhe o quadro O Seu Advogado.,2015
554,Biblioteca CCS/A: Ciclo de debates “Assédio moral no trabalho e a saúde dos trabalhadores” fb.me/zIVcR0fK,2015
555,II Encontro do Movimento Mais Mulheres na OAB debate Assédio Moral no Trabalho bit.ly/1LlYKf9,2015
556,Assédio moral: Técnica em Segurança no Trabalho impedida de realizar suas atribuições será... fb.me/3K2jXJVi6,2015
557,"Como Evitar o ""assédio moral"" no local de trabalho?? A Agência produziu um conj is.gd/ej1B6q... fb.me/6NDYaKbPq",2015
558,"Como Evitar o ""assédio moral"" no local de trabalho?? A Agência produziu um conj is.gd/ej1B6q... fb.me/7x1QG6J8M",2015
559,"Como Evitar o ""assédio moral"" no local de trabalho?? A Agência produziu um conj is.gd/ej1B6q #trabalhoerenda #trabalhoescravo",2015
560,Jornal Regional falando de assédio moral no trabalho e como a denuncia aumentou no MPT. A coisa é feia. Só quem conviveu com isso sabe,2015
561,"Raphael Sander, de Verdades Secretas: 'Assédio aumentou' - Raphael Sander começou com tudo seu primeiro trabalho n... ow.ly/33U2Em",2015
562,II Encontro do Movimento Mais Mulheres na OAB debate Assédio Moral no Trabalho bit.ly/1OzBaPl,2015
563,3 passos para acabar com situações de assédio moral no seu local de trabalho fb.me/7vahorVyg,2015
564,"SP: Simesp Debate discute ""Assédio moral no local de trabalho"" goo.gl/fb/EMsjNw",2015
565,"O Assédio Moral no Ambiente de Trabalho  Muitas vezes no setor privado da economia, devido a inúmeros fatores de... fb.me/2lo2KsrrO",2015
566,Assédio no trabalho é constante nesse País.Sempre tem alguém se achando no direito de pisar em cima dos... fb.me/6HT26ldFf,2015
567,"""Pena que eu perdi você, quem me dera eu poderia te dar um grande abraço e continue a provocação e o assédio de bom trabalho.""",2015
568,ASSÉDIO MORAL E DANO MORAL Você conhece alguém que já foi vítima no ambiente de trabalho?... fb.me/44br1XE3b,2015
569,Saiba identificar o assédio moral no ambiente de trabalho Agência Empregos fb.me/1Vfo0D9hW,2015
570,@napaulices @NaoInviabilize Me dei ao trabalho de ler e de achar o artigo original. E na vdd ela tá falando mais de assedio do que de beleza,2015
571,"Assédio moral e sexual no Direito do Trabalho e a advocacia no âmbito do Direito Coletivo e Sindical, dia 10/9 dnz.to/1Fhk",2015
572,"9:20h e eu já tinha ido no mercado , presenciado perseguição policial , correria no trabalho , até assédio eu sofri kkkkk",2015
573,O Assédio Moral no Ambiente de Trabalho caiopatriotaadvocacia.jusbra… via @JusBrasil,2015
574,O Assédio Moral no Ambiente de Trabalho | Artigos JusBrasil https://lnkd.in/eMaTaSc,2015
575,"Toda vez que uma dev conhecida minha reclama de assédio no ambiente de trabalho, eu escolho ser programadora de novo e não desistir de tudo",2015
576,O Assédio Moral no Ambiente de Trabalho | Artigos JusBrasil fb.me/3cNVkjWbi,2015
577,O Assédio Moral no Ambiente de Trabalho fb.me/1h3DUYsHG,2015
578,"@carolbalalaika e quantas milhares nao largam trabalho, escola, faculdade por assedio?",2015
579,Assédio sexual no trabalho.,2015
580,se wdym faz apologia á estupro então dirty work seria ao assédio sexual no trabalho?,2015
581,Vou ver disclosure na RTP. Assédio sexual no trabalho parece-me bem. #crimes #vitimas #ficandomaluca,2015
582,"@acnologia0 um trabalho na vdd, sobre assédio moral",2015
583,"""A maioria dos casos de assédio no trabalho não são denunciados"". O comentário: ""é que tem mulher que não cai nesse mimimi feminista"".",2015
584,Bullying no trabalho: bons profissionais sofrem assédio por parte dos colegas fb.me/3qW1LihHx,2015
585,Palestra: Assédio Moral nas Relações de Trabalho fb.me/3tmJ0RAJQ,2015
586,E o assedio moral Arnaldo? O Deboísmo pegou MUITO MAL para o Ministério do Trabalho brasilpost.com.br/2015/09/03…,2015
587,O assédio moral no ambiente de trabalho se caracteriza pela repetição de condutas abusivas atentatórias à honra e... fb.me/7xSDhZhfI,2015
588,Advogada trabalhista de Banco receberá indenização por assédio moral - blogdotrabalho.com/advogada-…,2015
589,Giancarlo e Kaya reconhecem que todo assédio dos fãs é amor. É reconhecimento pelo trabalho deles.  #MazeRunnerNoBrasil,2015
590,"Sexismo no trabalho é tão grave quanto assédio sexual, diz pesquisa fb.me/3XCqlEEGA",2015
591,Advogada trabalhista de Banco receberá indenização por assédio moral  O assédio moral no ambiente de trabalho se... fb.me/39HFsi8BS,2015
592,Está sofrendo Assédio Moral no Trabalho? Seu salário não dá nem para pagar as contas? Seus direitos estão sendo... fb.me/7ArORTHRp,2015
593,Está sofrendo Assédio Moral no Trabalho? Seu salário não dá nem para pagar as contas? Seus direitos estão sendo... fb.me/LNktK091,2015
594,"@RodrigoMedh  isso não tem graça. Tem trabalho escravo, assédio moral e eles pedem ""deboísmo""?",2015
595,"@DandharaMorais mas po, é tanto problema sério no setor trabalhista brasileiro. trabalho escravo, assédio... não vejo espaço pra ~deboísmo~",2015
596,Estudo sobre a influência do contexto de trabalho nas situações de assédio moral. O referencial teórico é a... fb.me/27IwKITJe,2015
597,"CONEXÃO PROFISSIONAL  Às 10h40, saiba como lidar com o assédio moral no ambiente de trabalho. cbnrecife.com/aovivo/",2015
598,TRIBUNA 28 08 2015 ENTENDA O ASSÉDIO MORAL NO TRABALHO fb.me/3JZXraH4b,2015
599,"#DireitosDoTrabalhador | Se você é testemunha de algum tipo de humilhação ou #Assédio no trabalho, supere o medo... fb.me/4oDCaiS1U",2015
600,"Gente é tudo Brinks. Depois do post acabou o assédio no trabalho, ninguém mais perdeu o emprego por puxada de tapete https://nitter.mint.lgbt/TrabalhoGovBr/status/639184188323840000",2015
601,"Olha ai pessoal a segunda parte do meu artigo sobre Assédio Moral nas Relações de Trabalho, publicado no Gen... fb.me/5tPosCLRY",2015
602,"Olha ai pessoal a segunda parte do meu artigo sobre Assédio Moral nas Relações de Trabalho, publicado no Gen... fb.me/36cz7HXc7",2015
603,@TrabalhoGovBr é meio complicado falar de deboísmo quando o trabalho de vocês é defender gente de assédio moral e problemas desse nível,2015
604,"#Encontro minha espontaneidade já fez alguns antigos colegas de trabalho massacrarem,o q hj é chamado de assédio moral.Perturbação gratuita",2015
605,AMBIENTE DE TRABALHO: ASSÉDIO MORAL. Confira: bit.ly/1LwRBLE  Fonte: Ministério do Trabalho.,2015
606,5 tapas na bunda hahah olha o assédio no trabalho,2015
607,@martini_seco @FlCard Você é maior que isso miga. Nos foquemos no assédio moral em local de trabalho ou nos grupos de WhatsApp.,2015
608,Por um ambiente com cores! Rogério Renzetti e o Assédio moral nas relações de trabalho. Parte II. goo.gl/KuJ977,2015
609,Por um ambiente com cores! Rogério Renzetti e o Assédio moral nas relações de trabalho. Parte II. goo.gl/KuJ977,2015
610,Clínica do Trabalho do Sindicato combate assédio moral bit.ly/1O65X65 fb.me/48Yr8Chhm,2015
611,.Acha normal ou incentiva humilhação no trabalho? Isso é assédio moral. #Dignidade #Respeito #NãoAoAssédio grupopierri.com.br/site/cont…,2015
612,"E aí, vasculhando o blog, eu vi que eles tem um post que diz que a mulher não deve denunciar assédio sexual no trabalho",2015
613,"#FASUBRA : III Congresso Ibero-americano sobre Assédio Moral no Trabalho:   Dignidade, direitos humanos e so... migre.me/ro7Yz",2015
614,"""Sofri assédio moral no trabalho durante o período de gravidez, o que devo fazer?"" fb.me/5n39j9jgC",2015
615,ASSÉDIO MORAL NO TRABALHO - ACABE COM ISSO. fb.me/3SIUBp61M,2015
616,Como pode ser caracterizado o assédio moral no ambiente de trabalho?  Ministro Agra Belmonte esclarece https://bibliotecaprt21.wordpress.com/2015/08/31/como-pode-ser-caracterizado-o-assedio-moral-no-ambiente-de-trabalho-ministro-agra-belmonte-esclarece,2015
617,O que é assédio moral no trabalho! fb.me/6PQG4VrQi,2015
618,"Assista ao programa Câmara em Pauta 98, exibido em 28/08/2015, que falou sobre o Assédio no Ambiente de Trabalho : bit.ly/1MY6Vm7",2015
619,Assédio Moral no Ambiente de Trabalho fb.me/JAFesPJb,2015
620,As pessoas de onde trabalho deveriam saber o que é assédio,2015
621,SP: Diretor da ACE debate assédio no trabalho em programa de TV goo.gl/fb/txWsSd,2015
622,RS: OAB/RS debate assédio moral no trabalho com advocacia gaúcha goo.gl/fb/Nqdlc6,2015
623,Ministro Agra Belmonte esclarece o que é e como pode ser caracterizado o assédio moral no ambiente de trabalho.... fb.me/3cmB37DT8,2015
624,#RevistaTST Ministro do TST esclarece como pode ser caracterizado o assédio moral no trabalho. Confira:... fb.me/2g0Wiw5PJ,2015
625,#RevistaTST Ministro do TST esclarece como pode ser caracterizado o assédio moral no trabalho. Confira: bit.ly/1NPTnYn,2015
626,#RevistaTST Ministro do TST esclarece como pode ser caracterizado o assédio moral no trabalho. Confira: bit.ly/1NPTnYn,2015
627,Assédio Moral no Ambiente de Trabalho fb.me/2FH6frnBC,2015
628,Assédio Moral no Ambiente de Trabalho fb.me/2rQrAxFTh,2015
629,Assédio moral no ambiente de trabalho: programa de TV do TRT/CE sobre o tema já está no Youtube. Assista aqui: https://goo.gl/dSKvV7,2015
630,Assédio moral no ambiente de trabalho: programa de TV do TRT/CE sobre o tema já está no Youtube. Assista aqui: https://goo.gl/dSKvV7,2015
631,Confira dados sobre o assédio no mercado de trabalho brasileiro: ow.ly/R5U9r,2015
632,"#RádioTST Sofri assédio moral no trabalho durante o período de gravidez, o que devo fazer? Confira no quadro! bit.ly/1OQYfwv",2015
633,"#RádioTST Sofri assédio moral no trabalho durante o período de gravidez, o que devo fazer? Confira no quadro! bit.ly/1OQYfwv",2015
634,CE: Assédio moral no ambiente de trabalho é o tema do programa de TV desta quarta-feira goo.gl/fb/5obmI0,2015
635,"assédio no trabalho, como lidar",2015
636,Assédio no Trabalho (Infográfico) goo.gl/fb/6JZIjH,2015
637,"@omachoalpha Hj tudo é assedio, tantos casos de assedios reais, em transporte publico, trabalho, em casa, q deveriam ter uma devida atenção.",2015
638,#QueroPost Você sabia que o chefe também pode sofrer assédio moral no ambiente de trabalho? Confira:... fb.me/6VmqJUjqt,2015
