,tweets,ano
0,"5- 525, vila velha, porta retrato quebrado, fka twigs, pedra da cebola, assédio no trabalho (isso foi triste), FILME COM AQUELE RATINHO",2015
1,“Isso é assédio moral!”: um tipo de violência no trabalho | Mais uma Opinião #assédiomoral #assédio maisumaopiniao.com.br/2015/0…,2015
2,Como Evitar o Assédio Moral no local de trabalho? controlesocialdesarandi.com.… @comassarandipr,2015
3,Como Evitar o Assédio Moral no local de trabalho? - controlesocialdesarandi.com.…,2015
4,"Desqualificar funcionários no ambiente de trabalho é assédio moral e pode causar danos como estresse, baixo... fb.me/56fGipe6i",2015
5,@pereirajoaof @SilviaGuedes @goncalosousa porq o assédio só estava tipificado no código de trabalho e assédio de rua n tem nada a ver c CT,2015
6,"@minfiration do trabalho excessivo, assedio e até mesmo daqueles comentários um pouco pesados, tem que saber lidar",2015
7,"Como Evitar o ""assédio moral"" no local de trabalho?? A Agência produziu um conj is.gd/ej1B6q... fb.me/4D4pla9iZ",2015
8,"Como Evitar o ""assédio moral"" no local de trabalho?? A Agência produziu um conj is.gd/ej1B6q... fb.me/7CV8IsV5I",2015
9,"Como Evitar o ""assédio moral"" no local de trabalho?? A Agência produziu um conj is.gd/ej1B6q #trabalhoerenda #trabalhoescravo",2015
10,"Uma vz no trabalho onde eu sofria assedio moral, eu tomei um resfenol e apaguei em cima da mesa de trabalho. NOOOOSSAA",2015
11,@adilsonmsf @Pontifex_pt booling e assédio moral já acontecem nos ambientes de trabalho ... humilhante ..vergonhoso. descaradamente ..comigo,2015
12,@AntonioMFrasson @Pontifex_pt amigo e irmão em Cristo Jesus. ..booling e assédio moral já estão acontecendo nos ambientes de trabalho ..,2015
13,"Campanha do Ministério do Trabalho e Emprego incentiva denúncias contra assédio moral. Toda e qualquer pessoa não merece ter sua dignidade,",2015
14,estou sendo vitima de assédio sexual no meu trabalho O.o,2015
15,"O combate de forma eficaz ao assédio moral no trabalho exige a formação de um coletivo multidisciplinar, envolvendo…https://lnkd.in/eUxKy75",2015
16,"Em Ouricuri, assédio moral no trabalho é crime e dá cadeia?  ouricuriemfoco.com.br/em-our…",2015
17,"Pela primeira vez sofri o famigerado ""assedio no trabalho"" o que não foi nada legal",2015
18,Saiba identificar assédio moral no trabalho e como reagir  https://catracalivre.com.br/geral/carreira-jovem/indicacao/saiba-identificar-assedio-moral-no-trabalho-e-como-reagir/?utm_source=soclminer&utm_medium=soclshare&utm_campaign=soclshare_twitter via @CatracaLivre,2015
19,Saiba identificar assédio moral no trabalho e como reagir bit.ly/1QLZEt2 #Emprego,2015
20,Há um ano fui vítima de assédio moral e tive meu acesso ao trabalho negado pelo poder público municipal. Por... fb.me/73HNm3HBt,2015
21,"Obrigada, @joutfuckinjout por esclarecer mais ainda o q é assédio para aqueles q nao sabem e pelo trabalho desenvolvido em seus vídeos! <3",2015
22,Vejo ex-colegas de trabalho expondo seus atendente no Face e penso: Assédio moral ? Não estou vendo isso .. Como... fb.me/4NuOC8rcZ,2015
23,"vamos falar sobre assédio no ambiente de trabalho na reunião do ""bom dia""? vamos sim senhor",2015
24,"Assédio sexual no trabalho, quem nunca? #WeAreAllHarry",2015
25,Ministério Público entra com ação contra Subway de Ilhéus por assédio moral: O Ministério Público do Trabalho ... bit.ly/1YsujuC,2015
26,Ministério Público entra com ação contra Subway de Ilhéus por assédio moral: O Ministério Público do Trabalho ... bit.ly/1YsujuC,2015
27,Ministério Público entra com ação contra Subway de Ilhéus por assédio moral: O Ministério Público do Trabalho ... bit.ly/1YsujuC,2015
28,Ministério Público entra com ação contra Subway de Ilhéus por assédio moral: O Ministério Público do Trabalho ... bit.ly/1YsujuC,2015
29,Ministério Público entra com ação contra Subway de Ilhéus por assédio moral: O Ministério Público do Trabalho ... bit.ly/1YsujuC,2015
30,Ministério Público entra com ação contra Subway de Ilhéus por assédio moral: O Ministério Público do Trabalho ... bit.ly/1lZm1P9,2015
31,Como lidar com assédio no trabalho negocios.umcomo.com.br/artic… #negocios,2015
32,@EncontroFatima Aos vinte e poucos anos passei por esse problema de assédio no trabalho. Fui demitida por não aceitar as investidas do chefe,2015
33,Ótima essa matéria do Lair sobre assédio no trabalho! #Encontro,2015
34,Quando eu vejo casos de assedio em redes sociais de modelos QUASE fico na bad de saber que meu trabalho contribui para que isso aconteça,2015
35,@WursterEmily feminismo é tão necessário quanto os sindicatos de trabalhadores que protegem esses do assédio e violência no trabalho.,2015
36,"Thiago Lacerda fala sobre Shakespeare, assédio e trabalho do ator bit.ly/1UDynb1",2015
37,"Thiago Lacerda fala sobre Shakespeare, assédio e trabalho do ator - #72 - bomnegocioempreendedor.com.b…",2015
38,"Assedio moral no trabalho de mulheres contra homens: Não se dobre,se defenda! Denuncie!!!",2015
39,"@gabriel_chalita ai ai... trabalho a gente tem em dobro, se a gente fica doente sofre assédio moral e se não cumpre prazo é notificado",2015
40,Conheça a cartilha sobre Assédio Moral no Trabalho produzida pela FETHESP https://www.facebook.com/media/set/?set=a.1068034979926863.1073741830.1057718660958495&type=3,2015
41,“Isso é assédio moral!”: um tipo de violência no trabalho wp.me/p5ZEXj-j via @rodrigopadrini #assédio #assédiomoral #rh,2015
42,"""Tudo agora é assédio"". No ônibus voltando cansada do trabalho tudo o que vc quer é levar encoxada e ser chamada de princesa.",2015
43,#RádioTST Ofensas em tom de brincadeira no trabalho podem caracterizar algum tipo de assédio? bit.ly/1QASnuu,2015
44,#RádioTST Ofensas em tom de brincadeira no trabalho podem caracterizar algum tipo de assédio? bit.ly/1QASnuu,2015
45,"@stalindadepre hahaha, ela vai falar do ""trabalho das ativistas"", e de como elas sofrem ""assédio"" dos homens...",2015
46,Importante trabalho do Jornal do Campus sobre assédio na USP. Os relatos são uma amostra da cultura do estupro e... fb.me/71N0OpEOo,2015
47,O assedio no trabalho deve ser algo fantastico. Eu acho que por um aumento vale tudo. Ou ate mesmo por sair mais cedo por 20 minutos,2015
48,Isso é assédio de trabalho pra não se transformar em cobra.  Q?;-; - 🌝💔 kiw.im/13nBR8Zyprt,2015
49,"eu já não tenho a menor vontade de sair de casa por causa de assédio na rua, daí acontece no trabalho tbm",2015
50,MPT processa empresas por praticar assédio moral em Ilhéus: O Ministério Público do Trabalho… goo.gl/fb/5eykz7,2015
51,Ilhéus: MPT processa a Subway por praticar assédio moral contra funcionários  O Ministério Público do Trabalho... fb.me/2B8TyeSZ3,2015
52,Novo Mundo terá de indenizar em R$ 15 mil vendedora de Rio Verde que sofreu assédio moral - blogdotrabalho.com/novo-mund…,2015
53,@hpcharles77 grande desafio é bloquear o assédio dos tios e avós gremistas e colorados...  Mas o trabalho aqui é forte e diário! :),2015
54,Consultor da Vivo registra cobranças por SMS em cartório e comprova assédio moral - blogdotrabalho.com/consultor…,2015
55,DIREITO DO TRABALHO: Consultor da Vivo registra cobranças por SMS em cartório e comprova assédio moral   Saiba... fb.me/2zd2AYvv1,2015
56,@facasnabota falaram isso pra vc amiga? foi do trabalho amiga? processinho de assedio sexual amiga?,2015
57,AUDIÊNCIA PÚBLICA PARA DISCUSSÃO DO ASSÉDIO MORAL AOS OPERADORES DE TELEMARKETING NO MINISTÉRIO DO TRABALHO. fb.me/2suliKMyO,2015
58,Assédio moral no trabalho fb.me/2ceI58D9d,2015
59,e o dia termina com assédio moral no trabalho,2015
60,Agora só falta Temer processar Dilma por assédio moral no Ministério do Trabalho,2015
61,"Lamber Cosplays cara? Além de ser assédio, o cara estragou o trabalho da mina, que custa dinheiro, tempo, disposição.",2015
62,@AlisonTheodoro e eu te processo por assedio no trabalho,2015
63,Consultor registra cobranças por SMS em cartório e comprova assédio moral  A Justiça do Trabalho condena empresa... fb.me/7OIAzzyn4,2015
64,"Seminário: Assédio Moral e Sexual - A Desigualdade de Gênero no Ambiente de Trabalho""  Presente!… https://www.instagram.com/p/-_9vVsP7lv/",2015
65,"Um assunto maravilhoso,sou soldadora trabalho embarcada além da descriminação o assédio existe,só depende de nós mulheres,tmj,Deus abençoe.",2015
66,"Como Evitar o ""assédio moral"" no local de trabalho?? A Agência produziu um conj is.gd/ej1B6q... fb.me/4buF1BU3u",2015
67,"Como Evitar o ""assédio moral"" no local de trabalho?? A Agência produziu um conj is.gd/ej1B6q #trabalhoerenda #trabalhoescravo",2015
68,Seminário Assédio Moral e Sexual: as desigualdades de gênero no ambiente de trabalho - São... fb.me/4JBnOzphd,2015
69,@felipeneto  o assunto no trabalho foi  assedio,2015
70,"Assédio sexual no trabalho é muito sério, quem se omite a isso compactua com a violência. Q a condenação da OAS sirva de exemplo",2015
71,"Desqualificar funcionários no ambiente de trabalho é assédio moral e pode causar danos como estresse, baixo... fb.me/30JK1sxoz",2015
72,Seminário de Assédio Moral e Sexual: Desigualdade de Gênero no Ambiente de Trabalho fsindical.org.br/U6SV | @CentralSindical,2015
73,"Na escolinha: assédio  No ensino médio: assédio Na faculdade: assédio No trabalho: assédio  Em todo lugar, toda a vida: assédio!",2015
74,DIREITO DO TRABALHO: Drogaria é condenada por não coibir assédio de gerente a balconista   Saiba mais em:... fb.me/70mFofm88,2015
75,Juíza do trabalho aborda “assédio moral na adm. pública” em palestra p/a DS Porto Alegre ocabrestosemno.com.br/index.… via @joomladaybrasil,2015
76,Como você lida com o assédio dos fãs e admiradores de seu trabalho? #OláLair EncontroComBrunoMontaleone,2015
77,"você já sofreu #aasediomoral ? BBC Brasil - Metade dos brasileiros já sofreu assédio no trabalho, aponta pesquisa bbc.com/portuguese/noticias/…",2015
78,"Crime de assédio moral no trabalho pode gerar até dois anos de reclusão lundi 2 juin 2008      Além de ser crime,... fb.me/2sB82PvEu",2015
79,Falabahia - Juiz fala sobre assédio moral no trabalho falabahia.com/detalhe-falaba… via @ibahia,2015
80,Assédio no trabalho é pesadelo para 36% das brasileiras tmblr.co/Z-x1sj1zBDqL9,2015
81,Juiz fala sobre assédio moral no trabalho cbnsalvador.com.br/noticias/…,2015
82,TV UNITAU: Assédio Moral no Trabalho https://tube.mint.lgbt/t9I1hs75-kg via @YouTube,2015
83,"Estupro moral é a nova modalidade no trabalho, incluindo em terceirizados e fornecedores de serviços. É feito junto com o assédio contratual",2015
84,"Agora rola assédio até no trabalho. Que lindo, que lindo",2015
85,Vamo la de novo... Agora trabalho com duas infos! Assedio forte do TIGRES e a ida tb do Grêmio para definir o negocio!,2015
86,"o bullying não é só coisa de criança, no direito do trabalho quando há assédio moral na relação de trabalho descobrimos que se chama mobbing",2015
87,“Isso é assédio moral!”: um tipo de violência no trabalho | Mais uma Opinião #assédio maisumaopiniao.com.br/2015/0…,2015
88,Curso grátis de prevenção ao assédio moral no trabalho. bit.ly/1vdmpLY #CursoGratis,2015
89,Será que você já sofreu assédio moral no trabalho? Alguns funcionários têm atitudes que são classificadas como tal. ow.ly/V8GnO,2015
90,#Notícia Assédio _ Sexual e Moral no Trabalho  Acompanhe a minha página Facebook.com/jeogen e veja mais fb.me/4TqhSCzJQ,2015
91,#Notícia Assédio _ Sexual e Moral no Trabalho  Acompanhe a minha página Facebook.com/jeogen e veja mais fb.me/6Z4mp5FX5,2015
92,#Notícia Assédio _ Sexual e Moral no Trabalho  Acompanhe a minha página Facebook.com/jeogen e veja mais fb.me/3lekhrkS5,2015
93,#Notícia Assédio _ Sexual e Moral no Trabalho  Acompanhe a minha página Facebook.com/jeogen e veja mais fb.me/zeBxnow3,2015
94,Você sofre assédio moral no trabalho? fb.me/4n24ADp65,2015
95,Você sofre assédio moral no trabalho? fb.me/6Zm25zVxF,2015
96,Assédio no ambiente de trabalho. Como os europeus cuidam disso? - https://lnkd.in/bGZ9evk,2015
97,o nível de assedio no meu trabalho é tão grande q os cara me chama até pra beber,2015
98,Cobrança reiterada de metas não é assédio moral - blogdotrabalho.com/cobranca-…,2015
99,"Assédio no trabalho. Vê, que maravilha",2015
100,Esse clipe é um exemplo perfeito de assédio no trabalho #MTVHitsMILGRAU,2015
101,@naomeacha que horror HHAAHAH assédio no trabalho issae,2015
102,Adicionei um vídeo a uma playlist @YouTube tube.mint.lgbt/YLfrY9KThmI?aPiada Assedio Sexual no trabalho,2015
103,Primeiro admiro a Jules de Faria que faz um lindo trabalho pelo fim da violência e do assédio contra as mulheres.... fb.me/G9b5O2fe,2015
104,@ricardofelici @bicmuller @letsantanaa não entendi. Prefere q sua filha sofra calada violência doméstica? Assédio no trabalho? Humilhação?,2015
105,É foda vc sofrer assédio moral no trabalho e não poder fazer nada. É foda sua empresa cometer vários crimes trabalhistas e vc não denunciar,2015
106,Gente o q vcs fariam se um filho de vcs sofresse um assédio moral no trabalho. Ao ponto de passar mal? Eu sei o q faria e vcs?,2015
107,Sempre fui contra o assédio das mulheres no ambiente de trabalho e me deixa feliz a campanha do #meuamigosecreto.... fb.me/TRsEOBXj,2015
108,O assédio no ambiente de trabalho fb.me/EgHwkJzn,2015
109,O assédio no ambiente de trabalho historiahoje.com/?p=7891,2015
110,"Pesquisa aponta que 36% das mulheres já sofreram assédio no trabalho, mas apenas 10% denunciariam. migre.me/sdVBt",2015
111,"Assédio Moral no Trabalho, por Robson Zanetti jacareidirect.com/produto/as…",2015
112,ninguém é diplomático quando sofro assédio no trabalho; ninguém é diplomático quando sou violentada por um desconhecido;,2015
113,"Mulheres são mortas, estupradas, violentadas, sofrem assédio diariamente no trabalho ou na rua, tem o salário... fb.me/20QfSq9Xq",2015
114,"Quem tem interesse sobre os assuntos: ""assédio moral e sexual"", e ""a importância da gestão de segurança do trabalho"" TEM PALESTRA NA CBTU",2015
115,ASSÉDIO NO TRABALHO É PESADELO PARA 36% DAS BRASILEIRAS... bit.ly/1NdwVL5,2015
116,"#meuamigosecreto é defensor de direitos humanos, mas pratica assédio moral no local de trabalho.  Por Patrícia Peterli",2015
117,é que nem quando vcs compartilhavam as histórias de primeiro assédio e não se davam ao trabalho de pôr um aviso de conteúdo,2015
118,"ai, vcs n querem me contar uma história de assédio q rolou c vcs n? eh p meu trabalho de sociologia... nunca pedi nada p vcs",2015
119,"#meuamigosecreto boicota mulher competente no trabalho, comete assédio moral.",2015
120,Plenária da Saúde discute casos de assédio moral e condições de trabalho. Veja mais no site: stmc.org.br,2015
121,"No meu trabalho só tem mulher, e o assunto do dia tá sendo assédio. TODAS aqui já foram assediadas. Pra vocês verem a que ponto chegamos...",2015
122,#meuamigosecreto é de esquerda e super liberal mas não sabe levar um não sem fazer assedio moral com coleguinhas de trabalho.,2015
123,Gaslighting no ambiente de trabalho é considerado assédio moral???,2015
124,esses bagui de assédio e estrupo é tão assustador que eu fiz meu pai me buscar do trabalho hoje por medo de voltar sozinha..,2015
125,amigo estava passando por assédio moral e bullying no trabalho por ser gay. reclamou c/ direção e o escroto foi demitido. bem feito!,2015
126,Assédio no trabalho é pesadelo para 36% das brasileiras dlvr.it/CqfBFF,2015
127,Assédio no trabalho é pesadelo para 36% das brasileiras dlvr.it/Cqdy8q,2015
128,Eai fi vai continuar com o assedio sexual em ambiente de trabalho msm ou vo ter que meter o famoso processinho,2015
129,Assédio no trabalho é pesadelo para 36% das brasileiras dlvr.it/Cqdnby,2015
130,"Assédio no trabalho é pesadelo para 36% das brasileiras: Os dados divulgados mostraram que, no Brasil, 36% já… dlvr.it/CqdtPZ",2015
131,Assédio via skype no trabalho,2015
132,@emesald assédio moral de macho sem noção teve  PS toda vez que acontece merda no meu trabalho vou ver e: no seu tb,2015
133,Você já sofreu ou conhece alguém que tenha sofrido assédio moral? Leia sobre esse tipo de violência no trabalho maisumaopiniao.com.br/2015/0…,2015
134,to sofrendo assédio no trabalho como lidar ~pesquisar,2015
135,Pesquisa: O assédio no mercado de trabalho é mais comum do que se imaginava. Confira:  ow.ly/Uhg56,2015
136,Assédio no ambiente de trabalho. Como os europeus cuidam disso? ln.is/lnkd.in/c3nq4,2015
137,"""Assédio no ambiente de trabalho. Como os europeus cuidam disso?"" por @pierangeli2013 no @LinkedIn ln.is/www.linkedin.com/pul/Y…",2015
138,O assédio no mercado de trabalho é mais comum do que se imaginava. Confira:  ow.ly/Uhg56,2015
139,"Veja nossa matéria sobre assédio moral no trabalho, e tire suas dúvidas sobre o assunto: migre.me/sbGRi",2015
140,"Assédio no trabalho é pesadelo para 36% das brasileiras Medo de se expor, de perder o emprego e a dificuldade de... fb.me/2IIdzEpts",2015
141,Assédio no trabalho é pesadelo para 36% das brasileiras itaporams.com/noticias/polic…,2015
142,Você já sofreu assédio no trabalho? Confira uma pesquisa sobre o tema: ow.ly/UhfYI,2015
143,Assédio Moral Pode Gerar Depressão e Afastamento do Trabalho  institutosc.com.br/blog/inss…,2015
144,ganhei um livro sobre assédio moral no trabalho,2015
145,"@Venissus @predros_ eu sei q o problema do assédio com as mulheres é muito sério e presente, principalmente em locais de trabalho",2015
146,Dos Direitos Humanos e o assédio moral no trabalho - Boletim Jurídico boletimjuridico.com.br/doutr…,2015
147,O que é assédio moral no trabalho assediomoral.ufsc.br/?page_i…,2015
148,@TiagoDvl assédio moral no trabalho...,2015
149,ASSÉDIO MORAL NO TRABALHO  Fonte: sina.org.br/  E o que é assédio moral no trabalho?  É a exposição... fb.me/6VyVoJ5sq,2015
150,“Isso é assédio moral!”: um tipo de violência no trabalho | Mais uma Opinião #assédiomoral #assédio maisumaopiniao.com.br/2015/0…,2015
151,Novo artigo: Assédio moral - consequências jurídicas no trabalho goo.gl/GGJ8wN,2015
152,"Qnd sua colega de trabalho, com mais de 40, escritora e professora, diz que o assédio ocorre pq a mulher não controla sua energia sexual.",2015
153,"⚡Apresentação ""Assédio Moral no local de trabalho Sara Martins Cruz."" slideplayer.com.br/slide/123…",2015
154,"estou a sentir o assédio, escusas de te dar ao trabalho",2015
155,Juiz fala sobre assédio moral no trabalho - Matéria Bom Dia Minas https://tube.mint.lgbt/RZiFz5XJceE via @YouTube,2015
156,ASSEDIO SEXUAL NO TRABALHO É CRIME,2015
157,Guia sobre Assédio no local de trabalho. Disponível para consulta e download. fb.me/2WvM1KvnX,2015
158,A prática do assédio moral está diretamente ligada às condições de trabalho. A redução da jornada da/o... fb.me/4fHxFX9NV,2015
159,"@bbcbrasil Aqui no Brasil seria tratado como assédio moral, trabalho infantil e ofensa aos direitos humanos.",2015
160,Sofrer assédio em ambiente de trabalho é terrível. TUDO PQ SOU MULHER?,2015
161,Assédio moral no trabalho fb.me/48on2Y3lL,2015
162,EEAU_15 Mesa 1 Assédio Moral no Ambiente de Trabalho fb.me/4bfnDMz5g,2015
163,@rosana Assédio moral eu vejo todos os dias onde trabalho.,2015
164,Assédio Moral no Trabalho e Bullying Escolar: Lei 13.185/2015. Por Gustavo Filipe Barbosa Garcia​: goo.gl/hQeZ1S,2015
165,Assédio Moral no Trabalho e Bullying Escolar: Lei 13.185/2015. Por Gustavo Filipe Barbosa Garcia​: goo.gl/hQeZ1S,2015
166,"Já sofreu assédio do trabalho, teve reajuste negado? Então vc entende a gente #EBCemGreve",2015
167,Por um ambiente de trabalho saudável em que a empresa não tolere assédio moral e sexual #EBCemGreve,2015
168,"@nacarolbjs é horrível essa naturalização do assédio moral no ambiente de trabalho, tem até figura q é paga pra defender isso na imprensa",2015
169,Incrível como em pleno séc. XXI as mulheres independentes ainda sofrem diversos tipos de assédio em seus ramos de trabalho,2015
170,Assedio no trabalho? Magina #TBTNoMTVHits,2015
171,#primeirobabaca pra que a gente possa compartilhar histórias de assédio moral no trabalho e passar a tarde juntos tomando dollynho.,2015
172,Como se defender do assédio moral no trabalho exame.abril.com.br/revista-v…,2015
173,Alternativa - Japão: estudo mostra drama de gestantes que sofrem assédio moral no trabalho alternativa.co.jp.2-t.jp/kYD… #Nippon #Japão,2015
174,Japão: estudo mostra drama de gestantes que sofrem assédio moral no trabalho fb.me/6X51tv6TM,2015
175,Assédio Moral - Procurador do Trabalho aborda as consequências do assédio moral - viaseg.com.br/noticia/16362-…,2015
176,Procurador do Trabalho aborda as consequências do assédio moral  bit.ly/1LanMx9,2015
177,Simples cobrança de metas não configura assédio moral - blogdotrabalho.com/simples-c…,2015
178,"@EncontroFatima tenho 35 anos e sofri assédio desde sempre em várias situações,  ônibus,  trabalho,  quando criança por adultos",2015
179,Mais um capítulo na história sobre o assédio. Hj voltando do trabalho fui seguida do início da Paço Imperial até as barcas. +,2015
180,"@mariruybarbosa parabéns por seu trabalho, muito importante chamar atenção para o grande problema que é o assedio em nossa sociedade!",2015
181,"Assédio moral ou bullying no trabalho, você é vítima?? deficienteciente.com.br/2011…",2015
182,Assédio Moral no Trabalho e Bullying Escolar: Lei 13.185/2015 gustavogarcia.adv.br/assedio…,2015
183,Projeto Qualificar debateu o assédio moral no ambiente de trabalho fb.me/7qi2f4S8L,2015
184,Assédio no ambiente de trabalho. Como os europeus cuidam disso? https://lnkd.in/epPZDad,2015
185,"""Assédio no ambiente de trabalho. Como os europeus cuidam disso?"" por @pierangeli2013 no @LinkedIn https://www.linkedin.com/pulse/ass%C3%A9dio-ambiente-de-trabalho-como-os-europeus-cuidam-catarina",2015
186,"No trabalho, assédio será moral ou sexual - domtotal.com/noticias/detalh…",2015
187,Juliana Bracks comenta sobre assédio moral no ambiente de trabalho migre.me/s4jyj Via Globonews,2015
188,"a situação no meu trabalho só melhora cada vez mais, agora estão querendo trazer pra minha área um cara acusado de assedio sexual",2015
189,“Isso é assédio moral!”: um tipo de violência no trabalho wp.me/p5ZEXj-j #assédiomoral #assédio,2015
190,*ASSÉDIO Moral e Sexual no trabalho (0:43') *Tipos de FIANÇA para aluguel de imóvel (7:25') *SEPARAÇÃO/DIVÓRCIO -... fb.me/47wlreSBt,2015
191,*ASSÉDIO Moral e Sexual no trabalho (0:43') *Tipos de FIANÇA para aluguel de imóvel (7:25') *SEPARAÇÃO/DIVÓRCIO -... fb.me/7FDE6kQcS,2015
192,A gerência ou o colega pelego está tentando convencer você a voltar ao trabalho?? Não aceite!! Isso é assédio... fb.me/5pdDwfVbc,2015
193,To fazendo o tal trabalho sobre assédio com os alunos. Eles me entregaram os casos anonimamente. To chorando aqui :(,2015
194,Ontem eu meus amiguinhos lindos da faculdade fizemos um trabalho muito louco que envolvia fotografia analógica e assédio,2015
195,@ProjetoJBFollow denunciei por assedio pq ta assediando o trabalho do meu idolo bj,2015
196,Aprenda a identificar o assédio moral no ambiente de trabalho doutissima.com.br/2015/11/07…,2015
197,"Pesquisa aponta que 36% das mulheres já sofreram assédio no trabalho, mas apenas 10% denunciariam bit.ly/20ALwWD #revistadonna",2015
198,Rio Sul: Assédio moral no trabalho riosul2012.com/2015/03/assed…,2015
199,Bruno Dantas diz que o assédio moral dos trabalhadores acontece diariamente com ameaças de demissões para quem não retornar ao trabalho.,2015
200,Assédio sexual no trabalho querido,2015
201,A maioria das pessoas que sofre assédio no trabalho passa oito horas trabalhando e o resto do dia sofrendo por antecipação.,2015
202,Drogaria é condenada por não coibir assédio de gerente a balconista - blogdotrabalho.com/drogaria-…,2015
203,Curso grátis de prevenção ao assédio moral no trabalho. bit.ly/1vdmpLY #CursoGratis,2015
204,Marca de roupas conhecida por trabalho escravo terá de pagar R$ 15 mil por assédio moral em loja no DF:      ... bit.ly/1QeBtBU,2015
205,Marca de roupas conhecida por trabalho escravo terá de pagar R$ 15 mil por assédio moral em loja no DF:      ... bit.ly/1QeBtSp,2015
206,Marca de roupas conhecida por trabalho escravo terá de pagar R$ 15 mil por assédio moral em loja no DF:      ... bit.ly/1QeBtBU,2015
207,Marca de roupas conhecida por trabalho escravo terá de pagar R$ 15 mil por assédio moral em loja no DF:      ... bit.ly/1QeBtSp,2015
208,Marca de roupas conhecida por trabalho escravo terá de pagar R$ 15 mil por assédio moral em loja no DF - noticiasembrasilia.com.br/no…,2015
209,Baixei esse app do assedio e minhas estatisticas sao basicamente assedios perto do meu trabalho. E na volta p casa dps de plantoes em fds :(,2015
210,Assédio no trabalho. ...quem nunca?,2015
211,Salão de Atos da UFRGS permanece lotado para discussão das condições de trabalho e assédio moral. Acompanhe ao vivo aovivo.ufrgs.br/ufrgstv,2015
212,Salão de Atos da UFRGS lotado para debates sobre assédio moral no trabalho: ao vivo ufrgs.br/tv,2015
213,"Tá rolando o II Seminário Assédio Moral Estado, Poder e Assédio: relações de trabalho na administração pública.",2015
214,A pessoa séria e honesta é a vítima do assédio moral no trabalho por atrapalhar interesses de mercado.,2015
215,O assédio no trabalho traz a solidão e a desesperança.( dr Álvaro Merlo.),2015
216,Retweeted UFRGS TV (@ufrgstv):  equipe @ufrgstv transmite ao vivo palestras sobre condições de trabalho e assédio... fb.me/6NcmvVdLs,2015
217,equipe @ufrgstv transmite ao vivo palestras sobre condições de trabalho e assédio moral aovivo.ufrgs.br/ufrgstv,2015
