,tweets,ano
1338,"eu tenho reparado nisso depois q passei a ir de carro pro trabalho, q o assédio só existe qdo vc está de a pé ou de transporte público, +",2017
1339,Assédio Moral no Ambiente de Trabalho fb.me/vDo7H6FC,2017
1340,"O que fazer quando voce sofre assedio no trabalho ? ""-""",2017
1341,1 semana pra concluirem que assédio é assédio parabéns pelo trabalho justiça americana vcs são uns grande coco de merda,2017
1342,Assédio moral e sexual leva empresa a pagar indenização - blogdotrabalho.com/assedio-m…,2017
1343,"Participe do I Seminário de Prevenção ao Assédio Moral no Trabalho. Amanhã (15), às 08h, no auditório 3 da FS. ;) https://goo.gl/i37feA",2017
1344,""" Foi um assédio sexual em um ambiente de trabalho"" #taylorswifttrial",2017
1345,Sofrer assédio moral e psicológico no trabalho é foda 2 anos depois e eu ainda quero correr pra bem longe e bem rápido,2017
1346,homem defendendo homem em caso de assédio e querendo ditar como uma mulher deveria reagir ao ser assediada em seu ambiente de trabalho,2017
1347,Assédio moral e sexual leva empresa a pagar indenização — Tribunal Regional do Trabalho 13ª Região - Paraíba fb.me/1wBBqKbV2,2017
1348,chorei de soluçar na empresa no dia que pedi demissão será que sofri assedio moral no trabalho durante o tempo que estive la?,2017
1349,Assédio: um desafio para a mulher no ambiente de trabalho ideiademarketing.com.br/2017… via @ideiademkt,2017
1350,"""Sempre trabalho duro, um dia os colegas ainda me acusam de assédio"" @hernanidasilva #punchlinesfordays",2017
1351,Sintfub promove I Seminário sobre o Combate ao Assédio Moral no Trabalho https://fs.unb.br/unb-fs/sintfub-promove-i-seminario-sobre-o-combate-ao-assedio-moral-no-trabalho,2017
1352,Assédio sexual como dispositivo de opressão à mulher no ambiente de trabalho https://jornalismoespecializadounesp.wordpress.com/2017/07/28/assedio-sexual-como-dispositivo-de-opressao-a-mulher-no-ambiente-de-trabalho/,2017
1353,Adicionei um vídeo a uma playlist @YouTube youtu.be/JMxK-vPyGy8?aComo Lidar com Assédio Moral no Trabalho,2017
1354,Gostei de um vídeo @YouTube youtu.be/JMxK-vPyGy8?aComo Lidar com Assédio Moral no Trabalho,2017
1355,Aproveita e aprimora a lei de assédio no trabalho. Ta cada  dia maior. Eu dei uma surra no meu último patrão dos pé a cabeça por assédio,2017
1356,[Presença na Mídia] Assédio: um desafio para a mulher no ambiente de trabalho zpr.io/PVEVf,2017
1357,"Sobre o assédio sexual no trabalho: a vida imita a arte, ou a arte imita a vida? dlvr.it/PdNTGT",2017
1358,"""Sempre trabalho duro, um dia as colegas ainda me acusam de assédio..."" @hernanidasilva #PunchLinesForDays",2017
1359,TRF1: Meros dissabores e aborrecimentos no ambiente de trabalho não configuram assédio moral correioforense.com.br/danomo…,2017
1360,"Romancezinho forçado entre os protagonistas, porém. Não pelos atores - que até têm química - mas porque configura assédio sexual no trabalho",2017
1361,"Cara, o pior q não. O trabalhador tem direito de desenvolver seu trabalho. Pq então o Porco num manda ele embora? Isso é assédio sim.",2017
1362,Amazon é processada por assédio a mulher transgênero e seu marido durante o trabalho | https://glo.bo/2fxyCeg,2017
1363,Assédio: um desafio para a mulher no ambiente de trabalho ow.ly/Cftk50dnpUa,2017
1364,Assédio: um desafio para a mulher no ambiente de trabalho ift.tt/2fw6JTU #marketing,2017
1365,Assedio* bigs. Assedio sexual é quando tem uma hierarquia e é quando ocorre em ambiente de trabalho entre chefe e empregado.,2017
1366,Meros dissabores e aborrecimentos no ambiente de trabalho não configuram assédio moral: advariovaldo.com.br/blog/mer… #assedio #assediomoral,2017
1367,Gente eu tava sofrendo assédio no trabalho eu tava mt afetada cm isso fui nem na aula mas agora conversaram cm aquele embuste tarado,2017
1368,"Negar trabalho a um empregado é assédio, afastá-lo do convívio com os pares também. Várias decisões no TST. Ganha facinho.",2017
1369,olha o Palmeiras tomando na tarraqueta pela 2ª X em menos de 24 hrs. F.Melo quer ser reintegrado.Caso não. Just.Trabalho (assedio moral),2017
1370,Amazon é processada por assédio a mulher transgênero e seu marido durante o trabalho dlvr.it/PdC7YQ,2017
1371,Sempre trabalho duro um dia ainda as colegas vão me acusar de assédio 😬😂👊  #PunchlinesForDays💫,2017
1372,Amazon é processada por assédio a mulher transgênero e seu marido durante o trabalho https://goo.gl/P7agNb,2017
1373,Sempre trabalho duro um dias as colegas me acusam de assédio  @hernanidasilva #PunchlineForDays 👹.,2017
1374,TRF-1ª – Meros dissabores e aborrecimentos no ambiente de trabalho não configuram assédio moral dnz.to/1Kdt,2017
1375,""" Sempre trabalho duro um dia as colegas ainda me acusam de assédio "" - Hernâni Da Silva MixTape ""Punchlines For Days""",2017
1376,""" Sempre trabalho duro um dia as colegas ainda me acusam de assédio "" - Hernâni Punchlines For Days",2017
1377,New post in AvisAra: Amazon é processada por assédio a mulher transgênero e seu marido durante o trabalho … ift.tt/2uKyo5h,2017
1378,Pütz... Amazon é processada por assédio a mulher transgênero e seu marido durante o trabalho  Casal trabalhava em es…https://lnkd.in/e6Bbpij,2017
1379,Meros dissabores e aborrecimentos no ambiente de trabalho não configuram assédio moral.   A interferência no... fb.me/2hCJA3rwY,2017
1380,Meros dissabores e aborrecimentos no ambiente de trabalho não configuram assédio moral https://goo.gl/grHp6M,2017
1381,TRF1: Meros dissabores e aborrecimentos no ambiente de trabalho não configuram assédio moral  https://correio-forense.jusbrasil.com.br/noticias/486823518/trf1-meros-dissabores-e-aborrecimentos-no-ambiente-de-trabalho-nao-configuram-assedio-moral,2017
1382,Amazon é processada por assédio a mulher transgênero e seu marido durante o trabalho fb.me/yWY8lPwh,2017
1383,Amazon é processada por assédio a mulher transgênero e seu marido durante o trabalho ow.ly/Rkau50dmDAy,2017
1384,Amazon é processada por assédio a mulher transgênero e seu marido durante o trabalho https://goo.gl/fb/16Hedw,2017
1385,Amazon é processada por assédio a mulher transgênero e seu marido durante o trabalho dlvr.it/Pd6r2B,2017
1386,Amazon é processada por assédio a mulher transgênero e seu marido durante o trabalho https://goo.gl/fb/Nx4FTS,2017
1387,Amazon é processada por assédio a mulher transgênero e seu marido durante o trabalho ow.ly/ybV550dmxCp,2017
1388,Amazon é processada por assédio a mulher transgênero e seu marido durante o trabalho ift.tt/2vRRdHT,2017
1389,Amazon é processada por assédio a mulher transgênero e seu marido durante o trabalho g1.globo.com/tecnologia/noti… #umRei #TimBeta #RT #SDV,2017
1390,Amazon é processada por assédio a mulher transgênero e seu marido durante o trabalho ift.tt/2vRRdHT #MissaoBeta #BetaAjudaBeta #t…,2017
1391,Amazon é processada por assédio a mulher transgênero e seu marido durante o trabalho  Casal trabalhava em estoque … ift.tt/2vRRdHT,2017
1392,"""Amazon é processada por assédio a mulher transgênero e seu marido durante o trabalho | Tecnologia e ... (g1.globo.com/tecnologia/noti…)"" #tecnoh…",2017
1393,Amazon é processada por assédio a mulher transgênero e seu marido durante o trabalho https://goo.gl/fb/W2C8pE,2017
1394,Amazon é processada por assédio a mulher transgênero e seu marido durante o trabalho | Tecnologia e ... (g1.globo.com/tecnologia/noti…),2017
1395,Amazon é processada por assédio a mulher transgênero e seu marido durante o trabalho ift.tt/2vRRdHT,2017
1396,TRF1: Meros dissabores e aborrecimentos no ambiente de trabalho não configuram assédio moral correioforense.com.br/danomo…,2017
1397,Amazon é processada por assédio a mulher transgênero e seu marido durante o trabalho https://glo.bo/2usIXLc,2017
1398,Amazon é processada por assédio a mulher transgênero e seu marido durante o trabalho https://glo.bo/2usIXLc,2017
1399,Amazon é processada por assédio a mulher transgênero e seu marido durante o trabalho https://glo.bo/2usIXLc,2017
1400,Meros dissabores e aborrecimentos no ambiente de trabalho não configuram assédio moral. (boletimjuridico.publicacoeso…).,2017
1401,- Meros dissabores e aborrecimentos no ambiente de trabalho não configuram assédio moral bomdia.adv.br/noticia-single…,2017
1402,Incrível como relações de trabalho podem ser extremamente abusivas (No sentido de assédio moral mesmo),2017
1403,"Amazon é processada por mulher transgênero e marido por assédio no trabalho https://www.terra.com.br/noticias/tecnologia/amazon-e-processada-por-mulher-transgenero-e-marido-por-assedio-no-trabalho,6319a7ef7df1d400b725747901119908y6daemj1.html",2017
1404,"@pabllovittar pabllo, eu sofri assédio dentro da empresa que eu trabalho ontem e a sua música foi a única coisa que me fez sorrir hoje, obg",2017
1405,ASSÉDIO MORAL X VOCÊ  ASSÉDIO MORAL X VOCÊ Acesso Livre Desenvolve: Como se defender do assédio moral no trabalho acessolivredesenvolve.blogsp…,2017
1406,Bruna Marquezine falando que já sofreu assédio no ambiente de trabalho por causa da beleza.   Bem vinda ao meu mundo Bruna...,2017
1407,Você conhece alguém que já passou por assédio moral no trabalho?  parceiros.catho.com.br/go.ph…,2017
1408,"Assédio no trabalho: conhecer, prevenir, combater https://goo.gl/xAPJdl",2017
1409,@Glauber_Braga @depChicoAlencar @jandira_feghali 17 anos tramitando! SIM ao #PL4742 /2001 ou apens. #PL7461 /2017 ASSÉDIO MORAL no TRABALHO,2017
1410,"Antes da aprovação desse PLS, deve-se aprovar a criminalização do assédio moral no trabalho indefinido há 17 anos👇",2017
1411,Adicionei um vídeo a uma playlist @YouTube youtu.be/opjQBsGT-SY?aMPPE debate o assédio moral no ambiente de trabalho,2017
1412,MPPE debate o assedio Moral no ambiente de trabalho: youtu.be/opjQBsGT-SY?a via @YouTube,2017
1413,#RadarEleitoral: Encontro no TSE reúne especialistas para tratar do assédio moral no trabalho. Assista ao vivo em youtube.com/justicaeleitoral!,2017
1414,Apresentadora da Record revela que sofreu assédio sexual durante o trabalho: “Fiquei… https://goo.gl/fb/m1iR54,2017
1415,Apresentadora da Record revela que sofreu assédio sexual durante o trabalho: “Fiquei assustada”  otvfoco.com.br/apresentadora…,2017
1416,Apresentadora da Record revela que sofreu assédio sexual durante o trabalho: “Fiquei assustada” https://goo.gl/5ZpgJb,2017
1417,Ciclo de Debates discute assédio e saúde no trabalho bit.ly/2ujaSRt,2017
1418,ASSÉDIO MORAL no ambiente de trabalho !!  Assista ao SIMPASSO na TV que tratou deste tema na edição mais recente... fb.me/8T9HAHkdY,2017
1419,#SouMulherE Repudio o assédio moral à mulher no trabalho!!!,2017
1420,Fica a saber quais os direitos das vítimas de assédio no local de trabalho em Portugal smack.pt/atualidade/2017-08-…,2017
1421,#JuizDeFora Ciclo de Debates discute assédio e saúde no trabalho https://jfclippingblog.wordpress.com/2017/08/07/ciclo-de-debates-discute-assedio-e-saude-no-trabalho/,2017
1422,Assédio no trabalho: a mudança necessária contra o isolamento esquerda.net/opiniao/assedio…,2017
1423,Assédio moral: Perseguidos e humilhados no trabalho fb.me/8i2DU5gg7,2017
1424,"Em meados de 2013 eu sofri oq a minha terapeuta classificou como ""assédio psicológico"" no trabalho. Eu tava muito mal, chorava todo dia",2017
1425,"Assédio sexual no trabalho, fausto toma cuidado, elas podem denunciar",2017
1426,Assédio moral: Perseguidos e humilhados no trabalho fb.me/1BBd1DFNh,2017
1427,Muito me impressiona o assédio sofrido no trabalho,2017
1428,Se eu falar 'decotão top' posso ser processado por assédio em ambiente de trabalho??,2017
1429,Assédio moral: Perseguidos e humilhados no trabalho jornaleconomico.sapo.pt/noti… via @ojeconomico,2017
1430,"Consequências – O assédio moral no trabalho desestabiliza o empregado, tanto na vida profissional quanto pessoal,... fb.me/xL8gULq6",2017
1431,"Situações vexatórias – Como exemplos frequentes de assédio moral no ambiente de trabalho, podemos citar a... fb.me/1zhS4lfNx",2017
1432,"ASSÉDIO MORAL CONTRA O EMPREGADO Equipe Guia Trabalhista  Tão antigo quanto o trabalho, o assédio moral... fb.me/8YcFbrb6e",2017
1433,Fica aqui o meu apreço e admiração pelo seu trabalho e pela coragem para enfrentar esse assédio todo.,2017
1434,Ser vítima de assédio no trabalho é suposto fazer parte da experiência ou devo só fazer queixa?,2017
1435,Gostei de um vídeo @YouTube youtu.be/-9NsoLU3SMQ?aJornad… fala sobre o assédio moral no ambiente de trabalho,2017
1436,Gostei de um vídeo @YouTube youtu.be/l3nf02bPz44?aComo Denunciar Assédio Moral no Trabalho,2017
1437,Machismo no meio nerd | Editora da Marvel toma Milkshake com colegas de trabalho e sofre assédio. – Collant collant.com.br/editora-marve…,2017
1438,Assédio moral: Perseguidos e humilhados no trabalho dlvr.it/PbxdRw,2017
1439,"Acho que caberia até uma indenização por assédio moral. É muita humilhação no ambiente de trabalho e exposta ao vivo pela TV, uma fortuna.",2017
1440,A mão de processar colega de trabalho por assédio moral chega a coçar,2017
1441,VIII Congresso - Palestras sobre Assédio Moral e Segurança do Trabalho,2017
1442,"Quando a gente pensa que assédio no trabalho só acontece com os outros, hein? esquecemos que somos os outros dos outros",2017
1443,Enquete mostra que quase 50% das mulheres motoristas já sofreram assédio no trabalho https://glo.bo/2u5m1Bt,2017
1444,Assédio no trabalho: a mudança necessária contra o isolamento esquerda.net/opiniao/assedio…,2017
1445,"Pelo menos irei manter contato com a lindeza *-* (Mas apenas trabalho, nada de assedio!!!)",2017
1446,👉 Existem dois tipos de assédio sexual no ambiente de trabalho: a chantagem e a intimidação. Veja aqui 👇 como... fb.me/DBhdA5sD,2017
1447,👉 Existem dois tipos de assédio sexual no ambiente de trabalho: a chantagem e a intimidação. Veja aqui 👇 como... fb.me/AY4rhnsn,2017
1448,Assédio Moral no local de trabalho tem consequências na sua saúde.  Proteja-se! Reaja! Denuncie! Defenda-se!... fb.me/7uVwIQyUD,2017
1449,"#MakeMineMilkshake  Editora da Marvel toma Milkshake com colegas de trabalho, faz selfie e sofre assédio collant.com.br/editora-marve…",2017
1450,Assédio moral: Quando o trabalho mata e adoece edsonsombra.com.br/post/asse…,2017
1451,EsquerdaNet: Assédio no trabalho: a mudança necessária contra o isolamento dlvr.it/Pbbfbt,2017
1452,Assédio no trabalho: a mudança necessária contra o isolamento esquerda.net/opiniao/assedio…,2017
1453,Assédio no trabalho: a mudança necessária contra o isolamento dlvr.it/PbbkRB,2017
1454,Assédio contra mulheres em ambiente de trabalho é debatido na Câmara de Natal -  rnmais.com.br/politica/assed… co...,2017
1455,Assédio no trabalho: a mudança necessária contra o isolamento dlvr.it/PbbjNw,2017
1456,Assédio no trabalho: a mudança necessária contra o isolamento dlvr.it/Pbbfbt,2017
1457,IMIP é denunciado no Ministério Público do Trabalho por assédio moral e pendências salariais https://goo.gl/gSsgxV,2017
1458,"No ambiente de trabalho, é no mínimo ASSÉDIO! É machismo. É estupidez. Falta de respeito a mulher e colega.",2017
1459,Está na hora de falar mais sobre o Assédio Moral no ambiente de trabalho. Confira quais são os direitos do... fb.me/706yApZNi,2017
1460,"Ah ta, vou sair xingando meu patrão aqui no meu trabalho e depois vou querer denunciar ele por assedio moral",2017
1461,Gostei de um vídeo @YouTube youtu.be/JMxK-vPyGy8?aComo Lidar com Assédio Moral no Trabalho,2017
1462,@camaradeputados APROVAÇÃO Já #PL4742 /2001/apensado #PL7461 /17 ASSÉDIO MORAL no TRABALHO precisa ser CRIMINALIZADO,2017
1463,Morro de nojo! Assédio sexual no trabalho 100% romantizado,2017
1464,Assédio contra mulheres em ambiente de trabalho é debatido na CMN  agorarn.com.br/destaques/ass…,2017
1465,"Em audiência pública, a CMN discutiu, nesta quarta (2), o assédio sexual e moral contra as mulheres no ambiente de trabalho.",2017
1466,"Editora da Marvel toma Milkshake com colegas de trabalho, faz selfie e sofre assédio. – Collant sem decote collant.com.br/editora-marve…",2017
1467,"Machismo no meio nerd | Editora da Marvel toma Milkshake com colegas de trabalho, faz selfie e sofre assédio. fb.me/8dOJY7zka",2017
1468,"Empoderador o debate sobre assédio sexual e moral contra mulheres no ambiente de trabalho, na audiência proposta pela verª @natbonavides.",2017
1469,Audiência Pública proposta por @natbonavides para discutir a situação do assédio Sexual e Moral contra as mulheres no ambiente de trabalho.,2017
1470,"Audiência Pública para discutir o assédio sexual e moral contra as mulheres no ambiente de trabalho, pela vereadora @natbonavides⁠⁠⁠⁠.",2017
1471,Começou! Audiência pública para debater assédio sexual e moral no trabalho. Sintoniza na TV Câmara 51.4 (digital) e 10 (Cabo) #EquipeBonas,2017
1472,"Machismo: Editora da Marvel toma Milkshake com colegas de trabalho, faz selfie e sofre assédio. – Collant sem decote collant.com.br/editora-marve…",2017
1473,"E ainda aguentando todo o assédio e até ameaças. Parabéns pelo trabalho, @marcelobechler!",2017
1474,Assédio moral: quando o trabalho mata e adoece ensp.fiocruz.br/portal-ensp/…,2017
1475,"Machismo no meio nerd | Editora da Marvel toma Milkshake com colegas de trabalho, faz selfie e sofre assédio. collant.com.br/editora-marve…",2017
1476,"Machismo no meio nerd | Editora da Marvel toma Milkshake com colegas de trabalho, faz selfie e sofre assédio. collant.com.br/editora-marve…",2017
1477,Câmara promove debate sobre assédio a mulheres no ambiente de trabalho  agorarn.com.br/destaques/cam…,2017
1478,Assédio moral: 9 situações no trabalho para ficar alerta e como encará-las. Confira matéria do UOL sobre o tema: sindjus2.hospedagemdesites.w…,2017
1479,"Machismo no meio nerd | Editora da Marvel toma Milkshake com colegas de trabalho, faz selfie e sofre assédio. – collant.com.br/editora-marve…",2017
1480,"Machismo no meio nerd | Editora da Marvel toma Milkshake com colegas de trabalho, faz selfie e sofre assédio.  collant.com.br/editora-marve…",2017
1481,"Editora da Marvel toma Milkshake com colegas de trabalho, faz selfie e sofre assédio. – Collant sem decote collant.com.br/editora-marve…",2017
1482,"Machismo no meio nerd | Editora da Marvel toma Milkshake com colegas de trabalho, faz selfie e sofre assédio. collant.com.br/editora-marve…",2017
1483,Denuncie o assédio no trabalho. fb.me/Ml7DyGWf,2017
1484,me passa a lista de quantos jogadores são reconhecidos apenas pela beleza e não pelo talento e quantos tem que aguentar assédio no TRABALHO https://twitter.com/RMora3s/status/892067650716794881,2017
1485,"sobre o machismo no meio nerd: editora da marvel toma milkshake com colegas de trabalho, faz selfie e sofre assédio. collant.com.br/editora-marve…",2017
1486,"Collant sem Decote | Editora da Marvel toma milkshake com colegas de trabalho, faz selfie e sofre assédio  collant.com.br/editora-marve…",2017
1487,"Machismo no meio nerd | Editora da Marvel toma Milkshake com colegas de trabalho, faz selfie e sofre assédio. collant.com.br/editora-marve…",2017
1488,"bit.ly/bullyinggroomingstalk… - Confira o artigo ""Bullying Grooming Stalking e afins"", de Ivanira Pancheri, da Coluna Assédio Moral no Trabalho.",2017
1489,Saiba como lidar com as situações de assédio moral no ambiente de trabalho.  Fonte: UOL fb.me/25g8w6WQb,2017
1490,"Bom dia, bora pra mais uma semana de trabalho tranquilo, sem assédio, sem briga pra saber quem manda mais, sem fofocas...",2017
1491,Assédio moral: 9 situações no trabalho para ficar alerta e como encará-las trib.al/1ADbmGa,2017
1492,Assédio moral no trabalho: nove situações para ficar alerta uol.com/bbkfKF @UOLNoticias #UOL,2017
1493,Assédio moral: 9 situações no trabalho para ficar alerta e como encará-las ift.tt/2hdcuGw,2017
1494,Assédio moral: 9 situações no trabalho para ficar alerta e como encará-las uol.com/bbkfKF @UOL,2017
1495,"Tô assistindo um ep de Família Dinossauro e tá passando sobre assédio sexual no ambiente de trabalho com uma mulher, que ep incrível!",2017
1496,"BetterBrave, site lançado no início de julho, ajuda mulheres dos US a tomarem medidas contra o assédio sexual no trabalho.",2017
1497,Companhias como Google e Uber foram acusadas de assédio no trabalho fb.me/19oVPDVo1,2017
1498,"Pressão familiar, assédio moral, sobrecarga de trabalho, horas de estudos mal planejadas, dificuldades... fb.me/21KMtTIdV",2017
1499,@DepRodrigoMaia Inaceitáveis 17 anos @betinhogomes APROVAÇÃO Já do #PL4742 /2001 ou apensado #PL7461 /2017 ASSÉDIO MORAL no TRABALHO,2017
1500,esse ano eu fui com uma amiga reportar um caso de assedio no trabalho na deleg da mulher e nem lá pode ser feito kkk,2017
1501,Gostei de um vídeo @YouTube youtu.be/ZKGzTjljGgM?aDocume…ário A dor (in)visível - Assédio Moral no Trabalho,2017
1502,"Assédio no mercado de trabalho: setor de RH é, por natureza, contra os funcionários? Entenda na reportagem: https://goo.gl/DjiX3g",2017
1503,Tammy Preston sofre assédio no ambiente de trabalho,2017
1504,Sofrendo calado assédio e discriminação no trabalho? Procure seu advogado de confiança e mova uma reclamação... fb.me/xf4jM2zU,2017
1505,@embratel  Como pode uma empresa tão grande não apoiar e ainda demitir a mulher que sofre #assédio sexual no trabalho #Protesto #injustica,2017
1506,Nosso episódio desta semana trata de assédio moral e assédio organizacional no local de trabalho.   É dia 27 de... fb.me/I2rsoSNe,2017
1507,Sem falar que configura assédio moral de trabalho o que o Dorival fez com o Vecchio. Que o Dorival ja chegou no SP excluindo pessoas. (+),2017
1508,"Sem contar que ele é major e ela é sargento, ou seja, ele é superior dela e o romance todo não passa de assédio no trabalho.",2017
1509,"Gostei de um vídeo @YouTube youtu.be/W2iA2q3Be8U?aEduard… Faria (Senge-PR) - Seminário ""Assedio Moral, Condições de Trabalho e",2017
1510,"quem  se submete a esse tipo de trabalho esta se submetendo apenas ao que ela trabalha, assedio nao ta no pacote",2017
1511,Assédio moral no trabalho: como evitar fb.me/8gXH5cQLY,2017
1512,Curso de Especialização em Saúde do Trabalhador debaterá o assédio moral no trabalho fb.me/2SfKJt9Ws,2017
1513,ASSÉDIO MORAL NO TRABALHO   Boa noite colega servidor. Esta semana queremos tratar de um assunto muito delicado e... fb.me/1wGtr359K,2017
1514,"Eduardo Faria (Senge-PR) - Seminário ""Assedio Moral, Condições de Trabalho e Adoecimento"" fb.me/4eZpUPbgU",2017
1515,"Profª Juçara Dutra - Seminário ""Assedio Moral, Condições de Trabalho e Adoecimento"" fb.me/aOYD5WmGn",2017
1516,... DEIXAR EMPREGADO SEM TRABALHO É ASSÉDIO MORAL...,2017
1517,"X Colóquio Anual de Direito do Trabalho STJ,18/10/2017 Minha Conferência: Assédio na relação laboral: conceito https://drive.google.com/open?id=0ByLuNZGcaEHjaFBwYkVsOXF6cHM",2017
1518,O problema é que é assédio. No trabalho.,2017
1519,"Depressão, burnout e assédio no trabalho ift.tt/2tplhqh",2017
1520,Vítimas de assédio no local de trabalho passam a ser indemnizadas fb.me/6qdFllm5L,2017
1521,"""Saúde mental e assédio no trabalho"" https://www.linkedin.com/pulse/saúde-mental-e-assédio-trabalho-lelio-muniz-barretto by @leliomunizbarr1 on @LinkedIn",2017
1522,Assédio moral no trabalho é crime vc sabia ? #ficaadicavocê empregador,2017
1523,JT na TV - Assédio organizacional e depressão no trabalho fb.me/1v6OACTWJ,2017
1524,📰 Notícias ao Minuto - Vítimas de assédio no trabalho passam a ser indemnizadas ✊ fb.me/2ZU82Jfxu,2017
1525,SINDJUSTIÇA lança campanha em combate ao assédio moral no trabalho https://reajaservidor.wordpress.com/?p=9628,2017
1526,AHAHAHAHAHAHAHAHAHAHA mas menino isso eh assedio sexual no ambiente de trabalho,2017
1527,Eu tambem sofro de assedio no meu trabalho e a FIFA nunca me ajudou em nada,2017
1528,Vítimas de assédio no trabalho vão ter de ser indemnizadas > TVI24 tvi24.iol.pt/sociedade/20-07…,2017
1529,Acusado de assédio no trabalho.!...170720 fb.me/1Br7SP81Q,2017
1530,Assédio sexual no trabalho é tema do Diálogo Brasil tvbrasil.ebc.com.br/dialogo-…,2017
1531,Curso de Especialização em #Saúde do Trabalhador debaterá o assédio moral no trabalho   #ENSP https://spdbcfmusp.wordpress.com/2017/07/20/curso-de-especializacao-em-saude-do-trabalhador-debatera-o-assedio-moral-no-trabalho/ via @bibliotecafmusp,2017
1532,[Podcast] Assédio moral no ambiente de trabalho é crime? ► https://goo.gl/PwjPZg #CBNribeirao,2017
1533,https://goo.gl/1XvmzZ  - Leia conteúdo da Cartilha de Assédio Moral no Ambiente de Trabalho. #cartilhasOABPiauí,2017
1534,Assédio sexual no trabalho é tema do Diálogo Brasil. goo.gl/e3ooc7,2017
1535,Curso de Especialização em Saúde do Trabalhador debaterá o assédio moral no trabalho ensp.fiocruz.br/portal-ensp/…,2017
1536,flamenguista reclamar de roubo é igual a prostituta reclamar de assédio sexual no seu horário de trabalho! pqp o... fb.me/3x7cnCqqp,2017
1537,Vítimas de assédio no local de trabalho passam a ser indemnizadas twib.in/l/Rn79Bjp56jbG #CM,2017
1538,"Falar sobre assédio no trabalho é um avanço do caralho, principalmente com dois advogados trabalhistas participando do debate.",2017
1539,Vítimas de assédio no local de trabalho passam a ser indemnizadas dlvr.it/PWw1zc,2017
1540,Vítimas de assédio no local de trabalho passam a ser indemnizadas tsf.pt/sociedade/interior/vi…,2017
1541,Vítimas de assédio no local de trabalho passam a ser indemnizadas publico.pt/1779738,2017
1542,Vítimas de assédio no local de trabalho passam a ser indemnizadas https://www.noticiasaominuto.com/n/834579 #paisaominuto,2017
